newspaper_id	time_str	original_title	n_original_body_lines	hash	time_ut	original_lang	url
economynextcom	2023-06-10 09:50:00	More formalised Samurdhi would see rise in bank accounts among Sri Lanka’s poor: study	5	e03a03a3	1686370800.0	en	https://economynext.com/more-formalised-samurdhi-would-see-rise-in-bank-accounts-among-sri-lankas-poor-study-123177/
dailymirrorlk	2023-06-10 07:45:46	Automated Border Control to be established at BIA	5	ea0b0f05	1686363346.0	en	https://www.dailymirror.lk/top_story/Automated-Border-Control-to-be-established-at-BIA/155-260840
dailymirrorlk	2023-06-10 01:17:47	Nihal Jayawardene appointed as HNB Chairman; he takes over after Chairperson Aruni Goonetilleke resigns	7	8a76018b	1686340067.0	en	https://www.dailymirror.lk/top_story/Nihal-Jayawardene-appointed-as-HNB-Chairman-he-takes-over-after-Chairperson-Aruni-Goonetilleke-resigns/155-260832
dbsjeyarajcom	2023-06-10 01:11:00	“Uduppiddy Singham” (Uduppiddy Lion) “Em”  Sivasithamparam  was a Champion of Tamils’ Rights.	26	9387e245	1686339660.0	en	https://dbsjeyaraj.com/dbsj/?p=82094
dbsjeyarajcom	2023-06-10 00:54:00	A Magisterial inquiry, a probe by the Parliamentary Privileges Committee and an investigation by the Human Rights Commission ) are currently underway into Incidents Concerning Jaffna MP Gajendrakumar Ponnambalam and Police Officials	20	1528d2a0	1686338640.0	en	https://dbsjeyaraj.com/dbsj/?p=82107
dailyftlk	2023-06-10 00:48:06	President instructs for expedition of Action Plan for Reconciliation	10	d4e3080e	1686338286.0	en	https://www.ft.lk/news/President-instructs-for-expedition-of-Action-Plan-for-Reconciliation/56-749356
dailyftlk	2023-06-10 00:47:32	Judiciary left disgruntled over two recent appointments to HC	7	767f7b54	1686338252.0	en	https://www.ft.lk/news/Judiciary-left-disgruntled-over-two-recent-appointments-to-HC/56-749355
dailyftlk	2023-06-10 00:47:16	President appoints Experts Committee to advice control of COVID-19 and Dengue	7	8df84af5	1686338236.0	en	https://www.ft.lk/news/President-appoints-Experts-Committee-to-advice-control-of-COVID-19-and-Dengue/56-749354
dailyftlk	2023-06-10 00:46:08	Swiss banks, taxes, energy policy and Chinese cafes	23	94b8df79	1686338168.0	en	https://www.ft.lk/columns/Swiss-banks-taxes-energy-policy-and-Chinese-cafes/4-749353
dbsjeyarajcom	2023-06-10 00:45:00	A tsunami of bad laws coming the nation’s way! Sri Lankans need to prepare ourselves for political attempts to turn legal and regulatory systems upside down, wreaking havoc on an already terribly weakened governance environment.	27	0b7cb1f3	1686338100.0	en	https://dbsjeyaraj.com/dbsj/?p=82105
dailyftlk	2023-06-10 00:12:15	Construction Power & Energy Expo 2023 unveils ultimate industry convergence	11	fc7945c1	1686336135.0	en	https://www.ft.lk/business/Construction-Power-Energy-Expo-2023-unveils-ultimate-industry-convergence/34-749343
dailyftlk	2023-06-10 00:12:05	Cafe 2023 opens at BMICH	1	4798ef07	1686336125.0	en	https://www.ft.lk/business/Cafe-2023-opens-at-BMICH/34-749342
dailyftlk	2023-06-10 00:10:49	Amritha Incense Sticks achieves historic milestone with SLS Certification, demonstrating commitment to quality and safety	6	b702e441	1686336049.0	en	https://www.ft.lk/business/Amritha-Incense-Sticks-achieves-historic-milestone-with-SLS-Certification-demonstrating-commitment-to-quality-and-safety/34-749341
dailymirrorlk	2023-06-10 00:10:25	We don’t need colonial powers meddling in Asia	18	1c79cbf8	1686336025.0	en	https://www.dailymirror.lk/opinion/We-dont-need-colonial-powers-meddling-in-Asia/172-260817
dailyftlk	2023-06-10 00:10:05	Seylan Bank partners National Industry Exhibition 2023 to empower Sri Lankan industries and SMEs	6	a34cb305	1686336005.0	en	https://www.ft.lk/business/Seylan-Bank-partners-National-Industry-Exhibition-2023-to-empower-Sri-Lankan-industries-and-SMEs/34-749340
dailyftlk	2023-06-10 00:09:21	Pelwatte Dairy partners Chef’s Guild to promote tourism	5	beb90a69	1686335961.0	en	https://www.ft.lk/business/Pelwatte-Dairy-partners-Chef-s-Guild-to-promote-tourism/34-749339
dailyftlk	2023-06-10 00:08:36	HNBA expands footprint; revamped Kandy and new Galewala branch now open to the public	4	af60886e	1686335916.0	en	https://www.ft.lk/business/HNBA-expands-footprint-revamped-Kandy-and-new-Galewala-branch-now-open-to-the-public/34-749338
dailyftlk	2023-06-10 00:07:56	Air Express Manpower wins 3-star Golden Award	3	ac19bdb2	1686335876.0	en	https://www.ft.lk/business/Air-Express-Manpower-wins-3-star-Golden-Award/34-749337
dailymirrorlk	2023-06-10 00:05:49	Who lost faith in elections?	17	1bd9de2c	1686335749.0	en	https://www.dailymirror.lk/opinion/Who-lost-faith-in-elections/172-260816
dailyftlk	2023-06-09 23:54:03	Feminist Collective for Economic Justice recommends progressive gender sensitive social protection response to crisis	18	b5c80cf3	1686335043.0	en	https://www.ft.lk/opinion/Feminist-Collective-for-Economic-Justice-recommends-progressive-gender-sensitive-social-protection-response-to-crisis/14-749325
dailyftlk	2023-06-09 23:51:09	Next steps in confronting Sinhala Buddhist nationalism	14	2749d73e	1686334869.0	en	https://www.ft.lk/columns/Next-steps-in-confronting-Sinhala-Buddhist-nationalism/4-749324
dailymirrorlk	2023-06-09 23:47:31	The Tamil Leader who refused to Kowtow before the Tigers	41	f7603856	1686334651.0	en	https://www.dailymirror.lk/opinion/The-Tamil-Leader-who-refused-to-Kowtow-before-the-Tigers/172-260815
islandlk	2023-06-09 21:25:00	Wrongs don’t cancel one another out	13	aa046e5d	1686326100.0	en	http://island.lk/wrongs-dont-cancel-one-another-out/
economynextcom	2023-06-09 20:49:00	Sri Lanka cabinet to take final decision on SLT sale with industry views	9	23af2c5a	1686323940.0	en	https://economynext.com/sri-lanka-cabinet-to-take-final-decision-on-slt-sale-with-industry-views-123170/
economynextcom	2023-06-09 17:34:00	Opposing Sri Lanka Telecom share sale on national security grounds baseless: expert	22	1d34847b	1686312240.0	en	https://economynext.com/opposing-sri-lanka-telecom-share-sale-on-national-security-grounds-baseless-expert-123151/
virakesarilk	2023-06-09 14:38:00	செயற்கை அழிவுக்கு கொடூரமாக விலையாகும் மக்கள்	2	840fb7c5	1686301680.0	ta	https://www.virakesari.lk/article/157350
economynextcom	2023-06-09 13:39:00	Sri Lanka Telecom share sale opposed on ‘national security’ grounds	12	96918be3	1686298140.0	en	https://economynext.com/sri-lanka-telecom-share-sale-opposed-on-national-security-grounds-123105/
economynextcom	2023-06-09 13:29:00	SLT shares down after privatization statement	6	7fecb358	1686297540.0	en	https://economynext.com/slt-shares-down-after-privatization-statement-123117/
bbccomsinhala	2023-06-09 12:12:29	නාකොටික් අත්අඩංගුවේ දී මියගිය සමන්ත ප්‍රීති කුමාර: 'මගේ මහත්තයා රජයේ සේවකයෙක්. එයා කුඩුකාරයෙක් නෙවෙයි'	32	2dd9a865	1686292949.0	si	https://www.bbc.com/sinhala/articles/crg7xnejpngo
economynextcom	2023-06-09 12:00:00	Sri Lanka’s Colombo Port capacity will rise to 15mn boxes in 3 years: Minister	8	50e7a731	1686292200.0	en	https://economynext.com/sri-lankas-colombo-port-capacity-will-rise-to-15mn-boxes-in-3-years-minister-123102/
dailymirrorlk	2023-06-09 11:03:58	Parliamentary committee recommends not to privatise SLT	5	ebc0db3f	1686288838.0	en	https://www.dailymirror.lk/top_story/Parliamentary-committee-recommends-not-to-privatise-SLT/155-260776
bbccomsinhala	2023-06-09 10:36:21	විද්‍යුත් විකාශන නියාමන කොමිෂන් සභා පනත: මාධ්‍යයේ කටට වැට බැඳෙයි ද?	65	61744c4c	1686287181.0	si	https://www.bbc.com/sinhala/articles/clwdjzwgyv3o
dailymirrorlk	2023-06-09 06:47:29	Value of a perch in Galle Fort increased to Rs. 22mn	6	aef25735	1686273449.0	en	https://www.dailymirror.lk/top_story/Value-of-a-perch-in-Galle-Fort-increased-to-Rs-22mn/155-260752
economynextcom	2023-06-09 06:21:00	Sri Lanka facing unknown claims over halted airport terminal, Rs15bn in bills	13	ef600ae3	1686271860.0	en	https://economynext.com/sri-lanka-facing-unknown-claims-over-halted-airport-terminal-rs15bn-in-bills-123058/
dailyftlk	2023-06-09 03:40:20	NPP defies court order to hold protest demanding for LG polls	7	0a8bdd02	1686262220.0	en	https://www.ft.lk/news/NPP-defies-court-order-to-hold-protest-demanding-for-LG-polls/56-749311
dailyftlk	2023-06-09 03:37:23	Cardinal calls for ousting of unsuitable leaders	10	5dfae3c6	1686262043.0	en	https://www.ft.lk/news/Cardinal-calls-for-ousting-of-unsuitable-leaders/56-749310
dailyftlk	2023-06-09 03:34:46	Opposition leader says enacting media regulations not up to Govt. or politicians	14	7d3066ce	1686261886.0	en	https://www.ft.lk/news/Opposition-leader-says-enacting-media-regulations-not-up-to-Govt-or-politicians/56-749309
dailyftlk	2023-06-09 03:29:50	MTI finalises inflation study for Pakistan; takes positive learnings from Sri Lanka	9	e000dda6	1686261590.0	en	https://www.ft.lk/business/MTI-finalises-inflation-study-for-Pakistan-takes-positive-learnings-from-Sri-Lanka/34-749308
dailyftlk	2023-06-09 03:23:10	Registration for SPARK: Youth Entrepreneurship Competition closes on 23 June	5	74cb5434	1686261190.0	en	https://www.ft.lk/business/Registration-for-SPARK-Youth-Entrepreneurship-Competition-closes-on-23-June/34-749307
dailyftlk	2023-06-09 03:21:21	Mandarina Colombo signs as hospitality partner for South Asian Travel Awards 2023	6	b57a2ff6	1686261081.0	en	https://www.ft.lk/business/Mandarina-Colombo-signs-as-hospitality-partner-for-South-Asian-Travel-Awards-2023/34-749306
dailyftlk	2023-06-09 03:19:20	Sri Lanka – Maldives Joint Commission 4th session concludes successfully in Colombo	5	5524eacc	1686260960.0	en	https://www.ft.lk/business/Sri-Lanka-Maldives-Joint-Commission-4th-session-concludes-successfully-in-Colombo/34-749305
dailyftlk	2023-06-09 02:34:18	Hemas inspiring insights to overcome economic and market challenges	32	c2bff54e	1686258258.0	en	https://www.ft.lk/business/Hemas-inspiring-insights-to-overcome-economic-and-market-challenges/34-749293
dailyftlk	2023-06-09 02:18:09	Extremism is not welcome in religion – Yvonne Ridley	52	5657f656	1686257289.0	en	https://www.ft.lk/opinion/Extremism-is-not-welcome-in-religion-Yvonne-Ridley/14-749292
dailyftlk	2023-06-09 02:12:31	‘‘Undemocratic measures pursued by President continue to undermine rule of law’’	13	88dfeb0e	1686256951.0	en	https://www.ft.lk/opinion/Undemocratic-measures-pursued-by-President-continue-to-undermine-rule-of-law/14-749291
dailyftlk	2023-06-09 01:55:19	New political parties that focus on values	24	fa6e70ea	1686255919.0	en	https://www.ft.lk/columns/New-political-parties-that-focus-on-values/4-749288
dailyftlk	2023-06-09 01:42:52	Politics behind a politician’s gold	14	04d0f582	1686255172.0	en	https://www.ft.lk/columns/Politics-behind-a-politician-s-gold/4-749287
dbsjeyarajcom	2023-06-09 00:45:00	The New Trend of Buddhist monks  bulldozing their way into lands  in the North and East claiming they were historically places of Buddhist worship is unacceptable.	13	8b00aca5	1686251700.0	en	https://dbsjeyaraj.com/dbsj/?p=82102
islandlk	2023-06-08 22:15:00	Arrests and duplicity	12	8a868c48	1686242700.0	en	http://island.lk/arrests-and-duplicity/
dailymirrorlk	2023-06-08 21:51:11	A good president needs to be challenged by evil! - EDITORIAL	8	d544558b	1686241271.0	en	https://www.dailymirror.lk/opinion/A-good-president-needs-to-be-challenged-by-evil-EDITORIAL/172-260733
dailymirrorlk	2023-06-08 21:46:27	Ukraine Dam disaster:  Another opportunity for peace	18	d8564eb5	1686240987.0	en	https://www.dailymirror.lk/opinion/Ukraine-Dam-disaster-Another-opportunity-for-peace/172-260732
colombotelegraphcom	2023-06-08 17:16:16	Political Buddhism In Sri Lanka	26	16590393	1686224776.0	en	https://www.colombotelegraph.com/index.php/political-buddhism-in-sri-lanka/
economynextcom	2023-06-08 17:08:00	Sri Lanka gets ADB nod for concessional loans	9	7a151c8d	1686224280.0	en	https://economynext.com/sri-lanka-gets-adb-nod-for-concessional-loans-123014/
economynextcom	2023-06-08 15:58:00	Sri Lanka trade unions threaten to resume strikes if tax issue not resolved	10	2d69d4a0	1686220080.0	en	https://economynext.com/sri-lanka-trade-unions-threaten-to-resume-strikes-if-tax-issue-not-resolved-123010/
economynextcom	2023-06-08 15:40:00	Sri Lankans who open tax files won’t be questioned on old income: Minister	7	26f6ab44	1686219000.0	en	https://economynext.com/sri-lankans-who-open-tax-files-wont-be-questioned-on-old-income-minister-123005/
bbccomsinhala	2023-06-08 13:26:56	ලෝක සාගර දිනය: මහ මුහුදේ ශෝකාන්තය කිමිදුම්කරුවෙකුගේ ඇසින් දකිමුද?	25	e427cb46	1686211016.0	si	https://www.bbc.com/sinhala/articles/c72mzqnlzrjo
economynextcom	2023-06-08 07:46:00	Sri Lanka’s poor surge by 4 million to 31-pct of population: Survey	28	fcdef988	1686190560.0	en	https://economynext.com/sri-lankas-poor-surge-by-4-million-to-31-pct-of-population-survey-122930/
dailymirrorlk	2023-06-08 06:21:05	GR gets new luxury state bungalow in Colombo 07	7	e9bf1601	1686185465.0	en	https://www.dailymirror.lk/top_story/GR-gets-new-luxury-state-bungalow-in-Colombo-07/155-260664
dailyftlk	2023-06-08 05:52:56	Ranil’s Nuwara Eliya doctrine and the Ostrich Opposition	49	12c54ec0	1686183776.0	en	https://www.ft.lk/columns/Ranil-s-Nuwara-Eliya-doctrine-and-the-Ostrich-Opposition/4-749250
dailyftlk	2023-06-08 05:43:43	Amendments to labour legislation: Please Mr. Minister, priorities first	8	5f484219	1686183223.0	en	https://www.ft.lk/columns/Amendments-to-labour-legislation-Please-Mr-Minister-priorities-first/4-749249
dailyftlk	2023-06-08 05:39:36	World Bank says global economy on precarious footing amid high interest rates	11	9d46ad6b	1686182976.0	en	https://www.ft.lk/opinion/World-Bank-says-global-economy-on-precarious-footing-amid-high-interest-rates/14-749248
dailyftlk	2023-06-08 05:37:11	Institute of Analytics UK launches operations in Sri Lanka	10	594cd493	1686182831.0	en	https://www.ft.lk/business/Institute-of-Analytics-UK-launches-operations-in-Sri-Lanka/34-749246
dailyftlk	2023-06-08 05:35:55	eArrow to digitise DIMO’s vocational training arm	11	4bd5791b	1686182755.0	en	https://www.ft.lk/business/eArrow-to-digitise-DIMO-s-vocational-training-arm/34-749245
dailyftlk	2023-06-08 05:33:07	Only 40% poor among 1.7 million Samurdhi beneficiaries: LIRNEasia	14	aca22a61	1686182587.0	en	https://www.ft.lk/news/Only-40-poor-among-1-7-million-Samurdhi-beneficiaries-LIRNEasia/56-749244
dailyftlk	2023-06-08 05:31:24	China hosts appreciation reception for Sri Lanka’s rescue mission of capsized fishing ship Lu Peng Yuan Yu 028	12	d94c0309	1686182484.0	en	https://www.ft.lk/news/China-hosts-appreciation-reception-for-Sri-Lanka-s-rescue-mission-of-capsized-fishing-ship-Lu-Peng-Yuan-Yu-028/56-749243
dailyftlk	2023-06-08 05:25:12	Industries Minister to take necessary steps with banks to speed up credit facilities for SMEs	7	bbc18cd2	1686182112.0	en	https://www.ft.lk/news/Industries-Minister-to-take-necessary-steps-with-banks-to-speed-up-credit-facilities-for-SMEs/56-749242
dailyftlk	2023-06-08 05:19:46	Manusha assures to make public summary of proposals for new labour law	4	3fa810d3	1686181786.0	en	https://www.ft.lk/business/Manusha-assures-to-make-public-summary-of-proposals-for-new-labour-law/34-749241
dailyftlk	2023-06-08 05:18:33	US Treasury official holds high level meetings in SL	5	57ae01af	1686181713.0	en	https://www.ft.lk/business/US-Treasury-official-holds-high-level-meetings-in-SL/34-749240
dailyftlk	2023-06-08 05:16:57	President holds crucial meeting with Intl. Federation of Red Cross, Red Crescent officials	7	f3199ed9	1686181617.0	en	https://www.ft.lk/news/President-holds-crucial-meeting-with-Intl-Federation-of-Red-Cross-Red-Crescent-officials/56-749239
dailyftlk	2023-06-08 05:15:56	CID to probe five activists for comments on Nathasha Edirisuriya arrest	10	fc030a72	1686181556.0	en	https://www.ft.lk/news/CID-to-probe-five-activists-for-comments-on-Nathasha-Edirisuriya-arrest/56-749238
dailyftlk	2023-06-08 05:14:41	GotaGoGama attack: Travel ban on Namal and others lifted	5	3afb94a8	1686181481.0	en	https://www.ft.lk/news/GotaGoGama-attack-Travel-ban-on-Namal-and-others-lifted/56-749237
dailyftlk	2023-06-08 05:13:43	Two new monkeypox cases detected	4	28bec107	1686181423.0	en	https://www.ft.lk/news/Two-new-monkeypox-cases-detected/56-749236
colombotelegraphcom	2023-06-08 00:09:13	In Memory Of Mr Shyamon Jayasinghe	14	e9679518	1686163153.0	en	https://www.colombotelegraph.com/index.php/in-memory-of-mr-shyamon-jayasinghe/
dailymirrorlk	2023-06-07 23:05:29	Restructuring domestic debt Must be credible, fast, comprehensive	13	04d990e5	1686159329.0	en	https://www.dailymirror.lk/opinion/Restructuring-domestic-debt-Must-be-credible-fast-comprehensive/172-260659
dailymirrorlk	2023-06-07 23:02:35	Humans share the earth; can protect it, not own it	12	d64ed4d2	1686159155.0	en	https://www.dailymirror.lk/opinion/Humans-share-the-earth-can-protect-it-not-own-it/172-260658
islandlk	2023-06-07 22:06:00	BAB irredeemably bad	10	4a05af62	1686155760.0	en	http://island.lk/bab-irredeemably-bad/
bbccomsinhala	2023-06-07 16:35:49	ගජේන්ද්‍රකුමාර් පොන්නම්බලම්:'මගේ පාර්ලිමේන්තු මන්ත්‍රී වැඩට බාධා වෙන විදියට පොලිසිය කිසිම දෙයක් කරන්න හොඳ නෑ කියලා නියෝග කළා'	22	967432a9	1686135949.0	si	https://www.bbc.com/sinhala/sri-lanka-65838700
dailymirrorlk	2023-06-07 13:26:29	Strengthening food safety in Sri Lanka: Empowering consumers for a safer future	29	c6874a86	1686124589.0	en	https://www.dailymirror.lk/plus/Strengthening-food-safety-in-Sri-Lanka-Empowering-consumers-for-a-safer-future/352-260638
dailymirrorlk	2023-06-07 13:06:21	Gota given new residence at Stanmore Crescent: MP Rasamanickam alleges	3	ce5f87d4	1686123381.0	en	https://www.dailymirror.lk/top_story/Gota-given-new-residence-at-Stanmore-Crescent-MP-Rasamanickam-alleges/155-260637
economynextcom	2023-06-07 10:20:00	Sri Lanka security sector takes 48-pct of salary bill, health 17-pct: report	6	0d42c768	1686113400.0	en	https://economynext.com/sri-lanka-security-sector-takes-48-pct-of-salary-bill-health-17-pct-report-122845/
dailymirrorlk	2023-06-07 06:57:39	Govt. to boost tax revenue by removing VAT exemptions	14	214e5e95	1686101259.0	en	https://www.dailymirror.lk/top_story/Govt-to-boost-tax-revenue-by-removing-VAT-exemptions/155-260603
dailymirrorlk	2023-06-07 06:32:40	Sex championships, martial law in Putin’s Russia, and fakes	23	bde5a1ae	1686099760.0	en	https://www.dailymirror.lk/opinion/Sex-championships-martial-law-in-Putins-Russia-and-fakes/172-260587
dailymirrorlk	2023-06-07 06:26:47	President’s speech-road map and milestones to be achieved - EDITORIAL	18	c6d5feac	1686099407.0	en	https://www.dailymirror.lk/opinion/Presidents-speech-road-map-and-milestones-to-be-achieved-EDITORIAL/172-260585
bbccomsinhala	2023-06-07 06:16:42	ලෝක ටෙස්ට් ක්‍රිකට් පිටියේ හොඳම ඉනිම කාගෙද?	35	edb52d95	1686098802.0	si	https://www.bbc.com/sinhala/articles/c6pl7y20pmgo
dailyftlk	2023-06-07 05:32:46	Sri Lanka calls for positive dialogue to develop security cooperation in Indian Ocean region	16	fcafe20b	1686096166.0	en	https://www.ft.lk/opinion/Sri-Lanka-calls-for-positive-dialogue-to-develop-security-cooperation-in-Indian-Ocean-region/14-749219
dailyftlk	2023-06-07 05:31:13	‘Uduppiddy Lion’ Sivasithamparam was a champion of Tamils’ rights	25	43dd881d	1686096073.0	en	https://www.ft.lk/columns/Uduppiddy-Lion-Sivasithamparam-was-a-champion-of-Tamils-rights/4-749218
dailyftlk	2023-06-07 05:23:11	Political monk: Disciple or destroyer?	26	0ad21f5f	1686095591.0	en	https://www.ft.lk/columns/Political-monk-Disciple-or-destroyer/4-749217
dailyftlk	2023-06-07 05:16:25	The Buddha’s covenant on critical thinking and free inquiry	38	72159d07	1686095185.0	en	https://www.ft.lk/columns/The-Buddha-s-covenant-on-critical-thinking-and-free-inquiry/4-749216
dailyftlk	2023-06-07 04:59:01	Ansell Lanka expands to new heights powered by Microsoft D365 cloud-based ERP solution	16	03082890	1686094141.0	en	https://www.ft.lk/business/Ansell-Lanka-expands-to-new-heights-powered-by-Microsoft-D365-cloud-based-ERP-solution/34-749210
dailyftlk	2023-06-07 04:57:26	Air China reinstates services between Colombo and Chengdu	9	b3c5c01a	1686094046.0	en	https://www.ft.lk/business/Air-China-reinstates-services-between-Colombo-and-Chengdu/34-749209
dailyftlk	2023-06-07 04:56:29	Govt. awards 2-year, $ 15.3 m UL repairing contract to Honeywell International	3	a549f7b1	1686093989.0	en	https://www.ft.lk/business/Govt-awards-2-year-15-3-m-UL-repairing-contract-to-Honeywell-International/34-749208
dailyftlk	2023-06-07 04:44:58	Israel’s 75th Independence Day celebrated in Sri Lanka	9	1234e2c5	1686093298.0	en	https://www.ft.lk/news/Israel-s-75th-Independence-Day-celebrated-in-Sri-Lanka/56-749201
dailyftlk	2023-06-07 04:43:09	On World LPG Day 2023 Litro reaffirms its commitment	10	eddd355c	1686093189.0	en	https://www.ft.lk/news/On-World-LPG-Day-2023-Litro-reaffirms-its-commitment/56-749200
dailyftlk	2023-06-07 04:40:46	Future decisions can only be made based on data and statistics: State Minister of Finance	6	5c8ac59a	1686093046.0	en	https://www.ft.lk/news/Future-decisions-can-only-be-made-based-on-data-and-statistics-State-Minister-of-Finance/56-749199
dailyftlk	2023-06-07 04:39:10	Speaker of the Parliament of Sri Lanka concludes visit to Ankara	4	8c949ec9	1686092950.0	en	https://www.ft.lk/news/Speaker-of-the-Parliament-of-Sri-Lanka-concludesvisit-to-Ankara/56-749198
dbsjeyarajcom	2023-06-07 03:33:00	“Kalaignar” (Artiste) Karunanidhi; From  Tamil Film Script Writer to Tamil Nadu Chief Minister.	42	be14734c	1686088980.0	en	https://dbsjeyaraj.com/dbsj/?p=82062
dbsjeyarajcom	2023-06-07 00:54:00	Trying to unleash another round of religious bloodletting over a few inapt words is not just un-Buddhist; it is the very antithesis of what the Buddha taught.	31	320b442c	1686079440.0	en	https://dbsjeyaraj.com/dbsj/?p=82083
dbsjeyarajcom	2023-06-07 00:27:00	“Justice for All” alarmed by the undemocratic measures pursued by President Wickremasinghe and his Govt that continue to undermine the rule of law, fundamental rights and democracy in Sri Lanka.	25	71b3fa1a	1686077820.0	en	https://dbsjeyaraj.com/dbsj/?p=82091
dbsjeyarajcom	2023-06-07 00:18:00	Jaffna District MP Gajendrakumar Ponnambalam  who was Arrested in Colombo by Maruthankerni and Jeyapuram Police Is Released After being  Granted Rs 500,000 Surety Bail by Kilinochchi Magistrates Court	4	a388a0fd	1686077280.0	en	https://dbsjeyaraj.com/dbsj/?p=82089
islandlk	2023-06-06 22:23:00	An indictment of SLPP leaders	7	2dc92391	1686070380.0	en	http://island.lk/an-indictment-of-slpp-leaders/
economynextcom	2023-06-06 12:13:00	Sri Lanka aims for 1.2-pct GDP revenue gain from scrapping VAT exemptions	6	927494f6	1686033780.0	en	https://economynext.com/sri-lanka-aims-for-1-2-pct-gdp-revenue-gain-from-scrapping-vat-exemptions-122759/
dailymirrorlk	2023-06-06 06:21:45	Fixed range for fuel price as Sinopec enters	7	0e56dea5	1686012705.0	en	https://www.dailymirror.lk/top_story/Fixed-range-for-fuel-price-as-Sinopec-enters/155-260521
colombotelegraphcom	2023-06-06 05:54:22	A Colossal Fall Of A Colossus	5	cb910192	1686011062.0	en	https://www.colombotelegraph.com/index.php/a-colossal-fall-of-a-colossus/
bbccomsinhala	2023-06-06 05:22:03	පුංචි දෙනෙත්ගේ නිවසට මාලිංගගෙන් ඇමතුමක්	25	38c5b046	1686009123.0	si	https://www.bbc.com/sinhala/articles/c9rnq4z931po
bbccomsinhala	2023-06-06 02:14:02	අජිත් තිලකසේනගේ අක්ෂර භාවිතාව සහ නූතන සිංහල පාඨකයින්ගේ 'මුද්‍රණ දෝෂ'	36	197e5790	1685997842.0	si	https://www.bbc.com/sinhala/articles/cll0j4n7385o
dbsjeyarajcom	2023-06-06 01:11:00	Tamil Congress Jaffna District MP Gajendrakumar Ponnambalam Arrested On June 7th Morning at his Colombo Residence;Will be taken to Maruthankerni Police Station In Jaffna Peninsula for a Statement to be Recorded Regarding Earlier  Incident of Friction With Police	18	da9a99c8	1685994060.0	en	https://dbsjeyaraj.com/dbsj/?p=82085
dailymirrorlk	2023-06-06 01:09:47	Whims of politicians shouldn’t take over rule of law - EDITORIAL	8	14fb73d9	1685993987.0	en	https://www.dailymirror.lk/opinion/Whims-of-politicians-shouldnt-take-over-rule-of-law-EDITORIAL/172-260517
dailymirrorlk	2023-06-06 01:03:41	Sri Lankan economy not out of the woods yet  Five things that could make or break it	14	5535147d	1685993621.0	en	https://www.dailymirror.lk/opinion/Sri-Lankan-economy-not-out-of-the-woods-yet-Five-things-that-could-make-or-break-it/172-260516
dailyftlk	2023-06-06 00:29:14	Hate speech: Do not go down the path to suppression of media freedoms	6	2aad95ad	1685991554.0	en	https://www.ft.lk/opinion/Hate-speech-Do-not-go-down-the-path-to-suppression-of-media-freedoms/14-749157
dailyftlk	2023-06-06 00:27:51	What is Sinhala Buddhist nationalism and where is it headed?	20	9319f0d2	1685991471.0	en	https://www.ft.lk/columns/What-is-Sinhala-Buddhist-nationalism-and-where-is-it-headed/4-749156
