newspaper_id	time_str	original_title	n_original_body_lines	hash	time_ut	original_lang	url
lankadeepalk	2023-02-25 09:38:03	මයන්ත  මුදල් කමිටුව බාර ගැනීමෙන් සජබේ අර්බුදයක්	8	014bb98a	1677298083.0	si	https://www.lankadeepa.lk/news/මයන්ත--මුදල්-කමිටුව-බාර-ගැනීමෙන්-සජබේ-අර්බුදයක්/101-629267
lankadeepalk	2023-02-25 09:38:03	මයන්ත  මුදල් කමිටුව බාර ගැනීමෙන් සජබේ අර්බුදයක්	8	d9808c44	1677298083.0	si	https://www.lankadeepa.lk/latest_news/මයන්ත--මුදල්-කමිටුව-බාර-ගැනීමෙන්-සජබේ-අර්බුදයක්/1-629267
adaderanalk	2023-02-25 09:10:00	Special commodity levy on imported eggs slashed ahead of arrival of first cargo	6	87075875	1677296400.0	en	https://www.adaderana.lk/news/88651/special-commodity-levy-on-imported-eggs-slashed-ahead-of-arrival-of-first-cargo
economynextcom	2023-02-25 08:46:00	Sri Lanka’s NTB Bank net up 15-pct in  Dec quarter	8	4681dfcb	1677294960.0	en	https://economynext.com/sri-lankas-ntb-bank-net-up-15-pct-in-dec-quarter-113265/
tamilmirrorlk	2023-02-25 08:40:44	முட்டைக் கப்பல் இன்று வருகிறது	3	5e839182	1677294644.0	ta	https://www.tamilmirror.lk/செய்திகள்/முட்டைக்-கப்பல்-இன்று-வருகிறது/175-312998
adaderanalk	2023-02-25 08:29:00	Sri Lanka attends Int’l Mother Language Day celebrations 2023 at UNESCO	7	0779cd73	1677293940.0	en	https://www.adaderana.lk/news/88649/sri-lanka-attends-intl-mother-language-day-celebrations-2023-at-unesco
adaderanalk	2023-02-25 08:09:00	“This happened with full knowledge of President”: Harsha on COPF chairmanship controversy	11	8f30e6f7	1677292740.0	en	https://www.adaderana.lk/news/88648/this-happened-with-full-knowledge-of-president-harsha-on-copf-chairmanship-controversy
dailymirrorlk	2023-02-25 07:58:15	President has no right to express opinion on legality of LG polls: AKD	7	4c1597fd	1677292095.0	en	https://www.dailymirror.lk/breaking_news/President-has-no-right-to-express-opinion-on-legality-of-LG-polls-AKD/108-254825
lankadeepalk	2023-02-25 07:51:02	අස්වනු අඩුවට හේතුව ජ‘පුරෙන් සොයා ගනී	7	1fe14a16	1677291662.0	si	https://www.lankadeepa.lk/latest_news/අස්වනු-අඩුවට-හේතුව-ජ‘පුරෙන්-සොයා-ගනී/1-629266
lankadeepalk	2023-02-25 07:51:02	අස්වනු අඩුවට හේතුව ජ‘පුරෙන් සොයා ගනී	7	907b3364	1677291662.0	si	https://www.lankadeepa.lk/news/අස්වනු-අඩුවට-හේතුව-ජ‘පුරෙන්-සොයා-ගනී/101-629266
lankadeepalk	2023-02-25 07:47:58	වැසි දෙවියෝ අදත් බරටම වැඩ	4	a0d4e12c	1677291478.0	si	https://www.lankadeepa.lk/news/වැසි-දෙවියෝ-අදත්-බරටම-වැඩ/101-629265
lankadeepalk	2023-02-25 07:47:58	වැසි දෙවියෝ අදත් බරටම වැඩ	4	bed5e042	1677291478.0	si	https://www.lankadeepa.lk/latest_news/වැසි-දෙවියෝ-අදත්-බරටම-වැඩ/1-629265
lankadeepalk	2023-02-25 07:45:45	යාල බලන්න ගිය මැලේ ජාතිකයා අතුරුදහන්	4	23ac76f6	1677291345.0	si	https://www.lankadeepa.lk/news/යාල-බලන්න-ගිය-මැලේ-ජාතිකයා-අතුරුදහන්/101-629264
lankadeepalk	2023-02-25 07:45:45	යාල බලන්න ගිය මැලේ ජාතිකයා අතුරුදහන්	4	7c87d040	1677291345.0	si	https://www.lankadeepa.lk/latest_news/යාල-බලන්න-ගිය-මැලේ-ජාතිකයා-අතුරුදහන්/1-629264
lankadeepalk	2023-02-25 07:35:29	වෙරි වැඩි වී වෙද නළාව පැහැරගෙන	3	c59af703	1677290729.0	si	https://www.lankadeepa.lk/news/වෙරි-වැඩි-වී-වෙද-නළාව-පැහැරගෙන/101-629262
lankadeepalk	2023-02-25 07:35:29	වෙරි වැඩි වී වෙද නළාව පැහැරගෙන	3	e5ef6595	1677290729.0	si	https://www.lankadeepa.lk/latest_news/වෙරි-වැඩි-වී-වෙද-නළාව-පැහැරගෙන/1-629262
tamilmirrorlk	2023-02-25 07:30:42	வீட்டுக்குள் புகுந்த அரியவகை விலங்கு	3	8116fbc2	1677290442.0	ta	https://www.tamilmirror.lk/வன்னி/வீட்டுக்குள்-புகுந்த-அரியவகை-விலங்கு/72-312997
tamilmirrorlk	2023-02-25 07:19:03	ஜனாதிபதி தலைமையில் இன்று முக்கிய கலந்துரையாடல்	3	72290a2f	1677289743.0	ta	https://www.tamilmirror.lk/செய்திகள்/ஜனாதிபதி-தலைமையில்-இன்று-முக்கிய-கலந்துரையாடல்/175-312996
tamilmirrorlk	2023-02-25 07:07:28	இன்றைய வானிலை தொடர்பான அறிவிப்பு	2	0d4301e7	1677289048.0	ta	https://www.tamilmirror.lk/செய்திகள்/இன்றைய-வானிலை-தொடர்பான-அறிவிப்பு/175-312995
adaderanalk	2023-02-25 07:04:00	Four districts to receive fairly heavy rainfall above 50mm	7	2a32d88d	1677288840.0	en	https://www.adaderana.lk/news/88647/four-districts-to-receive-fairly-heavy-rainfall-above-50mm-
tamilmirrorlk	2023-02-25 06:51:30	மின் உற்பத்தி திட்டத்தை சமர்ப்பித்தார் காஞ்சன	3	de3bc5c2	1677288090.0	ta	https://www.tamilmirror.lk/செய்திகள்/மின்-உற்பத்தி-திட்டத்தை-சமர்ப்பித்தார்-காஞ்சன/175-312994
dailymirrorlk	2023-02-25 03:28:13	Govt. settles Rs.191bn worth of arrears to various contractors and suppliers	7	5554dd53	1677275893.0	en	https://www.dailymirror.lk/breaking_news/Govt-settles-Rs-191bn-worth-of-arrears-to-various-contractors-and-suppliers/108-254824
dailymirrorlk	2023-02-25 03:24:27	Land Value Indicator of Colombo district expands by 14.8% in 2H22	8	f5d9c4cd	1677275667.0	en	https://www.dailymirror.lk/breaking_news/Land-Value-Indicator-of-Colombo-district-expands-by-14-8-in-2H22/108-254821
dailymirrorlk	2023-02-25 03:20:15	SL to be transformed into a year-round tourism destination	7	9b65a2ef	1677275415.0	en	https://www.dailymirror.lk/breaking_news/SL-to-be-transformed-into-a-year-round-tourism-destination/108-254817
dailymirrorlk	2023-02-25 03:13:48	A new conversation on love	18	007dfcc0	1677275028.0	en	https://www.dailymirror.lk/opinion/A-new-conversation-on-love/172-254816
dailymirrorlk	2023-02-25 03:10:46	Ukraine, Palestine and double standards	7	a623c832	1677274846.0	en	https://www.dailymirror.lk/opinion/Ukraine-Palestine-and-double-standards/172-254815
dailymirrorlk	2023-02-25 03:08:03	If all who were involved in bribery were deprived of Civic Rights…?	28	9cb2a627	1677274683.0	en	https://www.dailymirror.lk/opinion/If-all-who-were-involved-in-bribery-were-deprived-of-Civic-Rights/172-254814
dailymirrorlk	2023-02-25 03:04:23	deep concern over situation  in  the country	12	c5f91e43	1677274463.0	en	https://www.dailymirror.lk/opinion/deep-concern-over-situation-in-the-country/172-254813
dailyftlk	2023-02-24 23:38:14	Mujibur questions President’s state of mind over comments made on LG polls	7	26cd6e9a	1677262094.0	en	https://www.ft.lk/news/Mujibur-questions-President-s-state-of-mind-over-comments-made-on-LG-polls/56-745714
dailyftlk	2023-02-24 23:37:09	Bohra community calls on Prime Minister	1	7efd2e57	1677262029.0	en	https://www.ft.lk/news/Bohra-community-calls-on-Prime-Minister/56-745713
dailyftlk	2023-02-24 23:25:11	President pledges to make SL a year-round tourist destination	10	8d772dc2	1677261311.0	en	https://www.ft.lk/business/President-pledges-to-make-SL-a-year-round-tourist-destination/34-745712
dailyftlk	2023-02-24 23:22:29	SLT-Mobitel powered ‘SLIoT Challenge 2022’ and ‘Robo Games 2022’ to announce winners in March	9	138fb889	1677261149.0	en	https://www.ft.lk/business/SLT-Mobitel-powered-SLIoT-Challenge-2022-and-Robo-Games-2022-to-announce-winners-in-March/34-745711
dailyftlk	2023-02-24 23:21:50	Power and Energy Minister update development agencies on revamping CEB	6	87bab53e	1677261110.0	en	https://www.ft.lk/business/Power-and-Energy-Minister-update-development-agencies-on-revamping-CEB/34-745710
dailyftlk	2023-02-24 23:19:44	Dialog Home Broadband launches Sri Lanka’s most affordable prepaid home broadband data plans	3	3edfaacb	1677260984.0	en	https://www.ft.lk/business/Dialog-Home-Broadband-launches-Sri-Lanka-s-most-affordable-prepaid-home-broadband-data-plans/34-745709
dailyftlk	2023-02-24 23:02:05	Systems change: A scientific approach – Part 1	49	17e29e3d	1677259925.0	en	https://www.ft.lk/columns/Systems-change-A-scientific-approach-Part-1/4-745702
dailyftlk	2023-02-24 22:55:36	Sri Lanka has great potential, says Korean Deputy Foreign Minister Lee Sang-Hwa	14	899778e5	1677259536.0	en	https://www.ft.lk/news/Sri-Lanka-has-great-potential-says-Korean-Deputy-Foreign-Minister-Lee-Sang-Hwa/56-745701
dailyftlk	2023-02-24 22:54:09	Our country needs more people like General Paranagama: Prof. Mohan Munasighe	38	1903bab7	1677259449.0	en	https://www.ft.lk/news/Our-country-needs-more-people-like-General-Paranagama-Prof-Mohan-Munasighe/56-745700
dailyftlk	2023-02-24 22:39:26	Technical education and vocational training for a just energy transition	12	8d6e7623	1677258566.0	en	https://www.ft.lk/columns/Technical-education-and-vocational-training-for-a-just-energy-transition/4-745691
adaderanalk	2023-02-24 22:28:00	Sri Lankan-born Prof. Antony Anghie honoured for stellar contributions to international law	13	60c28d97	1677257880.0	en	https://www.adaderana.lk/news/88645/sri-lankan-born-prof-antony-anghie-honoured-for-stellar-contributions-to-international-law
dailymirrorlk	2023-02-24 22:25:15	Indian geologists forecast earthquake: If an earthquake occurs in India, we too will feel its impact: Prof. Athula Senaratne	3	89a34db4	1677257715.0	en	https://www.dailymirror.lk/breaking_news/Indian-geologists-forecast-earthquake-If-an-earthquake-occurs-in-India-we-too-will-feel-its-impact-Prof-Athula-Senaratne/108-254800
lankadeepalk	2023-02-24 21:49:45	පිරිවෙන් සමුළුව - බබලයි ලක් මව	3	11e0426b	1677255585.0	si	https://www.lankadeepa.lk/latest_news/පිරිවෙන්-සමුළුව---බබලයි-ලක්-මව/1-629261
lankadeepalk	2023-02-24 21:49:45	පිරිවෙන් සමුළුව - බබලයි ලක් මව	3	c7f14c4e	1677255585.0	si	https://www.lankadeepa.lk/news/පිරිවෙන්-සමුළුව---බබලයි-ලක්-මව/101-629261
lankadeepalk	2023-02-24 21:39:07	එජාපය අලුත් මන්ත්‍රීන් පත් කිරීම කඩිනම් කරයි	3	25874484	1677254947.0	si	https://www.lankadeepa.lk/latest_news/එජාපය-අලුත්-මන්ත්‍රීන්-පත්-කිරීම-කඩිනම්-කරයි/1-629260
lankadeepalk	2023-02-24 21:39:07	එජාපය අලුත් මන්ත්‍රීන් පත් කිරීම කඩිනම් කරයි	3	7aa39e3c	1677254947.0	si	https://www.lankadeepa.lk/news/එජාපය-අලුත්-මන්ත්‍රීන්-පත්-කිරීම-කඩිනම්-කරයි/101-629260
adaderanalk	2023-02-24 21:22:00	U.S. and China to hold deputy-level bilateral talks on debt	6	5155cd18	1677253920.0	en	https://www.adaderana.lk/news/88644/us-and-china-to-hold-deputy-level-bilateral-talks-on-debt
dailymirrorlk	2023-02-24 21:15:24	Soldier shoots himself at Panagoda Army Camp	3	010a8b6d	1677253524.0	en	https://www.dailymirror.lk/breaking_news/Soldier-shoots-himself-at-Panagoda-Army-Camp/108-254791
economynextcom	2023-02-24 20:35:00	Sri Lanka’s Colombo District property up 14.8-pct in 2H 2022	6	a8f7d253	1677251100.0	en	https://economynext.com/sri-lankas-colombo-district-property-up-14-8-pct-in-2h-2022-113254/
adaderanalk	2023-02-24 20:31:00	Soldier at Panagoda army camp takes his own life	6	2b007052	1677250860.0	en	https://www.adaderana.lk/news/88643/soldier-at-panagoda-army-camp-takes-his-own-life
economynextcom	2023-02-24 20:30:00	Sri Lanka stocks gain to two-month high on positive sentiments fueled by bank profits	15	34e71347	1677250800.0	en	https://economynext.com/sri-lanka-stocks-gain-to-two-month-high-on-positive-sentiments-fueled-by-bank-profits-113252/
lankadeepalk	2023-02-24 19:54:07	ජනාධිපති ප්‍රජාතන්ත්‍රවාදය-ඡන්ද අයිතිය හාස්‍යයට ලක්කළා	3	1de89445	1677248647.0	si	https://www.lankadeepa.lk/news/ජනාධිපති-ප්‍රජාතන්ත්‍රවාදය-ඡන්ද-අයිතිය-හාස්‍යයට-ලක්කළා/101-629258
lankadeepalk	2023-02-24 19:54:07	ජනාධිපති ප්‍රජාතන්ත්‍රවාදය-ඡන්ද අයිතිය හාස්‍යයට ලක්කළා	3	af8fe37d	1677248647.0	si	https://www.lankadeepa.lk/latest_news/ජනාධිපති-ප්‍රජාතන්ත්‍රවාදය-ඡන්ද-අයිතිය-හාස්‍යයට-ලක්කළා/1-629258
lankadeepalk	2023-02-24 18:52:36	ෆවුසිට ඇප	8	37acdc7f	1677244956.0	si	https://www.lankadeepa.lk/latest_news/ෆවුසිට-ඇප/1-629257
lankadeepalk	2023-02-24 18:52:36	ෆවුසිට ඇප	8	df460a50	1677244956.0	si	https://www.lankadeepa.lk/news/ෆවුසිට-ඇප/101-629257
dailymirrorlk	2023-02-24 18:08:45	FR filed by 10 individuals during a protest at Parliament: SC refuses to grant leave to proceed	2	5aaf46fb	1677242325.0	en	https://www.dailymirror.lk/breaking_news/FR-filed-by-10-individuals-during-a-protest-at-Parliament-SC-refuses-to-grant-leave-to-proceed/108-254789
economynextcom	2023-02-24 17:59:00	Sri Lanka local government polls put off after cash squeeze	6	3fe3f39d	1677241740.0	en	https://economynext.com/sri-lanka-local-government-polls-put-off-after-cash-squeeze-113231/
economynextcom	2023-02-24 17:35:00	Sri Lanka bond yields steady at close	6	afa8176a	1677240300.0	en	https://economynext.com/sri-lanka-bond-yields-steady-at-close-113239/
virakesarilk	2023-02-24 17:33:00	பணச்சலவைக்கு எதிரான அமைப்பிலிருந்து ரஷ்யா இடைநிறுத்தம்	6	a98b28d8	1677240180.0	ta	https://www.virakesari.lk/article/149087
lankadeepalk	2023-02-24 16:50:56	සිසු විරෝධයට ආ ගුරුන් ගැන පරීක්ෂණයක්	3	63111ad7	1677237656.0	si	https://www.lankadeepa.lk/news/සිසු-විරෝධයට-ආ-ගුරුන්-ගැන-පරීක්ෂණයක්/101-629253
lankadeepalk	2023-02-24 16:50:56	සිසු විරෝධයට ආ ගුරුන් ගැන පරීක්ෂණයක්	3	999d8c3b	1677237656.0	si	https://www.lankadeepa.lk/latest_news/සිසු-විරෝධයට-ආ-ගුරුන්-ගැන-පරීක්ෂණයක්/1-629253
dailymirrorlk	2023-02-24 16:22:54	Architect 2023 exhibition at BMICH	1	1b602aab	1677235974.0	en	https://www.dailymirror.lk/caption_story/Architect-2023-exhibition-at-BMICH/110-254787
lankadeepalk	2023-02-24 16:12:51	විනිසුරුවරුන්ගෙන් බදු අය කිරීමේ වළකන අතුරු නියෝගය දිගු කරයි	5	707d192c	1677235371.0	si	https://www.lankadeepa.lk/latest_news/විනිසුරුවරුන්ගෙන්-බදු-අය-කිරීමේ-වළකන-අතුරු-නියෝගය-දිගු-කරයි/1-629247
lankadeepalk	2023-02-24 16:12:51	විනිසුරුවරුන්ගෙන් බදු අය කිරීමේ වළකන අතුරු නියෝගය දිගු කරයි	5	bf685a18	1677235371.0	si	https://www.lankadeepa.lk/news/විනිසුරුවරුන්ගෙන්-බදු-අය-කිරීමේ-වළකන-අතුරු-නියෝගය-දිගු-කරයි/101-629247
dailymirrorlk	2023-02-24 16:03:49	Interim Order preventing collecting Personal Income Tax from judges further extended	5	c7e12b06	1677234829.0	en	https://www.dailymirror.lk/breaking_news/Interim-Order-preventing-collecting-Personal-Income-Tax-from-judges-further-extended/108-254786
virakesarilk	2023-02-24 16:03:00	சிஐஏயின் இயக்குநருக்கு நேபாளம் அனுமதி மறுத்தது ஏன்?	15	ca5fc51f	1677234780.0	ta	https://www.virakesari.lk/article/149077
dailymirrorlk	2023-02-24 15:39:06	LG Polls will not be held on March 9 - Elections Commission	4	e4f4991c	1677233346.0	en	https://www.dailymirror.lk/top_story/LG-Polls-will-not-be-held-on-March-9-Elections-Commission/155-254785
dailymirrorlk	2023-02-24 15:33:16	UN Human Rights Committee to review Sri Lanka	3	8701b1c8	1677232996.0	en	https://www.dailymirror.lk/breaking_news/UN-Human-Rights-Committee-to-review-Sri-Lanka/108-254784
lankadeepalk	2023-02-24 15:30:05	ඉසුරුපාය ඉදිරිපිට විරෝධතාවක්	2	401a6ac2	1677232805.0	si	https://www.lankadeepa.lk/news/ඉසුරුපාය-ඉදිරිපිට-විරෝධතාවක්/101-629246
lankadeepalk	2023-02-24 15:30:05	ඉසුරුපාය ඉදිරිපිට විරෝධතාවක්	2	53435e55	1677232805.0	si	https://www.lankadeepa.lk/latest_news/ඉසුරුපාය-ඉදිරිපිට-විරෝධතාවක්/1-629246
economynextcom	2023-02-24 15:27:00	Sri Lanka seeks development agency backing for CEB reforms	9	086b2e3e	1677232620.0	en	https://economynext.com/sri-lanka-seeks-development-agency-backing-for-ceb-reforms-113227/
virakesarilk	2023-02-24 15:24:00	சீனாவிற்கு எதிரான பெரும் நடவடிக்கைகளிற்காகவா சிஐஏயின் தலைவர்  இலங்கைக்கு விஜயம் மேற்கொண்டார் ? ஸ்ரீலங்கா கார்டியன்	12	2754fa23	1677232440.0	ta	https://www.virakesari.lk/article/149071
dailymirrorlk	2023-02-24 15:21:42	Failure to prevent violence after May 9: Wasantha Karannagoda report tabled in Court	8	c11630c1	1677232302.0	en	https://www.dailymirror.lk/breaking_news/Failure-to-prevent-violence-after-May-9-Wasantha-Karannagoda-report-tabled-in-Court/108-254783
dailymirrorlk	2023-02-24 15:13:18	President talks as if he has gone insane: Sajith	3	d329d2d5	1677231798.0	en	https://www.dailymirror.lk/breaking_news/President-talks-as-if-he-has-gone-insane-Sajith/108-254782
lankadeepalk	2023-02-24 15:04:41	සජබෙන් පොලිස්පතිට පැමිණිල්ලක්	4	257ba07c	1677231281.0	si	https://www.lankadeepa.lk/latest_news/සජබෙන්-පොලිස්පතිට-පැමිණිල්ලක්/1-629245
lankadeepalk	2023-02-24 15:04:41	සජබෙන් පොලිස්පතිට පැමිණිල්ලක්	4	3f64a594	1677231281.0	si	https://www.lankadeepa.lk/news/සජබෙන්-පොලිස්පතිට-පැමිණිල්ලක්/101-629245
lankadeepalk	2023-02-24 14:54:21	‘‘තේ සන්නාමය ලංකාවේ දලූ නෙලන ජනතාව තවමත් ලැයිමේ‘‘	16	8bd272da	1677230661.0	si	https://www.lankadeepa.lk/politics/‘‘තේ-සන්නාමය-ලංකාවේ-දලූ-නෙලන-ජනතාව-තවමත්-ලැයිමේ‘‘/13-629244
lankadeepalk	2023-02-24 14:54:21	‘‘තේ සන්නාමය ලංකාවේ දලූ නෙලන ජනතාව තවමත් ලැයිමේ‘‘	16	c8ecd056	1677230661.0	si	https://www.lankadeepa.lk/news/‘‘තේ-සන්නාමය-ලංකාවේ-දලූ-නෙලන-ජනතාව-තවමත්-ලැයිමේ‘‘/101-629244
lankadeepalk	2023-02-24 14:40:03	රට බංකොලොත්: ජනපති නන් දොඩවනවා	13	5131e4c2	1677229803.0	si	https://www.lankadeepa.lk/news/රට-බංකොලොත්:-ජනපති-නන්-දොඩවනවා/101-629243
lankadeepalk	2023-02-24 14:40:03	රට බංකොලොත්: ජනපති නන් දොඩවනවා	13	ba8a9e9d	1677229803.0	si	https://www.lankadeepa.lk/politics/රට-බංකොලොත්:-ජනපති-නන්-දොඩවනවා/13-629243
dailymirrorlk	2023-02-24 14:38:30	Chinese EXIM Bank offers short, mid, long term measures	8	185397cd	1677229710.0	en	https://www.dailymirror.lk/breaking_news/Chinese-EXIM-Bank-offers-short-mid-long-term-measures/108-254781
dailymirrorlk	2023-02-24 14:31:04	Verbal battle continues in Parliament over COPF Chairmanship	9	a44dd3eb	1677229264.0	en	https://www.dailymirror.lk/breaking_news/Verbal-battle-continues-in-Parliament-over-COPF-Chairmanship/108-254780
tamilmirrorlk	2023-02-24 13:58:54	“தேர்தல் நிதியை நிறுத்த அரசாங்கத்துக்கு  தார்மீக உரிமை இல்லை”	9	b7ae3b85	1677227334.0	ta	https://www.tamilmirror.lk/செய்திகள்/தேர்தல்-நிதியை-நிறுத்த-அரசாங்கத்துக்கு-தார்மீக-உரிமை-இல்லை/175-312975
lankadeepalk	2023-02-24 13:54:47	පිළියන්දලත් පන්දම් විරෝධයක්	2	1c495f98	1677227087.0	si	https://www.lankadeepa.lk/latest_news/පිළියන්දලත්-පන්දම්-විරෝධයක්/1-629242
dailymirrorlk	2023-02-24 13:50:38	Scouts Foundation Day celebrated in Matale	1	31c0dc60	1677226838.0	en	https://www.dailymirror.lk/caption_story/Scouts-Foundation-Day-celebrated-in-Matale/110-254779
lankadeepalk	2023-02-24 13:43:13	පාසල් නිල ඇඳුම් බෙදා දීම අරඹයි	4	76cebdbd	1677226393.0	si	https://www.lankadeepa.lk/latest_news/පාසල්-නිල-ඇඳුම්-බෙදා-දීම-අරඹයි/1-629240
dailymirrorlk	2023-02-24 13:34:19	Withholding funds for LG polls will have far-reaching consequences: Church of Ceylon	6	17d02962	1677225859.0	en	https://www.dailymirror.lk/breaking_news/Withholding-funds-for-LG-polls-will-have-far-reaching-consequences-Church-of-Ceylon/108-254778
lankadeepalk	2023-02-24 13:30:01	වෙඩික්කරුවෙක් කොටහේනෙන් අල්ලයි	5	b407e75e	1677225601.0	si	https://www.lankadeepa.lk/latest_news/වෙඩික්කරුවෙක්-කොටහේනෙන්-අල්ලයි/1-629238
tamilmirrorlk	2023-02-24 13:27:42	நிலநடுக்கத்தால் இலங்கைக்கு பாதிப்பு ஏற்படும்	4	036616e5	1677225462.0	ta	https://www.tamilmirror.lk/செய்திகள்/நிலநடுக்கத்தால்-இலங்கைக்கு-பாதிப்பு-ஏற்படும்/175-312973
dailymirrorlk	2023-02-24 13:24:09	Sashi Weerawansa asked to take 3 days rest by Magistrate	6	2c19fc39	1677225249.0	en	https://www.dailymirror.lk/breaking_news/Sashi-Weerawansa-asked-to-take-3-days-rest-by-Magistrate/108-254777
tamilmirrorlk	2023-02-24 13:21:10	பொதுஜன பெரமுனவின் திடீர் தீர்மானம்	4	e3fc0dae	1677225070.0	ta	https://www.tamilmirror.lk/செய்திகள்/பொதுஜன-பெரமுனவின்-திடீர்-தீர்மானம்/175-312972
virakesarilk	2023-02-24 13:09:00	முறையற்ற பிளாஸ்டிக் அப்புறப்படுத்தலையும் சுற்றாடல் மாசுபாட்டினையும் தவிர்ப்போம்!	58	5b84df84	1677224340.0	ta	https://www.virakesari.lk/article/149058
economynextcom	2023-02-24 13:08:00	Sri Lanka’s ‘Royal’ mess explained by old boy: Namal Suvendra	12	01a080f6	1677224280.0	en	https://economynext.com/sri-lankas-royal-mess-explained-by-old-boy-namal-suvendra-113221/
tamilmirrorlk	2023-02-24 13:01:24	நுவரெலியாவில் முட்டைக்கு தட்டுப்பாடு	4	a8eee9e4	1677223884.0	ta	https://www.tamilmirror.lk/செய்திகள்/நுவரெலியாவில்-முட்டைக்கு-தட்டுப்பாடு/175-312971
tamilmirrorlk	2023-02-24 12:46:49	’வருடம் முழுவதுமான சுற்றுலாத் தளமாக இலங்கை’	10	58938039	1677223009.0	ta	https://www.tamilmirror.lk/செய்திகள்/வருடம்-முழுவதுமான-சுற்றுலாத்-தளமாக-இலங்கை/175-312970
tamilmirrorlk	2023-02-24 12:44:34	உலகில் சிறந்த பல்கலைக்கழகமாக பேராதனை	3	c7710e1e	1677222874.0	ta	https://www.tamilmirror.lk/செய்திகள்/உலகில்-சிறந்த-பல்கலைக்கழகமாக-பேராதனை/175-312969
