newspaper_id	time_str	original_title	n_original_body_lines	hash	time_ut	original_lang	url
virakesarilk	2023-06-16 11:25:00	இடை நிறுத்தப்பட்ட மன்னார் அல் அஸ்ஹர் ம.வி தேசிய பாடசாலை மாணவர்களுக்கான பஸ் சேவையை உடன் ஆரம்பிக்க கோரிக்கை	8	91586984	1686894900.0	ta	https://www.virakesari.lk/article/157829
tamilmirrorlk	2023-06-16 11:24:03	தங்கம் விலை மீண்டும் உயர்வு	3	d5cc91d8	1686894843.0	ta	https://www.tamilmirror.lk/செய்திகள்/தங்கம்-விலை-மீண்டும்-உயர்வு/175-319301
virakesarilk	2023-06-16 11:16:00	யாழில் சிறுமிக்கு பாலியல் தொந்தரவு ; 30 வயதுடைய சந்தேகநபர் கைது!	4	6c53dfce	1686894360.0	ta	https://www.virakesari.lk/article/157835
tamilmirrorlk	2023-06-16 11:12:16	இரண்டு அரச திணைக்களங்ளுக்கு பூட்டு	2	d1e5e383	1686894136.0	ta	https://www.tamilmirror.lk/செய்திகள்/இரண்டு-அரச-திணைக்களங்ளுக்கு-பூட்டு/175-319300
adaderanalk	2023-06-16 10:49:00	Earthquake of magnitude 7.2 strikes in South Pacific Ocean	5	f1d42cfc	1686892740.0	en	https://www.adaderana.lk/news/91311/earthquake-of-magnitude-72-strikes-in-south-pacific-ocean
tamilmirrorlk	2023-06-16 10:43:39	விபத்தில் தாயும் மகளும் உடல் நசுங்கி பலி	9	b242173b	1686892419.0	ta	https://www.tamilmirror.lk/யாழ்ப்பாணம்/விபத்தில்-தாயும்-மகளும்-உடல்-நசுங்கி-பலி/71-319299
adalk	2023-06-16 10:38:57	පාස්කු ප්‍රහාරය හේතුවෙන් පොලිස් බුද්ධි අංශ  සැරයන් සේවයෙන් පහ කරයි	5	92d813c5	1686892137.0	si	https://www.ada.lk/breaking_news/පාස්කු-ප්‍රහාරය-හේතුවෙන්-පොලිස්-බුද්ධි-අංශ--සැරයන්-සේවයෙන්-පහ-කරයි/11-404146
virakesarilk	2023-06-16 10:34:00	வவுனியாவில் டிப்பர் மோதி விபத்து ; தாயும் மகளும் பலி!	9	0630519e	1686891840.0	ta	https://www.virakesari.lk/article/157822
adaderanalk	2023-06-16 10:32:00	Two dead in collision involving lorry and navy bus	2	f5e1c759	1686891720.0	en	https://www.adaderana.lk/news/91310/two-dead-in-collision-involving-lorry-and-navy-bus
adalk	2023-06-16 10:30:43	තිරියාය හා කුරුන්දි ඉඩම් ගැන හොයන්න ජනපතිගෙන් කමිටුවක්	3	b15df557	1686891643.0	si	https://www.ada.lk/breaking_news/තිරියාය-හා-කුරුන්දි-ඉඩම්-ගැන-හොයන්න-ජනපතිගෙන්-කමිටුවක්/11-404145
adalk	2023-06-16 10:26:16	ඉතිහාසය උදාහරණයට ගෙන ජනපති දුන් සහතිකය	16	ed2772d9	1686891376.0	si	https://www.ada.lk/breaking_news/ඉතිහාසය-උදාහරණයට-ගෙන-ජනපති-දුන්-සහතිකය/11-404144
virakesarilk	2023-06-16 10:26:00	சாரதியிடம் இலஞ்சம் பெற்ற இ.போ.ச அதிகாரி களுத்துறையில் கைது!	2	1baf978c	1686891360.0	ta	https://www.virakesari.lk/article/157828
newsfirstlk	2023-06-16 10:19:00	Partygate: The scandal that rocked Downing Street	12	23227b55	1686890940.0	en	https://www.newsfirst.lk/2023/06/16/partygate-the-scandal-that-rocked-downing-street/
tamilmirrorlk	2023-06-16 10:09:34	விபத்தில் ஐந்து மாணவர்கள் காயம்	3	41ec3a2e	1686890374.0	ta	https://www.tamilmirror.lk/மலையகம்/விபத்தில்-ஐந்து-மாணவர்கள்-காயம்/76-319298
economynextcom	2023-06-16 10:08:00	Sri Lanka rupee at Rs307/310 to US dollar, bond yields down	9	6c353563	1686890280.0	en	https://economynext.com/sri-lanka-rupee-at-rs307-310-to-us-dollar-bond-yields-down-123710/
adaderanalk	2023-06-16 10:05:00	Two govt departments liquidated	5	ae67982b	1686890100.0	en	https://www.adaderana.lk/news/91309/two-govt-departments-liquidated
adaderanalk	2023-06-16 10:05:00	Gazette issued on closure of liquidation of two state departments	3	c1ef3af4	1686890100.0	en	https://www.adaderana.lk/news/91309/gazette-issued-on-closure-of-liquidation-of-two-state-departments
virakesarilk	2023-06-16 10:04:00	சீனாவில் அவுஸ்திரேலியாவை வென்றது ஆர்ஜென்டீனா: அதிவிரைவான கோல் புகுத்தினார் மெஸி	5	88a13e6a	1686890040.0	ta	https://www.virakesari.lk/article/157824
tamilmirrorlk	2023-06-16 09:56:09	’நுவரெலியா தபால் நிலையத்தை அழிக்க இடமளியோம்’	9	a758d637	1686889569.0	ta	https://www.tamilmirror.lk/செய்திகள்/நுவரெலியா-தபால்-நிலையத்தை-அழிக்க-இடமளியோம்/175-319296
newsfirstlk	2023-06-16 09:56:00	IAEA studying plans of nuclear plant in Sri Lanka	12	ad12ac68	1686889560.0	en	https://www.newsfirst.lk/2023/06/16/iaea-studying-plans-of-nuclear-plant-in-sri-lanka/
virakesarilk	2023-06-16 09:53:00	குருந்தூர் மலை, திருகோணமலை திரியாய காணி விவகாரம் : நிபுணத்துவ குழு அமைத்து விசாரிக்க ஜனாதிபதி உத்தரவு	6	0d4f6ccb	1686889380.0	ta	https://www.virakesari.lk/article/157825
tamilmirrorlk	2023-06-16 09:49:09	அஷ்ரப் அசீஸ் காலமானார்	4	1a4212d7	1686889149.0	ta	https://www.tamilmirror.lk/செய்திகள்/அஷ்ரப்-அசீஸ்-காலமானார்/175-319294
newsfirstlk	2023-06-16 09:33:00	President vows to uphold freedom of expression	25	a5fa10f7	1686888180.0	en	https://www.newsfirst.lk/2023/06/16/president-vows-to-uphold-freedom-of-expression/
adaderanalk	2023-06-16 09:29:00	ASEAN hints at Sri Lanka’s potential entry into RCEP trade deal	9	b1ee641d	1686887940.0	en	https://www.adaderana.lk/news/91308/asean-hints-at-sri-lankas-potential-entry-into-rcep-trade-deal-
newsfirstlk	2023-06-16 09:27:00	PMD issues statement on Kurundi Viharaya lands	14	5b87fccc	1686887820.0	en	https://www.newsfirst.lk/2023/06/16/pmd-issues-statement-on-kurundi-viharaya-lands/
virakesarilk	2023-06-16 09:25:00	மெதிரிகிரியவில் துப்பாக்கி சூட்டில் பெண் பலி	3	6678ee4f	1686887700.0	ta	https://www.virakesari.lk/article/157821
newsfirstlk	2023-06-16 09:19:00	Pakistan pledges more support for Sri Lanka sports	10	4a04ce24	1686887340.0	en	https://www.newsfirst.lk/2023/06/16/pakistan-pledges-more-support-for-sri-lanka-sports/
dailymirrorlk	2023-06-16 09:12:00	Woman shot dead in Medirigiriya	5	f7123946	1686886920.0	en	https://www.dailymirror.lk/breaking_news/Woman-shot-dead-in-Medirigiriya/108-261209
newsfirstlk	2023-06-16 09:11:00	Gazette on closure of liquidation of two departments	6	86e909d3	1686886860.0	en	https://www.newsfirst.lk/2023/06/16/gazette-on-closure-of-liquidation-of-two-departments/
dailymirrorlk	2023-06-16 09:06:00	Brothel raided in Mt. Lavinia, eight arrested	4	32154060	1686886560.0	en	https://www.dailymirror.lk/breaking_news/Brothel-raided-in-Mt-Lavinia-eight-arrested/108-261208
tamilmirrorlk	2023-06-16 09:01:58	உயிர்த்த ஞாயிறு தாக்குதல்: பொலிஸ் பணி இடைநீக்கம்	3	2c0a8873	1686886318.0	ta	https://www.tamilmirror.lk/செய்திகள்/உயிர்த்த-ஞாயிறு-தாக்குதல்-பொலிஸ்-பணி-இடைநீக்கம்/175-319291
newsfirstlk	2023-06-16 08:52:00	Police Sergeant terminated over the 2019 Easter Sunday Attacks	9	7e814eae	1686885720.0	en	https://www.newsfirst.lk/2023/06/16/police-sergeant-terminated-over-the-2019-easter-sunday-attacks/
virakesarilk	2023-06-16 08:46:00	பல பகுதிகளில் மழை பெய்யும் சாத்தியம்	8	634a5b4c	1686885360.0	ta	https://www.virakesari.lk/article/157818
newsfirstlk	2023-06-16 08:39:00	Woman shot dead in Medirigiriya	7	d175d5f1	1686884940.0	en	https://www.newsfirst.lk/2023/06/16/woman-shot-dead-in-medirigiriya/
adaderanalk	2023-06-16 08:33:00	Met. Dept. forecasts spells of showers in many areas	7	48d35b02	1686884580.0	en	https://www.adaderana.lk/news/91307/met-dept-forecasts-spells-of-showers-in-many-areas
tamilmirrorlk	2023-06-16 08:07:39	இலஞ்சம் வாங்கிய அதிகாரி கைது	3	52cf0e87	1686883059.0	ta	https://www.tamilmirror.lk/செய்திகள்/இலஞ்சம்-வாங்கிய-அதிகாரி-கைது/175-319290
tamilmirrorlk	2023-06-16 08:00:31	துப்பாக்கிச்சூடு; பெண் உயிரிழப்பு	1	c468a856	1686882631.0	ta	https://www.tamilmirror.lk/செய்திகள்/துப்பாக்கிச்சூடு-பெண்-உயிரிழப்பு/175-319288
tamilmirrorlk	2023-06-16 07:57:54	பல தடவைகள் மழை பெய்யும்	4	9861adcc	1686882474.0	ta	https://www.tamilmirror.lk/செய்திகள்/பல-தடவைகள்-மழை-பெய்யும்/175-319287
adalk	2023-06-16 07:38:29	කුරුන්දි විහාරයේ ඉඩම් ගැන ජනපති ලේකම්ගෙන් ප්‍රකාශයක්	8	9a114af4	1686881309.0	si	https://www.ada.lk/breaking_news/කුරුන්දි-විහාරයේ-ඉඩම්-ගැන-ජනපති-ලේකම්ගෙන්-ප්‍රකාශයක්/11-404143
economynextcom	2023-06-16 07:31:00	Sri Lanka debt to GDP ratio down by March 2023 amid currency gain: analysis	17	bab73e1d	1686880860.0	en	https://economynext.com/sri-lanka-debt-to-gdp-ratio-down-by-march-2023-amid-currency-gain-analysis-123672/
economynextcom	2023-06-16 07:04:00	Sri Lanka pharma chamber wants new pricing mechanism for drugs	24	f49089a4	1686879240.0	en	https://economynext.com/sri-lanka-pharma-chamber-wants-new-pricing-mechanism-for-drugs-123698/
adaderanalk	2023-06-16 07:02:00	Woman dies after being shot in Medirigiriya	5	2e6eda68	1686879120.0	en	https://www.adaderana.lk/news/91306/woman-dies-after-being-shot-in-medirigiriya-
tamilmirrorlk	2023-06-16 07:00:36	மனித உரிமைகள் பேரவை கூட்டத்தொடர் திங்கள் ஆரம்பம்	3	11b343c8	1686879036.0	ta	https://www.tamilmirror.lk/செய்திகள்/மனித-உரிமைகள்-பேரவை-கூட்டத்தொடர்-திங்கள்-ஆரம்பம்/175-319286
dailymirrorlk	2023-06-16 06:54:19	Pharmaceutical industry ready to cut drug prices by up to 13%	10	9b224ff1	1686878659.0	en	https://www.dailymirror.lk/breaking_news/Pharmaceutical-industry-ready-to-cut-drug-prices-by-up-to-13/108-261201
tamilmirrorlk	2023-06-16 06:53:48	கருத்துரிமை பறிக்கப்படாது: ஜனாதிபதி	5	f8fa73dc	1686878628.0	ta	https://www.tamilmirror.lk/செய்திகள்/கருத்துரிமை-பறிக்கப்படாது-ஜனாதிபதி/175-319285
dailymirrorlk	2023-06-16 06:42:13	Maintenance costs of old ULT freezers very high: National Blood Bank	7	993c75ec	1686877933.0	en	https://www.dailymirror.lk/breaking_news/Maintenance-costs-of-old-ULT-freezers-very-high-National-Blood-Bank/108-261196
dailymirrorlk	2023-06-16 06:38:51	Convicted Lankan money forger and sex offender denied refugee status, must leave NZ	19	b4ef483d	1686877731.0	en	https://www.dailymirror.lk/breaking_news/Convicted-Lankan-money-forger-and-sex-offender-denied-refugee-status-must-leave-NZ/108-261195
dailymirrorlk	2023-06-16 06:33:00	No genocide took place in SL, Trudeau says otherwise for political ends	10	17cb3863	1686877380.0	en	https://www.dailymirror.lk/breaking_news/No-genocide-took-place-in-SL-Trudeau-says-otherwise-for-political-ends/108-261193
dailymirrorlk	2023-06-16 06:33:00	No genocide took place in SL, Trudeau says otherwise for political ends	10	e79635b8	1686877380.0	en	https://www.dailymirror.lk/top_story/No-genocide-took-place-in-SL-Trudeau-says-otherwise-for-political-ends/155-261193
virakesarilk	2023-06-16 06:20:00	கஜேந்திரகுமர் தொடர்பான நீதிமன்ற விசாரணைகளை அவதானிப்பதற்காக கொழும்பில் உள்ள அமெரிக்க இராஜதந்திரிகளை அனுப்பவேண்டும்- அமெரிக்க இராஜங்க செயலாளருக்கு புலம்பெயர் அமைப்புகள் கடிதம்	10	ee766a9c	1686876600.0	ta	https://www.virakesari.lk/article/157817
dailymirrorlk	2023-06-16 06:17:16	Sri Lanka‘s first electric taxi service ‘E-drive’ launched	10	f106dae5	1686876436.0	en	https://www.dailymirror.lk/breaking_news/Sri-Lankas-first-electric-taxi-service-E-drive-launched/108-261189
dailyftlk	2023-06-16 06:16:00	Sustainable debt and unsustainable democracy	11	cb14b76c	1686876360.0	en	https://www.ft.lk/columns/Sustainable-debt-and-unsustainable-democracy/4-749553
dailyftlk	2023-06-16 06:11:41	Sri Lanka Chamber of Pharmaceutical Industry has its say on pricing of drugs	18	5bd0e4bb	1686876101.0	en	https://www.ft.lk/opinion/Sri-Lanka-Chamber-of-Pharmaceutical-Industry-has-its-say-on-pricing-of-drugs/14-749552
economynextcom	2023-06-16 06:09:00	Sri Lanka top court dismisses cases against SLT privatization: report	5	91338308	1686875940.0	en	https://economynext.com/sri-lanka-top-court-dismisses-cases-against-slt-privatization-report-123708/
dailyftlk	2023-06-16 06:03:22	V. Anandasangaree: The LTTE vilified him, but history has vindicated him	38	3a4146f5	1686875602.0	en	https://www.ft.lk/opinion/V-Anandasangaree-The-LTTE-vilified-him-but-history-has-vindicated-him/14-749550
virakesarilk	2023-06-16 05:45:00	கனடாவில் டிரக் பேருந்து மீது மோதியதில் 15 பேர் உயிரிழப்பு	5	05874e87	1686874500.0	ta	https://www.virakesari.lk/article/157816
dailyftlk	2023-06-16 04:44:12	Stand up, speak up, and (be) shut up	19	f8108831	1686870852.0	en	https://www.ft.lk/columns/Stand-up-speak-up-and-be-shut-up/4-749549
dailyftlk	2023-06-16 04:43:17	‘Political monk: Disciple or destroyer’: A response	6	5e457cb9	1686870797.0	en	https://www.ft.lk/columns/Political-monk-Disciple-or-destroyer-A-response/4-749548
dailyftlk	2023-06-16 04:40:43	Prisons overcrowded	11	fcd58eac	1686870643.0	en	https://www.ft.lk/opinion/Prisons-overcrowded/14-749547
dailyftlk	2023-06-16 04:39:23	EDB Open Day guides innovative entrepreneurs to enter export market	6	39877b58	1686870563.0	en	https://www.ft.lk/business/EDB-Open-Day-guides-innovative-entrepreneurs-to-enter-export-market/34-749545
dailyftlk	2023-06-16 04:37:46	Blue Diamonds’ Rs. 129.5 m Rights Issue concludes with new partnership agreements	15	04f8a246	1686870466.0	en	https://www.ft.lk/business/Blue-Diamonds-Rs-129-5-m-Rights-Issue-concludes-with-new-partnership-agreements/34-749544
dailyftlk	2023-06-16 04:35:11	Godahewa accuses President of pursuing detrimental policies	12	c15c7171	1686870311.0	en	https://www.ft.lk/news/Godahewa-accuses-President-of-pursuing-detrimental-policies/56-749543
dailyftlk	2023-06-16 04:34:37	Mujibur files RTI on state benefits granted to Gota	6	0b5cfc5f	1686870277.0	en	https://www.ft.lk/news/Mujibur-files-RTI-on-state-benefits-granted-to-Gota/56-749542
colombotelegraphcom	2023-06-16 04:30:57	‘Due Impartiality’ Should Be Our Top Most Objective In Regulating The Broadcasting Sector	14	858b9e53	1686870057.0	en	https://www.colombotelegraph.com/index.php/due-impartiality-should-be-our-top-most-objective-in-regulating-the-broadcasting-sector/
islandlk	2023-06-16 01:47:00	Fitch maintains National Rating of Bank of Ceylon at ‘A(lka)’	12	dd4398aa	1686860220.0	en	http://island.lk/fitch-maintains-national-rating-of-bank-of-ceylon-at-alka/
islandlk	2023-06-16 01:46:00	COYLE monthly meeting endeavours to strengthen Sri Lanka-Bangladesh ties and drive growth	9	bdea3844	1686860160.0	en	http://island.lk/coyle-monthly-meeting-endeavours-to-strengthen-sri-lanka-bangladesh-ties-and-drive-growth/
islandlk	2023-06-16 01:43:00	Anantaya Resorts & Spas and Passikudah recognized by TripAdvisor for Traveler’s Choice award	15	158f5ae3	1686859980.0	en	http://island.lk/anantaya-resorts-spas-and-passikudah-recognized-by-tripadvisor-for-travelers-choice-award/
islandlk	2023-06-16 01:42:00	Entrepreneurs’ Organization to host South Asia Leadership Conference in Colombo	10	6d4b258e	1686859920.0	en	http://island.lk/entrepreneurs-organization-to-host-south-asia-leadership-conference-in-colombo/
islandlk	2023-06-16 01:40:00	Lolc General Insurance and Stafford Motors sign Mou to provide better services	12	ac0ba705	1686859800.0	en	http://island.lk/lolc-general-insurance-and-stafford-motors-sign-mou-to-provide-better-services/
islandlk	2023-06-16 00:23:00	Ceylinco Life’s bespoke SLIM diploma produces first batch of graduates	19	7f8cae05	1686855180.0	en	http://island.lk/ceylinco-lifes-bespoke-slim-diploma-produces-first-batch-of-graduates/
islandlk	2023-06-16 00:22:00	Museum of Modern and Contemporary Art Sri Lanka University of Jaffna internships	8	d26ce01c	1686855120.0	en	http://island.lk/museum-of-modern-and-contemporary-art-sri-lanka-university-of-jaffna-internships/
dailymirrorlk	2023-06-15 23:53:23	Intelligence cop suspended for failing in duty during Easter Sunday attack	4	0abce7b7	1686853403.0	en	https://www.dailymirror.lk/breaking_news/Intelligence-cop-suspended-for-failing-in-duty-during-Easter-Sunday-attack/108-261184
tamilmirrorlk	2023-06-15 23:41:05	மருந்துகளின் விலைகள் 16 சதவீதத்தால் குறைப்பு	2	986977cb	1686852665.0	ta	https://www.tamilmirror.lk/செய்திகள்/மருந்துகளின்-விலைகள்-16-சதவீதத்தால்-குறைப்பு/175-319282
dailymirrorlk	2023-06-15 23:38:21	Four cops among six who attended conference in UK decamp	5	e5124faa	1686852501.0	en	https://www.dailymirror.lk/breaking_news/Four-cops-among-six-who-attended-conference-in-UK-decamp/108-261182
dailymirrorlk	2023-06-15 23:06:12	Sri Lanka warm up for qualifiers with massive win	9	50ff8afa	1686850572.0	en	https://www.dailymirror.lk/breaking_news/Sri-Lanka-warm-up-for-qualifiers-with-massive-win/108-261180
dailymirrorlk	2023-06-15 22:47:46	A food shortage created by choice	11	39014547	1686849466.0	en	https://www.dailymirror.lk/opinion/A-food-shortage-created-by-choice/172-261179
dailymirrorlk	2023-06-15 22:34:36	After Iran-Saudi deal, China takes on bigger peace challenge in Palestine	23	c13e814f	1686848676.0	en	https://www.dailymirror.lk/opinion/After-Iran-Saudi-deal-China-takes-on-bigger-peace-challenge-in-Palestine/172-261178
dailymirrorlk	2023-06-15 22:15:52	British actors to play Australian umpires role in Murali’s 800 biopic	10	c7661299	1686847552.0	en	https://www.dailymirror.lk/breaking_news/British-actors-to-play-Australian-umpires-role-in-Muralis-800-biopic/108-261177
virakesarilk	2023-06-15 22:13:00	பொலிஸ்காவலின் கீழான உயிரிழப்புக்கள் குறித்து இலங்கை சட்டத்தரணிகள் சங்கம் தீவிர கரிசனை	6	669aeca7	1686847380.0	ta	https://www.virakesari.lk/article/157807
virakesarilk	2023-06-15 22:12:00	கட்சி என்ற ரீதியில் ஜனாதிபதியுடன் பேச்சுவார்த்தையில் ஈடுபடுவோம் -காமினி லொகுகே	7	b7d64060	1686847320.0	ta	https://www.virakesari.lk/article/157808
dailymirrorlk	2023-06-15 22:08:00	Prez to appoint committee to find out historical extent of land owned by Kurundi, Thiriyaya Viharas	6	99e435b4	1686847080.0	en	https://www.dailymirror.lk/breaking_news/Prez-to-appoint-committee-to-find-out-historical-extent-of-land-owned-by-Kurundi-Thiriyaya-Viharas/108-261176
virakesarilk	2023-06-15 22:07:00	சபாநாயகரை சந்தித்தார் பாராளுமன்ற அபிவிருத்தி தொடர்பான சர்வதேச நிபுணர் கெவின் டெவாக்ஷ்	1	1bc6c9b3	1686847020.0	ta	https://www.virakesari.lk/article/157810
virakesarilk	2023-06-15 22:07:00	இன நல்லிணக்கத்தை கட்டியெழுப்ப நாட்டு மக்களின் சிந்தனை ரீதியான மாற்றத்தை ஏற்படுத்த வேண்டும் - நீதி அமைச்சர்	14	1fcaf608	1686847020.0	ta	https://www.virakesari.lk/article/157809
virakesarilk	2023-06-15 22:02:00	சர்வதேச பொறுப்புக்கூறல் பொறிமுறை மாத்திரமே தமிழ்மக்கள் மத்தியில் நம்பிக்கையைத் துளிர்க்கச்செய்யும்; பின்லாந்து வெளிவிவகார அமைச்சிடம் - புலம்பெயர் தமிழர் அமைப்பு எடுத்துரைப்பு	6	23c164c1	1686846720.0	ta	https://www.virakesari.lk/article/157812
virakesarilk	2023-06-15 22:02:00	ஜனாதிபதியின் வெளிநாட்டுப் பயணம் நிறைவு பெற்றதன் பின் அமைச்சரவையில் மாற்றம் ஏற்படலாம் -பிரசன்ன ரணதுங்க	5	f925fb44	1686846720.0	ta	https://www.virakesari.lk/article/157813
virakesarilk	2023-06-15 22:01:00	அமைச்சர் அலி சப்ரி, சாகல ரத்நாயக்க ஆகியோருடன் ரோய் சமாதானம் சந்திப்பு	7	cb59aedf	1686846660.0	ta	https://www.virakesari.lk/article/157806
virakesarilk	2023-06-15 22:00:00	ஜனாதிபதிக்கும் பொதுஜன பெரமுனவுக்குமிடையிலான முரண்பாடு பொதுத் தேர்தலுக்கு வழிவகுக்கும் - சஜித்	10	8299b809	1686846600.0	ta	https://www.virakesari.lk/article/157805
virakesarilk	2023-06-15 21:59:00	இலங்கைக்கு வர முடியாமல் டென்மார்க்கிலுள்ள 2 ஆயிரம் புலம்பெயர் தமிழர்கள் : கடவுச்சீட்டுக்கான அனுமதியை கோரி அலி சப்ரிக்கு கடிதம்	11	c4f4ea68	1686846540.0	ta	https://www.virakesari.lk/article/157804
virakesarilk	2023-06-15 21:57:00	மாறுபட்ட நிலைப்பாட்டாளர்களைத் துரோகிகளாக சித்தரிக்கும் பண்பு தமிழ் அரசியல்வாதிகளிடம் வந்துவிட்டது - விக்கினேஸ்வரன்	9	5f7dac73	1686846420.0	ta	https://www.virakesari.lk/article/157803
adaderanalk	2023-06-15 21:54:00	26 arrested for illegal fishing	9	27d78274	1686846240.0	en	https://www.adaderana.lk/news/91305/26-arrested-for-illegal-fishing-
virakesarilk	2023-06-15 21:54:00	புதிய தொழில் சட்டத்தை விரைவில் பாராளுமன்றத்துக்கு சமர்ப்பிப்போம் - தொழில் அமைச்சர் மனுஷ	11	cb46bf77	1686846240.0	ta	https://www.virakesari.lk/article/157814
adaderanalk	2023-06-15 21:44:00	SLTB Regional Transport Manager arrested for accepting bribe	4	3e89c12e	1686845640.0	en	https://www.adaderana.lk/news/91304/sltb-regional-transport-manager-arrested-for-accepting-bribe-
adaderanalk	2023-06-15 20:46:00	President assures commitment to upholding right to freedom of expression	4	e85c1af7	1686842160.0	en	https://www.adaderana.lk/news/91303/president-assures-commitment-to-upholding-right-to-freedom-of-expression-
adalk	2023-06-15 19:45:11	ඖෂධ මිල අඩුකරමින් ගැසට් නිවේදනයක්	1	f85dfdf7	1686838511.0	si	https://www.ada.lk/breaking_news/ඖෂධ-මිල-අඩුකරමින්-ගැසට්-නිවේදනයක්/11-404142
dailymirrorlk	2023-06-15 19:30:17	Gammanpila to ask UNESCO for help	7	5491c206	1686837617.0	en	https://www.dailymirror.lk/breaking_news/Gammanpila-to-ask-UNESCO-for-help/108-261175
