newspaper_id	time_str	original_title	n_original_body_lines	hash	time_ut	original_lang	url
tamilmirrorlk	2023-02-24 12:43:29	கோபா தலைவராக லசந்த அழகியவண்ண	1	74984c31	1677222809.0	ta	https://www.tamilmirror.lk/செய்திகள்/கோபா-தலைவராக-லசந்த-அழகியவண்ண/175-312968
tamilmirrorlk	2023-02-24 12:42:21	அதிவேக நெடுஞ்சாலை விபத்தில் இளைஞன் பலி	3	da010620	1677222741.0	ta	https://www.tamilmirror.lk/செய்திகள்/அதிவேக-நெடுஞ்சாலை-விபத்தில்-இளைஞன்-பலி/175-312967
tamilmirrorlk	2023-02-24 12:40:27	விவசாயிகளுக்கு 56 பில்லியன் ரூபாய் ஒதுக்கீடு	2	93eb9a28	1677222627.0	ta	https://www.tamilmirror.lk/செய்திகள்/விவசாயிகளுக்கு-56-பில்லியன்-ரூபாய்-ஒதுக்கீடு/175-312966
dailymirrorlk	2023-02-24 12:25:00	SL to receive its first group of post-pandemic Chinese tourists on March 3	12	8664d0ab	1677221700.0	en	https://www.dailymirror.lk/breaking_news/SL-to-receive-its-first-group-of-post-pandemic-Chinese-tourists-on-March-3/108-254776
virakesarilk	2023-02-24 12:19:00	RDB வங்கியின் புதிய தலைவராக திரு. சுசந்த சில்வா பதவியேற்பு	4	728ffa45	1677221340.0	ta	https://www.virakesari.lk/article/149038
economynextcom	2023-02-24 12:10:00	Sri Lanka’s mid day shares edge up	7	4c2dce4f	1677220800.0	en	https://economynext.com/sri-lankas-mid-day-shares-edge-up-113194/
economynextcom	2023-02-24 12:02:00	Sri Lanka unveils draft monetary law for flexible policy	23	958ceae7	1677220320.0	en	https://economynext.com/sri-lanka-unveils-draft-monetary-law-for-flexible-policy-113195/
lankadeepalk	2023-02-24 11:33:45	අභියෝග තුනක් අභියස	24	5617c053	1677218625.0	si	https://www.lankadeepa.lk/features/අභියෝග-තුනක්-අභියස/2-629222
lankadeepalk	2023-02-24 11:33:45	අභියෝග තුනක් අභියස	24	7a112e3f	1677218625.0	si	https://www.lankadeepa.lk/visheshanga/අභියෝග-තුනක්-අභියස/26-629222
lankadeepalk	2023-02-24 11:18:04	ඔහු නික්ම ගොස් වසරයි	8	d4d7b7cf	1677217684.0	si	https://www.lankadeepa.lk/visheshanga/ඔහු-නික්ම-ගොස්-වසරයි/26-629219
bbccomsinhala	2023-02-24 11:02:26	සංක්‍රාන්ති ලිංගිකයින්ට වන හිරිහැර වැළැක්වීමට පොලිස්පතිගෙන් උපදෙස් 9ක්	21	7c24f06b	1677216746.0	si	https://www.bbc.com/sinhala/articles/cmmvyqd7d0yo
dailymirrorlk	2023-02-24 11:00:19	Sri Lanka again abstains from UN vote on Russian invasion	5	179e1dc1	1677216619.0	en	https://www.dailymirror.lk/top_story/Sri-Lanka-again-abstains-from-UN-vote-on-Russian-invasion/155-254767
bbccomsinhala	2023-02-24 10:53:32	පළාත් පාලන මැතිවරණය 2023: මාර්තු 09 ඡන්දය පැවැත්වෙන්නේ නැහැ	17	37829036	1677216212.0	si	https://www.bbc.com/sinhala/articles/c0jl4jzgj1no
tamilmirrorlk	2023-02-24 10:24:15	இலங்கை வரும் சீன சுற்றுலா பயணிகள் குழு	4	c9bbcc55	1677214455.0	ta	https://www.tamilmirror.lk/செய்திகள்/இலங்கை-வரும்-சீன-சுற்றுலா-பயணிகள்-குழு/175-312961
tamilmirrorlk	2023-02-24 10:20:39	வெளிநாட்டுப் பெண்ணை செருப்பால் அடித்த இளைஞன்	3	ae551b24	1677214239.0	ta	https://www.tamilmirror.lk/செய்திகள்/வெளிநாட்டுப்-பெண்ணை-செருப்பால்-அடித்த-இளைஞன்/175-312960
tamilmirrorlk	2023-02-24 10:14:32	'ஜனாதிபதிக்கு  பைத்தியம்' ; சாடுகிறார் சஜித்	5	c9c4bb93	1677213872.0	ta	https://www.tamilmirror.lk/செய்திகள்/ஜனாதிபதிக்கு-பைத்தியம்-சாடுகிறார்-சஜித்/175-312958
tamilmirrorlk	2023-02-24 10:09:50	ரஷ்யாவுக்கு எதிரான வாக்கெடுப்பு -  பங்கேற்காத இலங்கை, இந்தியா	2	1ab55225	1677213590.0	ta	https://www.tamilmirror.lk/செய்திகள்/ரஷ்யாவுக்கு-எதிரான-வாக்கெடுப்பு-பங்கேற்காத-இலங்கை-இந்தியா/175-312957
economynextcom	2023-02-24 10:01:00	Sri Lanka bond yields, rupee steady at open	6	8d300706	1677213060.0	en	https://economynext.com/sri-lanka-bond-yields-rupee-steady-at-open-113183/
virakesarilk	2023-02-24 09:44:00	ஜே.வி.பி.யிடம் ஏற்படவேண்டிய முக்கியமான  ஒரு மாறுதல்	1	b20ee39d	1677212040.0	ta	https://www.virakesari.lk/article/149012
economynextcom	2023-02-24 09:01:00	Yellen calls on China for specific debt assurances for Sri Lanka	13	39f1ca90	1677209460.0	en	https://economynext.com/yellen-calls-on-china-for-specific-debt-assurances-for-sri-lanka-113173/
dailyftlk	2023-02-24 06:34:10	Sri Lanka kicks off France-supported RIVER project	15	e71335e4	1677200650.0	en	https://www.ft.lk/business/Sri-Lanka-kicks-off-France-supported-RIVER-project/34-745665
dailyftlk	2023-02-24 06:28:19	Overseas Realty net profit tops Rs. 6 b mark in FY22	9	c39b6267	1677200299.0	en	https://www.ft.lk/business/Overseas-Realty-net-profit-tops-Rs-6-b-mark-in-FY22/34-745664
dailyftlk	2023-02-24 06:17:24	WCIC inks first international MoU with Lahore WCCI to boost trade opportunities	4	d3df70ea	1677199644.0	en	https://www.ft.lk/business/WCIC-inks-first-international-MoU-with-Lahore-WCCI-to-boost-trade-opportunities/34-745663
dailyftlk	2023-02-24 06:16:27	Dunsinane Estate achieves all-time record for Western High CTC BP1 Grade	4	3ba70088	1677199587.0	en	https://www.ft.lk/business/Dunsinane-Estate-achieves-all-time-record-for-Western-High-CTC-BP1-Grade/34-745662
dailyftlk	2023-02-24 06:14:40	‘Uphold the people’s right to franchise’	13	aaa24bd7	1677199480.0	en	https://www.ft.lk/opinion/Uphold-the-people-s-right-to-franchise/14-745661
dailyftlk	2023-02-24 06:12:56	Do elections in Sri Lanka mean “democracy”?	20	35fae774	1677199376.0	en	https://www.ft.lk/columns/Do-elections-in-Sri-Lanka-mean-democracy/4-745660
dailyftlk	2023-02-24 06:10:11	Sri Lanka’s talent exodus and the challenge of retention	8	aea705fc	1677199211.0	en	https://www.ft.lk/columns/Sri-Lanka-s-talent-exodus-and-the-challenge-of-retention/4-745659
dailyftlk	2023-02-24 06:07:23	Grievances over Royal College in Year 1 admission	5	4ca06cb5	1677199043.0	en	https://www.ft.lk/opinion/Grievances-over-Royal-College-in-Year-1-admission/14-745658
dailyftlk	2023-02-24 06:02:20	President gaining cruel enjoyment by obstructing polls: AKD	11	30602443	1677198740.0	en	https://www.ft.lk/news/President-gaining-cruel-enjoyment-by-obstructing-polls-AKD/56-745653
dailyftlk	2023-02-24 06:01:15	Well aware of Ranil’s games, says S.M. Marikkar	10	a0e79daf	1677198675.0	en	https://www.ft.lk/news/Well-aware-of-Ranil-s-games-says-S-M-Marikkar/56-745652
dailyftlk	2023-02-24 05:44:41	Kananathan selected to be an election observer in Nigeria	9	a4518537	1677197681.0	en	https://www.ft.lk/news/Kananathan-selected-to-be-an-election-observer-in-Nigeria/56-745651
tamilmirrorlk	2023-02-24 05:12:43	தேர்தல்கள் ஆணைக்குழு இன்று இறுதி தீர்மானம்	2	af2fd3de	1677195763.0	ta	https://www.tamilmirror.lk/செய்திகள்/தேர்தல்கள்-ஆணைக்குழு-இன்று-இறுதி-தீர்மானம்/175-312953
dailyftlk	2023-02-24 05:01:03	Another batch of Indian Oil’s women executives visit Sri Lanka	8	04cd3acb	1677195063.0	en	https://www.ft.lk/business/Another-batch-of-Indian-Oil-s-women-executives-visit-Sri-Lanka/34-745642
dailymirrorlk	2023-02-23 22:33:59	Sri Lanka does have a past when it had rich ideas - EDITORIAL	8	b11a6a54	1677171839.0	en	https://www.dailymirror.lk/opinion/Sri-Lanka-does-have-a-past-when-it-had-rich-ideas-EDITORIAL/172-254734
dailymirrorlk	2023-02-23 22:32:15	Ukraine war, one year on: All we are saying is give peace a chance	19	32817916	1677171735.0	en	https://www.dailymirror.lk/opinion/Ukraine-war-one-year-on-All-we-are-saying-is-give-peace-a-chance/172-254733
dailymirrorlk	2023-02-23 22:27:22	US$ 36 billion of Sri Lanka’s export money held offshore	17	fe5b5f19	1677171442.0	en	https://www.dailymirror.lk/opinion/US-36-billion-of-Sri-Lankas-export-money-held-offshore/231-254732
economynextcom	2023-02-23 22:21:00	Climate Insecurity is a Collective Challenge, South Asia Needs a Common Policy	18	6ea99a88	1677171060.0	en	https://economynext.com/climate-insecurity-is-a-collective-challenge-south-asia-needs-a-common-policy-113162/
economynextcom	2023-02-23 19:46:00	Sri Lanka close on two month high	15	93d94d56	1677161760.0	en	https://economynext.com/sri-lanka-close-on-two-month-high-113149/
economynextcom	2023-02-23 17:53:00	Sri Lanka bond yields close higher	5	6427066d	1677154980.0	en	https://economynext.com/sri-lanka-bond-yields-close-higher-113144/
economynextcom	2023-02-23 17:51:00	Sri Lanka ruling party MP Ranjith Bandara reappointed COPE chair	7	2c00c813	1677154860.0	en	https://economynext.com/sri-lanka-ruling-party-mp-ranjith-bandara-reappointed-cope-chair-113141/
economynextcom	2023-02-23 17:48:00	Sri Lanka NDB Bank profits up in Dec-2022 quarter	15	23998b30	1677154680.0	en	https://economynext.com/sri-lanka-ndb-bank-profits-up-in-dec-2022-quarter-113112/
virakesarilk	2023-02-23 15:42:00	மேரி கொல்வின் சிரியாவில் கொல்லப்பட்டு 11 வருடங்கள்	16	9f2871c4	1677147120.0	ta	https://www.virakesari.lk/article/148982
economynextcom	2023-02-23 14:57:00	Sri Lanka Supreme Court postpones writ petition on local elections to May 11	12	a4194b85	1677144420.0	en	https://economynext.com/sri-lanka-supreme-court-postpones-writ-petition-on-local-elections-to-may-11-113119/
virakesarilk	2023-02-23 12:15:00	உக்ரைனின் ஓவியங்களிற்கு அடைக்கலம்  வழங்கியுள்ள சுவிட்சர்லாந்து	9	0f305ca0	1677134700.0	ta	https://www.virakesari.lk/article/148950
bbccomsinhala	2023-02-23 11:39:24	මරණ දණ්ඩනයට අත්සන් කරන්නේ නැහැ - ජනපති	22	33c65ef7	1677132564.0	si	https://www.bbc.com/sinhala/articles/c3gnzd34031o
dailymirrorlk	2023-02-23 11:32:49	LG polls not legally declared: President	4	2ff6b062	1677132169.0	en	https://www.dailymirror.lk/top_story/LG-polls-not-legally-declared-President/155-254704
lankadeepalk	2023-02-23 11:01:22	නිදහස් සටනට පුවත්පත අවිය කරගත් ඩී.ආර්.විජයවර්ධන	34	87cba5c3	1677130282.0	si	https://www.lankadeepa.lk/visheshanga/නිදහස්-සටනට-පුවත්පත-අවිය-කරගත්-ඩී-ආර්-විජයවර්ධන/26-629155
lankadeepalk	2023-02-23 11:01:22	නිදහස් සටනට පුවත්පත අවිය කරගත් ඩී.ආර්.විජයවර්ධන	34	e3fe4290	1677130282.0	si	https://www.lankadeepa.lk/features/නිදහස්-සටනට-පුවත්පත-අවිය-කරගත්-ඩී-ආර්-විජයවර්ධන/2-629155
bbccomsinhala	2023-02-23 10:44:35	පළාත් පාලන මැතිවරණය 2023 : අද  ශ්‍රේෂ්ඨාධිකරණයේදී සිදුවුයේ කුමක්ද?	29	68a30a71	1677129275.0	si	https://www.bbc.com/sinhala/articles/cw8516zvpn0o
lankadeepalk	2023-02-23 10:21:48	වේගයෙන් වැඩිවන ශ්‍රී ලංකාවේ දුප්පත්කම	28	39c3d586	1677127908.0	si	https://www.lankadeepa.lk/visheshanga/වේගයෙන්-වැඩිවන-ශ්‍රී-ලංකාවේ-දුප්පත්කම/26-629148
lankadeepalk	2023-02-23 10:13:44	පාන් ගෙඩියේ බත් පැකට්ටුවේ මිල බහින්නේම නැද්ද?	11	0b3196c7	1677127424.0	si	https://www.lankadeepa.lk/features/පාන්-ගෙඩියේ-බත්-පැකට්ටුවේ-මිල-බහින්නේම-නැද්ද-/2-629147
lankadeepalk	2023-02-23 10:13:44	පාන් ගෙඩියේ බත් පැකට්ටුවේ මිල බහින්නේම නැද්ද?	11	dcc76c8d	1677127424.0	si	https://www.lankadeepa.lk/visheshanga/පාන්-ගෙඩියේ-බත්-පැකට්ටුවේ-මිල-බහින්නේම-නැද්ද-/26-629147
economynextcom	2023-02-23 08:13:00	Sri Lanka chicken demand falls after currency collapse, inflation: poultry group	12	6832806f	1677120180.0	en	https://economynext.com/sri-lanka-chicken-demand-falls-after-currency-collapse-inflation-poultry-group-113084/
bbccomsinhala	2023-02-23 05:57:57	චීනයේ සහය නොමැතිව IMF ශ්‍රී ලංකාවට ණය අනුමත කරයිද?	44	0954bc91	1677112077.0	si	https://www.bbc.com/sinhala/articles/crgv28xvpnwo
dailymirrorlk	2023-02-23 04:06:32	Laughingstock at the Republic Day	11	eeceaefa	1677105392.0	en	https://www.dailymirror.lk/opinion/Laughingstock-at-the-Republic-Day/172-254661
dailymirrorlk	2023-02-23 04:04:25	A prophetic voice in the wilderness	10	e3242a8a	1677105265.0	en	https://www.dailymirror.lk/opinion/A-prophetic-voice-in-the-wilderness/172-254660
dailymirrorlk	2023-02-23 04:00:41	Building a generation of independent Liberal minds	32	cad9bd6d	1677105041.0	en	https://www.dailymirror.lk/opinion/Building-a-generation-of-independent-Liberal-minds/172-254659
dailymirrorlk	2023-02-23 03:57:25	13th Amendment should be implemented in three steps: Douglas	18	b9e3e78d	1677104845.0	en	https://www.dailymirror.lk/opinion/13th-Amendment-should-be-implemented-in-three-steps-Douglas/172-254658
dailyftlk	2023-02-23 01:46:48	Sajith reveals President’s promises to Pohottuwa	6	d01c320c	1677097008.0	en	https://www.ft.lk/news/Sajith-reveals-President-s-promises-to-Pohottuwa/56-745629
dailyftlk	2023-02-23 01:45:13	Karu calls for a stop to activities that may hinder the country’s well-being	4	3eaa6dc2	1677096913.0	en	https://www.ft.lk/news/Karu-calls-for-a-stop-to-activities-that-may-hinder-the-country-s-well-being/56-745628
dailyftlk	2023-02-23 01:44:09	Japan provides $ 46 m for diesel fuel for public hospitals	5	d7584892	1677096849.0	en	https://www.ft.lk/news/Japan-provides-46-m-for-diesel-fuel-for-public-hospitals/56-745627
dailyftlk	2023-02-23 01:42:57	Dr. Jasinghe meets Japan’s State Environment Minister; discusses Joint Crediting Mechanism	1	75ae8c2c	1677096777.0	en	https://www.ft.lk/news/Dr-Jasinghe-meets-Japan-s-State-Environment-Minister-discusses-Joint-Crediting-Mechanism/56-745626
dailyftlk	2023-02-23 01:41:57	305 nominations for Nobel Peace Prize: institute	10	010751f2	1677096717.0	en	https://www.ft.lk/news/305-nominations-for-Nobel-Peace-Prize-institute/56-745625
dailyftlk	2023-02-23 00:47:17	Supporting grassroots entrepreneurs is essential to revitalising Sri Lankan economy	20	975d2d48	1677093437.0	en	https://www.ft.lk/opinion/Supporting-grassroots-entrepreneurs-is-essential-to-revitalising-Sri-Lankan-economy/14-745609
dailyftlk	2023-02-23 00:45:08	Mr President restoring worker remittances to $ 7 b can help Sri Lankans to come out of ‘deep well’ faster than IMF’s four year $ 2.9 b	8	1826c6d8	1677093308.0	en	https://www.ft.lk/columns/Mr-President-restoring-worker-remittances-to-7-b-can-help-Sri-Lankans-to-come-out-of-deep-well-faster-than-IMF-s-four-year-2-9-b/4-745608
dailyftlk	2023-02-23 00:42:10	BASL Chief optimistic Justice Priyantha Fernando will continue to uphold dignity of the court	23	d0383f47	1677093130.0	en	https://www.ft.lk/opinion/BASL-Chief-optimistic-Justice-Priyantha-Fernando-will-continue-to-uphold-dignity-of-the-court/14-745607
dailyftlk	2023-02-22 23:21:04	Lanka IOC rewards high performing SERVO lube distributors	8	25ee60e0	1677088264.0	en	https://www.ft.lk/business/Lanka-IOC-rewards-high-performing-SERVO-lube-distributors/34-745600
dailyftlk	2023-02-22 23:19:10	Bogala Graphite unveils new chemical to strengthen cement, rubber production	10	9c8dd030	1677088150.0	en	https://www.ft.lk/business/Bogala-Graphite-unveils-new-chemical-to-strengthen-cement-rubber-production/34-745599
dailyftlk	2023-02-22 21:57:44	Commercial High Court issues Enjoining Order against use of “Thilakawardhana”	12	1bfa6065	1677083264.0	en	https://www.ft.lk/business/Commercial-High-Court-issues-Enjoining-Order-against-use-of-Thilakawardhana/34-745598
dailymirrorlk	2023-02-22 21:43:19	Adani Group gets BOI nod to install two wind power plants in Mannar, Pooneryn	4	968d6afb	1677082399.0	en	https://www.dailymirror.lk/top_story/Adani-Group-gets-BOI-nod-to-install-two-wind-power-plants-in-Mannar-Pooneryn/155-254651
dailyftlk	2023-02-22 21:34:02	Dispensable democracy: The Ranil doctrine	58	e5e38182	1677081842.0	en	https://www.ft.lk/columns/Dispensable-democracy-The-Ranil-doctrine/4-745596
dailyftlk	2023-02-22 21:22:08	Why not tax the informal rich rather than the formal poor?	23	18163552	1677081128.0	en	https://www.ft.lk/columns/Why-not-tax-the-informal-rich-rather-than-the-formal-poor/4-745595
virakesarilk	2023-02-22 17:51:00	அமைச்சுப் பதவி வகித்தால் அரசாங்கத்தின் பாடலை இசைக்கத்தான் வேண்டும்…!	21	d66789f1	1677068460.0	ta	https://www.virakesari.lk/article/148895
virakesarilk	2023-02-22 16:06:00	இன அடையாளத்தை பதிவது தொடர்பில் தெளிவற்ற நிலையிலிருக்கும் தரப்பினர்	26	51768745	1677062160.0	ta	https://www.virakesari.lk/article/148884
virakesarilk	2023-02-22 11:07:00	பல மாதங்களாக இரகசியமாக  திட்டமிடப்பட்ட பைடனின் உக்ரைன் விஜயம் - 10 மணித்தியால புகையிரத பயணம்- வெளியாகின விபரங்கள்	25	e659cabd	1677044220.0	ta	https://www.virakesari.lk/article/148822
virakesarilk	2023-02-22 10:59:00	தேர்தல் செயல்முறையும் ஓர் அத்தியாவசிய சேவையே!	1	b4192e3d	1677043740.0	ta	https://www.virakesari.lk/article/148814
lankadeepalk	2023-02-22 10:32:01	‘‘ඡන්දයක් තිබ්බොත් ආණ්ඩුවට ඇපත් නෑ‘‘	8	0e16390c	1677042121.0	si	https://www.lankadeepa.lk/news/‘‘ඡන්දයක්-තිබ්බොත්-ආණ්ඩුවට-ඇපත්-නෑ‘‘/101-629088
lankadeepalk	2023-02-22 10:32:01	‘‘ඡන්දයක් තිබ්බොත් ආණ්ඩුවට ඇපත් නෑ‘‘	8	c27ed463	1677042121.0	si	https://www.lankadeepa.lk/politics/‘‘ඡන්දයක්-තිබ්බොත්-ආණ්ඩුවට-ඇපත්-නෑ‘‘/13-629088
dailyftlk	2023-02-22 09:47:23	China has offered only two-year moratorium on debt repayments: Bandula	9	d3c182fc	1677039443.0	en	https://www.ft.lk/business/China-has-offered-only-two-year-moratorium-on-debt-repayments-Bandula/34-745591
dailyftlk	2023-02-22 09:47:07	Cabinet reviews progress of 261 large-scale development projects	7	8d6791c9	1677039427.0	en	https://www.ft.lk/business/Cabinet-reviews-progress-of-261-large-scale-development-projects/34-745590
dailyftlk	2023-02-22 09:42:02	Lankem continues growth trajectory into 3Q	18	589c650e	1677039122.0	en	https://www.ft.lk/business/Lankem-continues-growth-trajectory-into-3Q/34-745588
lankadeepalk	2023-02-22 09:28:38	අද අවශ්‍ය ඡන්දයද? ආර්ථිකයද?	18	e8431b95	1677038318.0	si	https://www.lankadeepa.lk/visheshanga/අද-අවශ්‍ය-ඡන්දයද--ආර්ථිකයද-/26-629082
lankadeepalk	2023-02-22 09:28:38	අද අවශ්‍ය ඡන්දයද? ආර්ථිකයද?	18	f18c4a92	1677038318.0	si	https://www.lankadeepa.lk/features/අද-අවශ්‍ය-ඡන්දයද--ආර්ථිකයද-/2-629082
lankadeepalk	2023-02-22 09:03:18	ගොවීන්ට මුදල් දීම පමා කළ නිලධාරින්ට දඬුවම් නැද්ද?	9	52e2cabb	1677036798.0	si	https://www.lankadeepa.lk/visheshanga/ගොවීන්ට-මුදල්-දීම-පමා-කළ-නිලධාරින්ට-දඬුවම්-නැද්ද-/26-629079
economynextcom	2023-02-22 08:40:00	Sri Lanka to present IMF deal to parliament: President	13	09925a13	1677035400.0	en	https://economynext.com/sri-lanka-to-present-imf-deal-to-parliament-president-113036/
bbccomsinhala	2023-02-22 07:02:08	සේවක විරෝධය හේතුවෙන් රජය අදායම් බදු ප්‍රතිපත්තිය ආපසු හරවයිද?	27	d0b8453f	1677029528.0	si	https://www.bbc.com/sinhala/articles/czd34q09vjwo
bbccomsinhala	2023-02-22 04:20:10	ජනාධිපතිවරයාට පාර්ලිමේන්තුව විසුරුවා හැරිය හැක්කේ කුමන අවස්ථාවකද?	59	868858f1	1677019810.0	si	https://www.bbc.com/sinhala/articles/cd1nx500531o
dailyftlk	2023-02-22 01:24:13	Country now under Kekille rule: Prof.Charitha Herath	8	f60189a1	1677009253.0	en	https://www.ft.lk/news/Country-now-under-Kekille-rule-Prof-Charitha-Herath/56-745575
dailyftlk	2023-02-22 01:22:46	NPP releases copyrighted font to combat political misinformation, distortions	13	acd85263	1677009166.0	en	https://www.ft.lk/news/NPP-releases-copyrighted-font-to-combat-political-misinformation-distortions/56-745574
dailyftlk	2023-02-22 00:49:18	Digital voting system a must for future poll: Sri Lanka Digital Citizen Association	8	3fbd446b	1677007158.0	en	https://www.ft.lk/news/Digital-voting-system-a-must-for-future-poll-Sri-Lanka-Digital-Citizen-Association/56-745572
dailyftlk	2023-02-22 00:48:27	People’s Convention on Good Governance on 25 Feb. at BMICH	8	809f5bd1	1677007107.0	en	https://www.ft.lk/news/People-s-Convention-on-Good-Governance-on-25-Feb-at-BMICH/56-745571
dailyftlk	2023-02-22 00:47:32	PM kicks off International Mother Language Day celebration	4	f0a69c4f	1677007052.0	en	https://www.ft.lk/news/PM-kicks-off-International-Mother-Language-Day-celebration/56-745570
dailyftlk	2023-02-21 23:18:45	Myths of money printing	34	d001ba4c	1677001725.0	en	https://www.ft.lk/columns/Myths-of-money-printing/4-745565
dailyftlk	2023-02-21 23:11:56	‘Boss lady’ Jayalalithaa had party members falling at her feet	48	3a52967f	1677001316.0	en	https://www.ft.lk/columns/Boss-lady-Jayalalithaa-had-party-members-falling-at-her-feet/4-745564
dailyftlk	2023-02-21 22:45:36	South Asia’s human capital is the resilience it needs	14	8436a694	1676999736.0	en	https://www.ft.lk/columns/South-Asia-s-human-capital-is-the-resilience-it-needs/4-745547
dailymirrorlk	2023-02-21 22:38:18	Death of Onesh Subasinghe:  If you don’t let me go, I will kill you - servant overhears Onesh’s wife	10	4bc7c69e	1676999298.0	en	https://www.dailymirror.lk/top_story/Death-of-Onesh-Subasinghe-If-you-dont-let-me-go-I-will-kill-you-servant-overhears-Oneshs-wife/155-254595
economynextcom	2023-02-21 22:26:00	Sri Lanka President to meet China Finance Minister for debt talks	19	14bddc50	1676998560.0	en	https://economynext.com/sri-lanka-president-to-meet-china-finance-minister-for-debt-talks-113031/
dailymirrorlk	2023-02-21 21:58:53	Elections and lessons from the past - EDITORIAL	18	cced6771	1676996933.0	en	https://www.dailymirror.lk/opinion/Elections-and-lessons-from-the-past-EDITORIAL/172-254584
dailymirrorlk	2023-02-21 21:57:37	Who wants elections now?	28	05b73ae1	1676996857.0	en	https://www.dailymirror.lk/opinion/Who-wants-elections-now/172-254583
dailymirrorlk	2023-02-21 21:52:12	IHP SLOTS Voting Intentions January 2023: NPP/JVP-SJB running neck-and-neck: No party dominates	17	194428c8	1676996532.0	en	https://www.dailymirror.lk/opinion/IHP-SLOTS-Voting-Intentions-January-2023-NPPJVP-SJB-running-neck-and-neck-No-party-dominates/172-254582
economynextcom	2023-02-21 20:16:00	Sri Lanka to crush illegally imported vehicle parts to be sold as scrap metal	8	34a8b78d	1676990760.0	en	https://economynext.com/sri-lanka-to-crush-illegally-imported-vehicle-parts-to-be-sold-as-scrap-metal-113026/
economynextcom	2023-02-21 17:15:00	Sri Lanka’s re-based national inflation eases to 53.2-pct in Jan 2023	7	c9047ea9	1676979900.0	en	https://economynext.com/sri-lankas-re-based-national-inflation-eases-to-53-2-pct-in-jan-2023-113009/
dailymirrorlk	2023-02-21 14:30:09	Parliament can be dissolved any time now	4	b82a9e29	1676970009.0	en	https://www.dailymirror.lk/top_story/Parliament-can-be-dissolved-any-time-now/155-254569
