newspaper_id	time_str	original_title	n_original_body_lines	hash	time_ut	original_lang	url
dbsjeyarajcom	2023-04-16 00:36:00	Sri Lanka After 75 Years of Independence has become a Failed State says Chandrika Kumaratunga;“We are incapable of managing the affairs of the state,” tates the Former Sri Lankan President	12	2e8822ec	1681585560.0	en	https://dbsjeyaraj.com/dbsj/?p=81739
dbsjeyarajcom	2023-04-15 00:45:00	TPA Leader Mano Ganesan  Moots Proposal to set up  a “Tamil Caucus ‘in  Parliament that would Enable  Tamil legislators to express the “collective desire” of the island’s Tamil speaking peoples.	18	6158bf20	1681499700.0	en	https://dbsjeyaraj.com/dbsj/?p=81735
dbsjeyarajcom	2023-04-15 00:36:00	Setting up a remote satellite receiving ground station system in Southern Sri Lanka  through a collaborative effort between  the Chinese Academy of Sciences and the University of Ruhuna Raises Security Concerns in India	17	bc75bbf0	1681499160.0	en	https://dbsjeyaraj.com/dbsj/?p=81733
dbsjeyarajcom	2023-04-14 02:22:00	Gathering Political Storm Threatens Sajith and the SJB	37	ac3cfb64	1681419120.0	en	https://dbsjeyaraj.com/dbsj/?p=81702
dbsjeyarajcom	2023-04-14 01:11:00	“Narendra Modi led BJP Govt Rewrites History in School Textbooks According to the “Hindutva”Vision of Reimagining India as a Purely Hindu land’; Muslim Contribution to India is being Expunged in History Books”-The Economist	12	12853adb	1681414860.0	en	https://dbsjeyaraj.com/dbsj/?p=81727
dbsjeyarajcom	2023-04-14 01:11:00	Lakshman Kadirgamar departed too early, with no lasting legacy penned in his own words, and no narrative whether fact or fiction to sit on library shelves for posterity	16	c6c26541	1681414860.0	en	https://dbsjeyaraj.com/dbsj/?p=81709
dbsjeyarajcom	2023-04-13 00:54:00	“Despite differences in political affiliation, ethnicity and religion, a fresh beginning is imperative to create a brighter future for us and our nation, in this New Year.”-President Ranil Wickremesinghe in his April New Year Message	6	7396106c	1681327440.0	en	https://dbsjeyaraj.com/dbsj/?p=81720
dbsjeyarajcom	2023-04-13 00:27:00	The Govt ought to abandon the Anti-Terrorism Bill (ATB)  and formulate a new law with the help of all stakeholders to replace the Prevention of Terrorism Act (PTA) – “The Island”	12	36e28ddb	1681325820.0	en	https://dbsjeyaraj.com/dbsj/?p=81723
dbsjeyarajcom	2023-04-09 03:33:00	SJV Chelvanayakam: Christian who Led the Predominantly Hindu  Tamils for Over 20 Years	59	56ee5901	1680991380.0	en	https://dbsjeyaraj.com/dbsj/?p=81672
dbsjeyarajcom	2023-04-09 00:45:00	Clauses 10 and 11 of the 2023 Anti-Terrorism Bill  are Clearly aimed at all media Including print, electronic and web-based.	23	b3443485	1680981300.0	en	https://dbsjeyaraj.com/dbsj/?p=81698
dbsjeyarajcom	2023-04-09 00:09:00	President Wickremesinghe States  he  is not in a rush to Take Opposition MPs into Govt as he has a Comfortable  majority in the House;  Ranil says Opposition MPs who want to Cross Over must do so voluntarily Without  Expecting Portfolios in Return	8	1dd499c0	1680979140.0	en	https://dbsjeyaraj.com/dbsj/?p=81693
dbsjeyarajcom	2023-04-07 00:54:00	Repealing the PTA is an urgent need. Unfortunately, the anti-terror law the Government intends as its replacement contains within it even greater potential for abuse.	30	954c379f	1680809040.0	en	https://dbsjeyaraj.com/dbsj/?p=81689
dbsjeyarajcom	2023-04-07 00:36:00	Samagi  Jana Balawegaya Leader Sajith Premadasa Meets Party MPs  and Tells them that he has heard a group of MPs including Harsha de Silva are talking to the President and Urges them to Stay Together in the SJB	6	39bd70f3	1680807960.0	en	https://dbsjeyaraj.com/dbsj/?p=81684
dbsjeyarajcom	2023-04-07 00:27:00	With IMF Boost, Ranil is Confident of Winning the 2024 Presidential Election	37	1da1a4b2	1680807420.0	en	https://dbsjeyaraj.com/dbsj/?p=81631
dbsjeyarajcom	2023-04-04 03:00:00	Sajith Premadasa  Tries Desperately to Keep Samagi Jana Balawegaya(SJB) Intact as many Party MPs Engage in Discussions With the Intention of Crossing Over to  President Ranil Wickremesinghe’s Government	12	9d53b96e	1680557400.0	en	https://dbsjeyaraj.com/dbsj/?p=81660
dbsjeyarajcom	2023-04-04 02:22:00	Lasantha Wickrematunge:  The Fearless Editor who Spoke Truth to Power	24	49bbf716	1680555120.0	en	https://dbsjeyaraj.com/dbsj/?p=80797
dbsjeyarajcom	2023-04-04 01:11:00	Lester James Peries and the  Double Gold Winning “Gamperaliya”	39	35478b47	1680550860.0	en	https://dbsjeyaraj.com/dbsj/?p=77241
dbsjeyarajcom	2023-04-04 00:09:00	New Bill Signed Into Law by US President Joe Biden may Prevent Ex-Sri Lanka President Gota Rajapaksa from Returning to his Home in California	16	4966fdea	1680547140.0	en	https://dbsjeyaraj.com/dbsj/?p=80875
dbsjeyarajcom	2023-04-02 02:22:00	JVP led National Peoples Power  Scents the Sweet Smell of Electoral Success.	25	c9aa23cb	1680382320.0	en	https://dbsjeyaraj.com/dbsj/?p=81614
dbsjeyarajcom	2023-04-01 00:09:00	If the Anti-Terrorism Bill passes the seal of Parliament as currently framed, Sri Lanka will pass from a de facto police state to a de jure police state. The political consensus must be to reject the Anti-Terrorism Bill wholesale.	33	9c549c5a	1680287940.0	en	https://dbsjeyaraj.com/dbsj/?p=81655
dbsjeyarajcom	2023-03-27 01:11:00	Is Jaffna booming, blooming or busting is the question that arises in the minds of those familiar with Jaffna’s heritage, historical background, culture and socioeconomic development patterns.	24	10b6b83c	1679859660.0	en	https://dbsjeyaraj.com/dbsj/?p=81648
dbsjeyarajcom	2023-03-23 03:33:00	“I had no power in Parliament. I had no MPs from my Party to call my own. Even though I had none of these, I had just one strength. This was my conviction that I was  capable of rebuilding my country. I accepted the challenge with the conviction that even if I failed, the country would not.”- President  Ranil Wickremesinghe	73	1f4be658	1679522580.0	en	https://dbsjeyaraj.com/dbsj/?p=81600
