newspaper_id	time_str	original_title	n_original_body_lines	hash	time_ut	original_lang	url
virakesarilk	2023-06-14 20:50:00	தொல்பொருள் இடங்களை பாதுகாக்கும்  நடவடிக்கையை இனவாத கோணத்தில் நோக்க வேண்டாம் - அகிலவிராஜ்	12	8ed09cc1	1686756000.0	ta	https://www.virakesari.lk/article/157724
adaderanalk	2023-06-14 20:43:00	SOC seeks advice from university lecturers regarding future plans related to media sector	5	1bd328d0	1686755580.0	en	https://www.adaderana.lk/news/91269/soc-seeks-advice-from-university-lecturers-regarding-future-plans-related-to-media-sector
virakesarilk	2023-06-14 20:40:00	புதிய தலைமையகக் கட்டடத் தொகுதியோடு முக்கிய மைல்கல் ஒன்றை வெலிபல் பினான்ஸ் எட்டியது	19	01fb7143	1686755400.0	ta	https://www.virakesari.lk/article/157712
virakesarilk	2023-06-14 20:37:00	வரலாறு தெரியாத புதிய தலைமுறையினரால் ராஜபக்ஷவுக்கு எதிர்ப்பு - பிரசன்ன ரணதுங்க	17	d1bf7c88	1686755220.0	ta	https://www.virakesari.lk/article/157732
virakesarilk	2023-06-14 20:35:00	கால்நடைகளிடையே தோல்கழலை நோய் தீவிரம் : ஜம்இய்யதுல் உலமாவுக்கு ஹலீம் அவசர கடிதம்	9	5a2337f9	1686755100.0	ta	https://www.virakesari.lk/article/157733
virakesarilk	2023-06-14 20:31:00	யாழில் இடம்பெறும் குற்றச்செயல்களை கட்டுப்படுத்த ஒத்துளைப்பு வழங்குங்கள் - இராணுவ கட்டளைத் தளபதியிடம் அரச அதிபர் கோரிக்கை	5	35351510	1686754860.0	ta	https://www.virakesari.lk/article/157734
virakesarilk	2023-06-14 20:30:00	ஜனாதிபதி தனித்து செயற்பட்டால் அவரை பின் தொடரமாட்டோம் - சனத் நிஷாந்த	10	808e7ca3	1686754800.0	ta	https://www.virakesari.lk/article/157735
virakesarilk	2023-06-14 20:28:00	5,500 பட்டதாரிகளுக்கு ஆசிரியர் நியமனம் - கல்வி அமைச்சு தீர்மானம்	10	db3d1bad	1686754680.0	ta	https://www.virakesari.lk/article/157736
virakesarilk	2023-06-14 20:27:00	விவசாய - வர்த்தக முயற்சியாண்மை பங்கேற்பு செயற்திட்டத்துக்கான உதவிகளை வழங்கத்தயார் - விவசாய அபிவிருத்திக்கான சர்வதேச நிதியம் உத்தரவாதம்	4	54e5d427	1686754620.0	ta	https://www.virakesari.lk/article/157737
dailymirrorlk	2023-06-14 20:21:20	Beware of buying whitening creams online: Dermatologist	5	11ab8ea9	1686754280.0	en	https://www.dailymirror.lk/breaking_news/Beware-of-buying-whitening-creams-online-Dermatologist/108-261101
adaderanalk	2023-06-14 19:50:00	Six youths arrested over ‘alcohol Dansala’ video on TikTok	6	0c307288	1686752400.0	en	https://www.adaderana.lk/news/91268/six-youths-arrested-over-alcohol-dansala-video-on-tiktok
adalk	2023-06-14 19:47:42	පතල් කැනීම් කාර්යාංශය කෝප් කමිටුවෙන් සමාව ඉල්ලයි	14	de78294e	1686752262.0	si	https://www.ada.lk/breaking_news/පතල්-කැනීම්-කාර්යාංශය-කෝප්-කමිටුවෙන්-සමාව-ඉල්ලයි/11-404111
virakesarilk	2023-06-14 19:39:00	பழைய பேருந்து நிலையம் வரை உள்ளூர் சேவைகள் ! கலந்துரையாடலில் தீர்மானம்!	11	13d46415	1686751740.0	ta	https://www.virakesari.lk/article/157718
virakesarilk	2023-06-14 19:34:00	அமெரிக்காவிடமிருந்து 46 மில்லியன் டொலர் பெறுமதியான அத்தியாவசிய மருந்துகள், மருத்துவ உகரணங்கள்	5	6f996270	1686751440.0	ta	https://www.virakesari.lk/article/157738
virakesarilk	2023-06-14 19:32:00	மஹா விகாரை தொடர்பாக ஜனாதிபதி தெரிவித்திருந்த கருத்தில் எந்த உண்மையும் இல்லை : குருந்து விஹாரை தலைமை தேரர் கலிகமுவே சந்தபோதி தேரர்	14	8bd07724	1686751320.0	ta	https://www.virakesari.lk/article/157739
adalk	2023-06-14 19:30:35	පබිලිස්ගේ ග්‍රන්ථයේ කතෘ පබිලිස් සිල්වාම බව ශ්‍රේෂ්ඨාධිකරණය කියයි	9	3c34bc98	1686751235.0	si	https://www.ada.lk/breaking_news/පබිලිස්ගේ-ග්‍රන්ථයේ-කතෘ-පබිලිස්-සිල්වාම-බව-ශ්‍රේෂ්ඨාධිකරණය-කියයි/11-404110
dailymirrorlk	2023-06-14 18:29:10	People now can apply for passports online	8	f229552c	1686747550.0	en	https://www.dailymirror.lk/breaking_news/People-now-can-apply-for-passports-online/108-261100
tamilmirrorlk	2023-06-14 18:24:31	ஓடிக்கொண்டிருந்த போது பற்றி எரிந்த மோட்டார் சைக்கிள்	4	6eeac202	1686747271.0	ta	https://www.tamilmirror.lk/வன்னி/ஓடிக்கொண்டிருந்த-போது-பற்றி-எரிந்த-மோட்டார்-சைக்கிள்/72-319203
tamilmirrorlk	2023-06-14 18:18:28	வீட்டின் இரும்பு படலை சிறுவனுக்கு எமனானது	4	1d00d15a	1686746908.0	ta	https://www.tamilmirror.lk/வன்னி/வீட்டின்-இரும்பு-படலை-சிறுவனுக்கு-எமனானது/72-319202
dailymirrorlk	2023-06-14 18:15:08	Over 5,000 graduate teachers will be absorbed to education sector soon: Minister	6	132d514f	1686746708.0	en	https://www.dailymirror.lk/breaking_news/Over-5-000-graduate-teachers-will-be-absorbed-to-education-sector-soon-Minister/108-261099
adalk	2023-06-14 18:11:45	බිළිඳියක් දරුකමට හදා ගැනිමට මුදලට ගත් අඹුසැමියන්ට අත්හිටවූ සිර දඬුවම්	7	4474a40b	1686746505.0	si	https://www.ada.lk/breaking_news/බිළිඳියක්-දරුකමට-හදා-ගැනිමට-මුදලට-ගත්-අඹුසැමියන්ට-අත්හිටවූ-සිර-දඬුවම්/11-404109
dailymirrorlk	2023-06-14 18:11:34	’Where were these experts four years ago to predict country’s economy reaching zero?’ asks Susil	10	e702c2be	1686746494.0	en	https://www.dailymirror.lk/breaking_news/Where-were-these-experts-four-years-ago-to-predict-countrys-economy-reaching-zero-asks-Susil/108-261098
dailymirrorlk	2023-06-14 18:05:19	US$ rate reaches Rs.300; in-depth study on vehicle imports stressed: Siyambalapitiya	6	da5be495	1686746119.0	en	https://www.dailymirror.lk/top_story/US-rate-reaches-Rs-300-in-depth-study-on-vehicle-imports-stressed-Siyambalapitiya/155-261097
adalk	2023-06-14 18:04:46	යාපනයේ සිට ගාල්ලට පයින් ගොස් ලෝක වාර්තාවක් තැබීමට සැරසෙන නිවුන් සොහොයුරන්	4	f4e0cb2b	1686746086.0	si	https://www.ada.lk/breaking_news/යාපනයේ-සිට-ගාල්ලට-පයින්-ගොස්-ලෝක-වාර්තාවක්-තැබීමට-සැරසෙන-නිවුන්-සොහොයුරන්/11-404108
adalk	2023-06-14 17:57:16	හිටපු මන්ත්‍රී පිරිසක් බිය ගැන්වීම අහසට වෙඩි තියයි	4	41f8bad3	1686745636.0	si	https://www.ada.lk/breaking_news/හිටපු-මන්ත්‍රී-පිරිසක්-බිය-ගැන්වීම-අහසට-වෙඩි-තියයි/11-404107
adaderanalk	2023-06-14 17:51:00	59 migrants dead, dozens feared missing after fishing vessel capsizes off Greece	11	02cf8572	1686745260.0	en	https://www.adaderana.lk/news/91267/59-migrants-dead-dozens-feared-missing-after-fishing-vessel-capsizes-off-greece
virakesarilk	2023-06-14 17:29:00	ஊவா - கிழக்கு ஆளுநர்களின் விசேட சந்திப்பு!	3	150841f9	1686743940.0	ta	https://www.virakesari.lk/article/157710
virakesarilk	2023-06-14 17:28:00	ஈழத்து திரைப்படம் ‘சபா’ ஞாயிறு கிளிநொச்சியில் திரையிடப்படுகிறது	3	831ea2c0	1686743880.0	ta	https://www.virakesari.lk/article/157728
tamilmirrorlk	2023-06-14 17:21:36	17 ஆண்டுக்கு பின் கடன் கேட்ட தம்பி மீது தாக்குதல்	4	86aee1e4	1686743496.0	ta	https://www.tamilmirror.lk/செய்திகள்/17-ஆண்டுக்கு-பின்-கடன்-கேட்ட-தம்பி-மீது-தாக்குதல்/175-319199
adalk	2023-06-14 17:15:03	සක්විතිගේ නීතිඥයින්ගේ තර්කයට මහාධිකරණ විනිසුරුගෙන් මූලික විරෝධයක්	10	17823a11	1686743103.0	si	https://www.ada.lk/breaking_news/සක්විතිගේ-නීතිඥයින්ගේ-තර්කයට-මහාධිකරණ-විනිසුරුගෙන්-මූලික-විරෝධයක්/11-404106
economynextcom	2023-06-14 17:15:00	Sri Lanka shares close at a near two month high on macroeconomic sentiments	15	5d34657a	1686743100.0	en	https://economynext.com/sri-lanka-shares-close-at-a-near-two-month-high-on-macroeconomic-sentiments-123476/
adalk	2023-06-14 17:09:51	පීතෘ නිවාඩු ලබාදීමට නව කම්කරු නීතියෙන් යොජනා	32	1cceb755	1686742791.0	si	https://www.ada.lk/breaking_news/පීතෘ-නිවාඩු-ලබාදීමට-නව-කම්කරු-නීතියෙන්-යොජනා/11-404105
adaderanalk	2023-06-14 17:09:00	Body of young teacher with cut wounds found in Matara	3	b38bea58	1686742740.0	en	https://www.adaderana.lk/news/91266/body-of-young-teacher-with-cut-wounds-found-in-matara
tamilmirrorlk	2023-06-14 17:03:51	பெண் ஒருவர் கழுத்தை அறுத்து கொடூர கொலை	5	01937535	1686742431.0	ta	https://www.tamilmirror.lk/செய்திகள்/பெண்-ஒருவர்-கழுத்தை-அறுத்து-கொடூர-கொலை/175-319198
virakesarilk	2023-06-14 17:03:00	மட்டக்களப்பில் கடனை திரும்பெற சென்ற தமையன் மீது தாக்குல்  ; 4 பேர் கைது	5	31307f20	1686742380.0	ta	https://www.virakesari.lk/article/157722
virakesarilk	2023-06-14 16:57:00	ஊருபொக்க பிரதேச பாடசாலையின் பெண் அபிவிருத்தி உத்தியோகத்தர் காதலனால் கழுத்தறுக்கப்பட்டு கொலை!	3	f7ac4aed	1686742020.0	ta	https://www.virakesari.lk/article/157723
virakesarilk	2023-06-14 16:55:00	ஐஸ் போதைப்பொருளுக்கு அடிமையாகிய இளைஞன் தற்கொலை ; மன்னாரில் சம்பவம்	3	4c06928d	1686741900.0	ta	https://www.virakesari.lk/article/157709
adalk	2023-06-14 16:54:49	ඩිල්ෂාන් මධුශංකට ඩොලර් 92000ක්	7	27352099	1686741889.0	si	https://www.ada.lk/sports/ඩිල්ෂාන්-මධුශංකට-ඩොලර්-92000ක්/9-404104
adalk	2023-06-14 16:54:49	චරිත් අසලංකට ඩොලර් 80000ක්	5	3dced5aa	1686741889.0	si	https://www.ada.lk/sports/චරිත්-අසලංකට-ඩොලර්-80000ක්/9-404104
adaderanalk	2023-06-14 16:54:00	Underworld figure “Booru Muna” remanded	6	f19c69c3	1686741840.0	en	https://www.adaderana.lk/news/91265/underworld-figure-booru-muna-remanded
virakesarilk	2023-06-14 16:52:00	566 கி.மீ. தூரத்தை 3 நாட்களில் நடந்து சென்று சாதனை படைக்கவுள்ள பொகவந்தலாவை இரட்டையர்!	5	d3af5c41	1686741720.0	ta	https://www.virakesari.lk/article/157716
tamilmirrorlk	2023-06-14 16:47:29	செந்தில் பாலாஜிக்கு 28 வரை சிறை	6	ee614dee	1686741449.0	ta	https://www.tamilmirror.lk/செய்திகள்/செந்தில்-பாலாஜிக்கு-28-வரை-சிறை/175-319197
newsfirstlk	2023-06-14 16:47:00	UNP led-alliance to contest next election	4	1c283e05	1686741420.0	en	https://www.newsfirst.lk/2023/06/14/unp-led-alliance-to-contest-next-election/
virakesarilk	2023-06-14 16:28:00	கற்பிட்டி பொலிஸ் பொறுப்பதிகாரியின் இடம் மாற்றத்திற்கு எதிராக ஆர்ப்பாட்டம்	4	bd427729	1686740280.0	ta	https://www.virakesari.lk/article/157714
virakesarilk	2023-06-14 16:26:00	குடியேற்றவாசிகளின் படகு கவிழ்ந்ததால் 59 பேர் பலி	2	1fe7c48c	1686740160.0	ta	https://www.virakesari.lk/article/157717
adaderanalk	2023-06-14 16:21:00	New online passport application system to be launched tomorrow	4	86d8367b	1686739860.0	en	https://www.adaderana.lk/news/91262/new-online-passport-application-system-to-be-launched-tomorrow
virakesarilk	2023-06-14 16:20:00	வவுனியாவில் குடிவரவு - குடியகல்வு பிராந்திய காரியாலயம் முன்பாக 5 பேர் கைது	3	60300265	1686739800.0	ta	https://www.virakesari.lk/article/157715
economynextcom	2023-06-14 16:16:00	Sri Lanka sells Rs180bn in T-bill auction, 6-month down 129bp	4	ed210e85	1686739560.0	en	https://economynext.com/sri-lanka-sells-rs180bn-in-t-bill-auction-6-month-down-129bp-123470/
adaderanalk	2023-06-14 16:11:00	Suspect arrested for hacking youth to death in Panadura	6	bae96aa4	1686739260.0	en	https://www.adaderana.lk/news/91261/suspect-arrested-for-hacking-youth-to-death-in-panadura-
tamilmirrorlk	2023-06-14 16:09:20	மாணவிகளை சீண்டிய ஆசிரியர் கைது	6	a05a83b9	1686739160.0	ta	https://www.tamilmirror.lk/செய்திகள்/மாணவிகளை-சீண்டிய-ஆசிரியர்-கைது/175-319195
virakesarilk	2023-06-14 16:09:00	பாணந்துறை கொலையாளி கதிர்காமத்தில் கைது !	4	1e6c1a31	1686739140.0	ta	https://www.virakesari.lk/article/157708
dailymirrorlk	2023-06-14 16:06:37	Gajendrakumar’s arrest is unequal treatment of individuals, communities: NPC	6	11407436	1686738997.0	en	https://www.dailymirror.lk/breaking_news/Gajendrakumars-arrest-is-unequal-treatment-of-individuals-communities-NPC/108-261095
adaderanalk	2023-06-14 15:54:00	Doctors raise concerns over rising dengue cases among children	7	fdd5ef8b	1686738240.0	en	https://www.adaderana.lk/news/91260/doctors-raise-concerns-over-rising-dengue-cases-among-children
tamilmirrorlk	2023-06-14 15:48:10	ஜனாதிபதியை சாடினார் தேரர்	3	49594ed2	1686737890.0	ta	https://www.tamilmirror.lk/செய்திகள்/ஜனாதிபதியை-சாடினார்-தேரர்/175-319192
tamilmirrorlk	2023-06-14 15:14:52	ஜோடி போட்டு திருடிய தம்பதி கைது	7	e3a5873a	1686735892.0	ta	https://www.tamilmirror.lk/செய்திகள்/ஜோடி-போட்டு-திருடிய-தம்பதி-கைது/175-319190
dailymirrorlk	2023-06-14 15:14:42	Pada Yatra pilgim trampled to death by jumbo	3	5650bc7d	1686735882.0	en	https://www.dailymirror.lk/breaking_news/Pada-Yatra-pilgim-trampled-to-death-by-jumbo/108-261094
dbsjeyarajcom	2023-06-14 15:13:00	Sangaree : The Tamil Leader Who Refused to  Kowtow Before   Tiger Tyranny.	59	0b68c6e0	1686735780.0	en	https://dbsjeyaraj.com/dbsj/?p=82109
virakesarilk	2023-06-14 15:02:00	இறுதிக்கட்ட படப்பிடிப்பில் சத்யராஜ் நடிக்கும் 'ஜாக்சன் துரை 2'.	5	c713668b	1686735120.0	ta	https://www.virakesari.lk/article/157706
virakesarilk	2023-06-14 15:00:00	தேர்தல்கள் ஆணைக்குழு பொது மக்களிடம் விடுத்துள்ள கோரிக்கை	9	96de4469	1686735000.0	ta	https://www.virakesari.lk/article/157705
virakesarilk	2023-06-14 15:00:00	பொலிஸ் நிலையங்களில் மரணங்கள் அதிகரிப்பு - இலங்கை சட்டத்தரணிகள்  சங்கம் கவலை	5	c4a812cf	1686735000.0	ta	https://www.virakesari.lk/article/157707
virakesarilk	2023-06-14 14:59:00	மணிப்பூரில் மீண்டும் வன்முறை : 9 பேர் சுட்டுக்கொலை	6	75ab08f2	1686734940.0	ta	https://www.virakesari.lk/article/157704
virakesarilk	2023-06-14 14:58:00	பொதுஜன பெரமுன தலைமையிலான கூட்டணியே ஆட்சியை கைப்பற்றும் - நாமல் ராஜபக்ஷ	9	01f71183	1686734880.0	ta	https://www.virakesari.lk/article/157698
virakesarilk	2023-06-14 14:57:00	தென்னிந்திய பழங்குடி இன மக்களின் வரலாற்றை சொல்லும் 'நாயாடி'	5	9a9d4163	1686734820.0	ta	https://www.virakesari.lk/article/157699
virakesarilk	2023-06-14 14:57:00	மட்டக்களப்பு அமிர்தகழியில் தச்சுத் தொழிலாளர்கள் இருவர் மின்சாரம் தாக்கி உயிரிழப்பு	3	d41d2da9	1686734820.0	ta	https://www.virakesari.lk/article/157701
virakesarilk	2023-06-14 14:56:00	உதயநிதி ஸ்டாலினின் 'மாமன்னன்' படத்திலிருந்து புதிய பாடல் வெளியீடு	4	e04484ea	1686734760.0	ta	https://www.virakesari.lk/article/157700
virakesarilk	2023-06-14 14:55:00	லியோ சிவக்குமார் நடிக்கும் 'அழகிய கண்ணே' முன்னோட்டம் வெளியீடு	6	70b95f49	1686734700.0	ta	https://www.virakesari.lk/article/157703
tamilmirrorlk	2023-06-14 14:38:55	“ஐஸ்”  உடன் நால்வர் கைது	3	97be8c9d	1686733735.0	ta	https://www.tamilmirror.lk/செய்திகள்/ஐஸ்-உடன்-நால்வர்-கைது/175-319188
virakesarilk	2023-06-14 14:37:00	மாணவிக்கு பாலியல் சீண்டல் ; ஆசிரியருக்கு விளக்கமறியல் - யாழ் தீவக பகுதியில் சம்பவம்	6	334aa8bf	1686733620.0	ta	https://www.virakesari.lk/article/157696
adaderanalk	2023-06-14 14:27:00	Sri Lankan Rupee significantly depreciates against USD	3	ee6afa6f	1686733020.0	en	https://www.adaderana.lk/news/91259/sri-lankan-rupee-significantly-depreciates-against-usd
dailymirrorlk	2023-06-14 14:24:49	Donate blood, saves lives	1	efbad2df	1686732889.0	en	https://www.dailymirror.lk/caption_story/Donate-blood-saves-lives/110-261093
dailymirrorlk	2023-06-14 14:22:20	Congestion in prisons gone up over 250%: COPA reveals	5	f094796d	1686732740.0	en	https://www.dailymirror.lk/breaking_news/Congestion-in-prisons-gone-up-over-250-COPA-reveals/108-261092
adaderanalk	2023-06-14 14:17:00	LIVE UPDATES : LPL 2023 Auction	10	fa4b3964	1686732420.0	en	https://www.adaderana.lk/news/91258/live-updates-lpl-2023-auction-
economynextcom	2023-06-14 14:15:00	Sri Lanka’s People’s bank ‘A(lka)’ rating confirmed with negative watch: Fitch	23	ce47e10a	1686732300.0	en	https://economynext.com/sri-lankas-peoples-bank-alka-rating-confirmed-with-negative-watch-fitch-123466/
virakesarilk	2023-06-14 14:11:00	பெண்கள் பயன்படுத்தும் முகப்பூச்சுகள் தொடர்பில் சுகாதாரத் திணைக்களம் அறிவுறுத்தல்!	4	7115cc87	1686732060.0	ta	https://www.virakesari.lk/article/157695
islandlk	2023-06-14 14:11:00	Softlogic Life launches Sri Lanka’s first-ever TV commercial powered by AI, featuring all-time music legends	7	879ee85c	1686732060.0	en	http://island.lk/softlogic-life-launches-sri-lankas-first-ever-tv-commercial-powered-by-ai-featuring-all-time-music-legends/
islandlk	2023-06-14 14:08:00	Dialog Enterprise enables digital transformation of MBSL with Dialog SD-WAN solution	10	1f1f3791	1686731880.0	en	http://island.lk/dialog-enterprise-enables-digital-transformation-of-mbsl-with-dialog-sd-wan-solution/
tamilmirrorlk	2023-06-14 13:58:12	கிழக்கு சுற்றுலாப் பணியகத்தின் தவிசாளராக மதன் பதவியேற்பு	1	8aeecef1	1686731292.0	ta	https://www.tamilmirror.lk/திருகோணமலை/கிழக்கு-சுற்றுலாப்-பணியகத்தின்-தவிசாளராக-மதன்-பதவியேற்பு/75-319186
tamilmirrorlk	2023-06-14 13:57:26	மீண்டும் டொலர் 300 ஐத் தாண்டியது	2	b8fc3fd0	1686731246.0	ta	https://www.tamilmirror.lk/செய்திகள்/மீண்டும்-டொலர்-300-ஐத்-தாண்டியது/175-319185
adalk	2023-06-14 13:54:02	රුපියල තවත් කඩා වැටෙයි	3	22cbb49d	1686731042.0	si	https://www.ada.lk/breaking_news/රුපියල-තවත්-කඩා-වැටෙයි/11-404103
economynextcom	2023-06-14 13:53:00	Sri Lanka’s Hatton National Bank ‘A(lka)’ rating confirmed with negative watch: Fitch	25	16d40ee2	1686730980.0	en	https://economynext.com/sri-lankas-hatton-national-bank-alka-rating-confirmed-with-negative-watch-fitch-123460/
adaderanalk	2023-06-14 13:47:00	110 million people forcibly displaced as Sudan, Ukraine wars add to world refugee crisis, UN says	13	052fb310	1686730620.0	en	https://www.adaderana.lk/news/91257/110-million-people-forcibly-displaced-as-sudan-ukraine-wars-add-to-world-refugee-crisis-un-says
adaderanalk	2023-06-14 13:42:00	BASL deeply concerned over recent surge in custodial deaths, criminal activity	10	9a45946e	1686730320.0	en	https://www.adaderana.lk/news/91256/basl-deeply-concerned-over-recent-surge-in-custodial-deaths-criminal-activity
dailymirrorlk	2023-06-14 13:26:00	Dengue claims two more lives	5	ff35f2af	1686729360.0	en	https://www.dailymirror.lk/breaking_news/Dengue-claims-two-more-lives/108-261091
dailymirrorlk	2023-06-14 13:17:21	ICC to limit overseas players at T20 franchise leagues: report	7	3365c75f	1686728841.0	en	https://www.dailymirror.lk/breaking_news/ICC-to-limit-overseas-players-at-T20-franchise-leagues-report/108-261090
virakesarilk	2023-06-14 13:17:00	இன்றைய நாணய மாற்று விகிதம்	2	c8862644	1686728820.0	ta	https://www.virakesari.lk/article/157691
virakesarilk	2023-06-14 13:13:00	தொல்பொருள் மரபுரிமைக்கு எதிரான ஜனாதிபதியின் செயற்பாட்டை பொதுஜன பெரமுன ஏற்குமா ? - கம்மன்பில	13	51251efe	1686728580.0	ta	https://www.virakesari.lk/article/157687
virakesarilk	2023-06-14 13:11:00	கிழக்கு மாகாண சுற்றுலா பணியகத்தின் தவிசாளராக மதன் கடமைகளை பொறுப்பேற்றார்	1	df8eef87	1686728460.0	ta	https://www.virakesari.lk/article/157684
virakesarilk	2023-06-14 13:06:00	ஆற்றை கடப்பதற்காக மொட்டுக் கட்சியினர் பயன்படுத்திய மரக்குற்றியே ஜனாதிபதி - அஜித் பி பெரேரா	9	f275b5c4	1686728160.0	ta	https://www.virakesari.lk/article/157688
virakesarilk	2023-06-14 13:04:00	ரயில் கடவையில் கவனக்குறைவாக பஸ்ஸை செலுத்திய சாரதி  கொலை முயற்சி குற்றச்சாட்டில் கைது!	3	035cf639	1686728040.0	ta	https://www.virakesari.lk/article/157682
