newspaper_id	time_str	original_title	n_original_body_lines	hash	time_ut	original_lang	url
adalk	2023-11-20 15:45:09	මාරාන්තික උපවාසය ඇමති මැදිහත්වීමෙන් නවතී	3	261dcc8d	1700475309.0	si	https://www.ada.lk/breaking_news/මාරාන්තික-උපවාසය-ඇමති-මැදිහත්වීමෙන්-නවතී/11-406736
virakesarilk	2023-11-20 15:41:00	இந்தியாவில் விசாகப்பட்டினம் துறைமுகத்தில் தீ விபத்து ; 40 படகுகள் எரிந்து நாசம்	4	01fcedc0	1700475060.0	ta	https://www.virakesari.lk/article/169785
adalk	2023-11-20 15:40:50	අයවැය ගැන මෛත්‍රීලාගේ තීරණය හෙට	6	a61d1ccd	1700475050.0	si	https://www.ada.lk/breaking_news/අයවැය-ගැන-මෛත්‍රීලාගේ-තීරණය-හෙට/11-406735
virakesarilk	2023-11-20 15:37:00	குழந்தை பருவத்தின் மெல்லிசைக்கு முன்பாக ஏவுகணைகளின் சத்தங்களை கற்றுக்கொள்ளும் காசா குழந்தைகள்	19	fc358cc3	1700474820.0	ta	https://www.virakesari.lk/article/169787
economynextcom	2023-11-20 15:34:00	Sri Lanka, Bangladesh Business Council launched	5	a577174b	1700474640.0	en	https://economynext.com/sri-lanka-bangladesh-business-council-launched-140794/
adaderanalk	2023-11-20 15:31:00	ADB backs future water supply projects in Sri Lanka	6	1d77018b	1700474460.0	en	https://www.adaderana.lk/news/95010/adb-backs-future-water-supply-projects-in-sri-lanka
adaderanalk	2023-11-20 15:23:00	Rising gold-backed loans elevate risks for Sri Lankan finance companies - Fitch	10	28d768bc	1700473980.0	en	https://www.adaderana.lk/news/95009/rising-gold-backed-loans-elevate-risks-for-sri-lankan-finance-companies-fitch
economynextcom	2023-11-20 15:20:00	Namal takes on opposition for supporting Sri Lanka’s 2019 tax cut	5	e5d93334	1700473800.0	en	https://economynext.com/namal-takes-on-opposition-for-supporting-sri-lankas-2019-tax-cut-140782/
virakesarilk	2023-11-20 15:13:00	தம்பலகாமம் பண்ணையாளர்கள் மேய்ச்சல் தரை இன்றி எதிர்கொள்ளும் சவால்கள்	7	ec9f5b63	1700473380.0	ta	https://www.virakesari.lk/article/169781
tamilmirrorlk	2023-11-20 15:06:23	ஞாயிறன்று சபை கூடுகின்றது	1	8eed60cf	1700472983.0	ta	https://www.tamilmirror.lk/செய்திகள்/ஞாயிறன்று-சபை-கூடுகின்றது/175-328321
adaderanalk	2023-11-20 15:05:00	Petition against SLC interim committee recalled on Wednesday	11	b561ef4e	1700472900.0	en	https://www.adaderana.lk/news/95008/petition-against-slc-interim-committee-recalled-on-wednesday
virakesarilk	2023-11-20 14:52:00	காட்டெருமை தாக்கி வயோதிபர் படுகாயம்	5	cd999681	1700472120.0	ta	https://www.virakesari.lk/article/169779
newsfirstlk	2023-11-20 14:50:00	Fake Medicine: Medical Supplies Division workers arrested	23	2a40887c	1700472000.0	en	https://www.newsfirst.lk/2023/11/20/fake-medicine-medical-supplies-division-workers-arrested/
economynextcom	2023-11-20 14:49:00	Sri Lanka must use court verdict to recover stolen assets: CBK	11	1da6bcca	1700471940.0	en	https://economynext.com/sri-lanka-must-use-court-verdict-to-recover-stolen-assets-cbk-140788/
virakesarilk	2023-11-20 14:44:00	ரயில் மிதிபலகையில் பயணித்த நால்வர் கொம்பனித் தெரு ரயில் நிலையத்துக்கு அருகில் சுவரில் மோதப்பட்டதில் காயம்!	2	0a964e0f	1700471640.0	ta	https://www.virakesari.lk/article/169777
newsfirstlk	2023-11-20 14:27:00	South & Central Sri Lanka among 24 best places to visit	7	7916bcdf	1700470620.0	en	https://www.newsfirst.lk/2023/11/20/south-central-sri-lanka-among-24-best-places-to-visit/
virakesarilk	2023-11-20 14:26:00	கிரிக்கெட்  இடைக்கால நிர்வாகக் குழுவுக்கு எதிரான மனு மீதான  விசாரணை 22 ஆம் திகதி!	2	ae7f4799	1700470560.0	ta	https://www.virakesari.lk/article/169775
virakesarilk	2023-11-20 14:15:00	யாழ். நவாலியில் துவிச்சக்கர வண்டியில் சென்ற முதியவர் மயங்கி விழுந்து உயிரிழப்பு	4	d478177a	1700469900.0	ta	https://www.virakesari.lk/article/169773
tamilmirrorlk	2023-11-20 14:14:04	தரமற்ற தடுப்பூசி: மேலும் நால்வர் கைது	1	4fa09662	1700469844.0	ta	https://www.tamilmirror.lk/செய்திகள்/தரமற்ற-தடுப்பூசி-மேலும்-நால்வர்-கைது/175-328316
virakesarilk	2023-11-20 14:11:00	ஸ்ரீரங்காவுக்கு பிணை வழங்குவதில் ஏற்பட்டுள்ள இழுத்தடிப்பு குறித்து கவனம் செலுத்த வேண்டும் : தயாசிறி, கஜேந்திரகுமார் சபாநாயகரிடம் கோரிக்கை	11	4f8cc102	1700469660.0	ta	https://www.virakesari.lk/article/169765
economynextcom	2023-11-20 14:09:00	High density cultivation system to increase tea yield by five times: Minister	8	7fb45d56	1700469540.0	en	https://economynext.com/high-density-cultivation-system-to-increase-tea-yield-by-five-times-minister-140777/
virakesarilk	2023-11-20 14:05:00	புத்தக விற்பனை நிலையத்தில் தாக்குதல் நடத்திய நபர் :  உரிமையாளர் உட்பட இருவர் காயம்!	4	f91625de	1700469300.0	ta	https://www.virakesari.lk/article/169772
tamilmirrorlk	2023-11-20 13:57:14	வட்டுக்கோட்டை பொலிஸ் நிலையத்திற்கு அதிரடிப் படை பாதுகாப்பு	4	31940c3c	1700468834.0	ta	https://www.tamilmirror.lk/செய்திகள்/வட்டுக்கோட்டை-பொலிஸ்-நிலையத்திற்கு-அதிரடிப்-படை-பாதுகாப்பு/175-328313
virakesarilk	2023-11-20 13:57:00	பாராளுமன்ற குழுக்கள் மற்றும் துறைசார் மேற்பார்வை குழுக்களுக்கு வெளியாட்களை அழைக்கும் போது எனது எழுத்து மூலமான அனுமதியை பெற வேண்டும் - சபாநாயகர் வலியுறுத்தல்	6	aa8cd388	1700468820.0	ta	https://www.virakesari.lk/article/169771
adaderanalk	2023-11-20 13:41:00	New Health Secretary assumes duties	6	de28ad98	1700467860.0	en	https://www.adaderana.lk/news/95007/new-health-secretary-assumes-duties
adaderanalk	2023-11-20 13:27:00	Director of Health Ministry’s MSD and three others arrested	7	69dd280d	1700467020.0	en	https://www.adaderana.lk/news/95006/director-of-health-ministrys-msd-and-three-others-arrested
adaderanalk	2023-11-20 13:09:00	COPE chairman vows to resign as MP if sexual bribery chargers are proven	4	8f6b453b	1700465940.0	en	https://www.adaderana.lk/news/95005/cope-chairman-vows-to-resign-as-mp-if-sexual-bribery-chargers-are-proven-
virakesarilk	2023-11-20 13:08:00	தங்க நகை அணியாததால் பெண்ணை தாக்கி விட்டு தப்பிச்சென்ற கொள்ளைக் கும்பல்	4	f87fa232	1700465880.0	ta	https://www.virakesari.lk/article/169758
tamilmirrorlk	2023-11-20 13:03:01	புத்தக கடைக்குள் கத்திக்குத்து: இருவர் காயம்	3	eb94b512	1700465581.0	ta	https://www.tamilmirror.lk/மேல்-மாகாணம்/புத்தக-கடைக்குள்-கத்திக்குத்து-இருவர்-காயம்/95-328309
newsfirstlk	2023-11-20 13:01:00	Paddy Farmers to be Trained on Sustainable Cultivation with FAO & EU support	10	397d325e	1700465460.0	en	https://www.newsfirst.lk/2023/11/20/paddy-farmers-to-be-trained-on-sustainable-cultivation-with-fao-eu-support/
newsfirstlk	2023-11-20 12:58:00	45 MOH divisions declared high-risk Dengue zones	5	9c12a244	1700465280.0	en	https://www.newsfirst.lk/2023/11/20/45-moh-divisions-declared-high-risk-dengue-zones/
adalk	2023-11-20 12:56:30	මහපොළ අරමුදලට වාර්ෂිකව රුපියල්  බිලියන 2ක පොලියක්	6	3d337cb6	1700465190.0	si	https://www.ada.lk/breaking_news/මහපොළ-අරමුදලට-වාර්ෂිකව-රුපියල්--බිලියන-2ක-පොලියක්/11-406734
tamilmirrorlk	2023-11-20 12:49:23	பாலியல் குற்றச்சாட்டு நிரூபிக்கப்பட்டால் பதவியை துறப்பேன்	3	910ea5ff	1700464763.0	ta	https://www.tamilmirror.lk/செய்திகள்/பாலியல்-குற்றச்சாட்டு-நிரூபிக்கப்பட்டால்-பதவியை-துறப்பேன்/175-328308
virakesarilk	2023-11-20 12:43:00	இன்றைய நாணய மாற்று விகிதம்	1	07bb6bbb	1700464380.0	ta	https://www.virakesari.lk/article/169763
virakesarilk	2023-11-20 12:43:00	அவுஸ்திரேலிய கப்பல் மாலுமிகள் மீது சீனாவின் போர்க்கப்பல் சோனார் தாக்குதல்	6	beac7a74	1700464380.0	ta	https://www.virakesari.lk/article/169762
newsfirstlk	2023-11-20 12:37:00	Four hospitalized after colliding with wall while travelling on train footboard	7	44b0b478	1700464020.0	en	https://www.newsfirst.lk/2023/11/20/four-hospitalized-after-colliding-with-wall-while-travelling-on-train-footboard/
tamilmirrorlk	2023-11-20 12:36:47	‘ஹலால்’  சான்று பெற்ற பொருட்களுக்கு தடை	6	18b424c3	1700464007.0	ta	https://www.tamilmirror.lk/செய்திகள்/ஹலால்-சான்று-பெற்ற-பொருட்களுக்கு-தடை/175-328306
virakesarilk	2023-11-20 12:36:00	நாட்டில் வர்க்க பேதமின்றி அனைவரையும் வாட்டிவதைக்கும் பொருளாதாரப்  பிரச்சினை !	1	9ca70326	1700463960.0	ta	https://www.virakesari.lk/article/169756
virakesarilk	2023-11-20 12:34:00	கந்தகெதர சென்ற பஸ்  தொழில்நுட்பக் கோளாறுக்கு உள்ளானபோது 1,000 அடி பள்ளத்தில் வீழாது சாதுரியமாக செயற்பட்ட சாரதி!	4	f8d37612	1700463840.0	ta	https://www.virakesari.lk/article/169760
newsfirstlk	2023-11-20 12:28:00	ADB backs future water supply projects in Sri Lanka	7	07e30aba	1700463480.0	en	https://www.newsfirst.lk/2023/11/20/adb-backs-future-water-supply-projects-in-sri-lanka/
tamilmirrorlk	2023-11-20 12:27:08	டெங்கு நோயாளர்களின் எண்ணிக்கை அதிகரிப்பு	5	67698df5	1700463428.0	ta	https://www.tamilmirror.lk/செய்திகள்/டெங்கு-நோயாளர்களின்-எண்ணிக்கை-அதிகரிப்பு/175-328304
adaderanalk	2023-11-20 12:05:00	Flood warning issued for low-lying areas of Deduru Oya extended	4	fd644161	1700462100.0	en	https://www.adaderana.lk/news/95004/flood-warning-issued-for-low-lying-areas-of-deduru-oya-extended
adalk	2023-11-20 12:03:32	ශ්‍රී පාදයට කුණු දැම්මොත් නාස්ති වෙන්නේ අපේ සල්ලි	4	97b47a7a	1700462012.0	si	https://www.ada.lk/breaking_news/ශ්‍රී-පාදයට-කුණු-දැම්මොත්-නාස්ති-වෙන්නේ-අපේ-සල්ලි/11-406733
economynextcom	2023-11-20 11:52:00	Sri Lanka beer battle to froth after Heineken purchase	13	87dca97b	1700461320.0	en	https://economynext.com/sri-lanka-beer-battle-to-froth-after-heineken-purchase-140740/
economynextcom	2023-11-20 11:51:00	Sri Lanka budget deficit illegal, fiscal rules should be relaxed: Harsha	11	b7e96aa2	1700461260.0	en	https://economynext.com/sri-lanka-budget-deficit-illegal-fiscal-rules-should-be-relaxed-harsha-140741/
adaderanalk	2023-11-20 11:48:00	SLC rejects Sports Minister’s allegations on ICC suspension	11	af2dd969	1700461080.0	en	https://www.adaderana.lk/news/95003/slc-rejects-sports-ministers-allegations-on-icc-suspension-
tamilmirrorlk	2023-11-20 11:45:45	பொலிஸாரின் சித்திரவதையால் இளைஞன் உயிரிழப்பு	9	ab97ca63	1700460945.0	ta	https://www.tamilmirror.lk/செய்திகள்/பொலிஸாரின்-சித்திரவதையால்-இளைஞன்-உயிரிழப்பு/175-328302
newsfirstlk	2023-11-20 11:38:00	Tourism : The lowest hanging fruit – Nishad Wijetunga on THE TALK OF THE TOWN	4	d7c724c4	1700460480.0	en	https://www.newsfirst.lk/2023/11/20/tourism-the-lowest-hanging-fruit-nishad-wijetunga-on-the-talk-of-the-town/
tamilmirrorlk	2023-11-20 11:32:51	நீர் வழங்கல் துறைக்கு ஆசிய அபிவிருத்தி வங்கி ஆதரவு	5	a19f9917	1700460171.0	ta	https://www.tamilmirror.lk/செய்திகள்/நீர்-வழங்கல்-துறைக்கு-ஆசிய-அபிவிருத்தி-வங்கி-ஆதரவு/175-328301
virakesarilk	2023-11-20 11:32:00	எயார் பஸ் 320 இல் 1,700 மணித்தியாலங்கள் விமானியாக பறந்த தமிழ் பெண் அர்ச்சனா	18	ccb6f3f4	1700460120.0	ta	https://www.virakesari.lk/article/169742
adaderanalk	2023-11-20 11:28:00	Speaker issues special statement on outsiders attending parliamentary committee meetings	9	b6578625	1700459880.0	en	https://www.adaderana.lk/news/95002/speaker-issues-special-statement-on-outsiders-attending-parliamentary-committee-meetings
adalk	2023-11-20 11:15:16	විමලසුරෙන්ද්‍ර වාන් දමයි, කාසල් රී පිටාර මට්ටමට අඟල් 6යි	2	1b72cc06	1700459116.0	si	https://www.ada.lk/breaking_news/විමලසුරෙන්ද්‍ර-වාන්-දමයි--කාසල්-රී-පිටාර-මට්ටමට-අඟල්-6යි/11-406732
adaderanalk	2023-11-20 10:57:00	India-bound ‘Israeli cargo ship’ seized by Yemen’s Houthi rebels	9	29dbc7ac	1700458020.0	en	https://www.adaderana.lk/news/95001/india-bound-israeli-cargo-ship-seized-by-yemens-houthi-rebels
tamilmirrorlk	2023-11-20 10:40:53	புலிகளின் சின்னங்களை பயன்படுத்தக் கூடாது	3	2f4e438c	1700457053.0	ta	https://www.tamilmirror.lk/செய்திகள்/புலிகளின்-சின்னங்களை-பயன்படுத்தக்-கூடாது/175-328299
tamilmirrorlk	2023-11-20 10:37:04	’’எனது அனுமதியின்றி அழைத்து வர வேண்டாம்”	3	1a7a5ef9	1700456824.0	ta	https://www.tamilmirror.lk/செய்திகள்/எனது-அனுமதியின்றி-அழைத்து-வர-வேண்டாம்/175-328298
economynextcom	2023-11-20 10:36:00	Sri Lanka CEB makes Rs18.2bn loss up to Aug amid controlled prices : FinMin	12	23641f0c	1700456760.0	en	https://economynext.com/sri-lanka-ceb-makes-rs18-2bn-loss-up-to-aug-amid-controlled-prices-finmin-140736/
adaderanalk	2023-11-20 10:32:00	Major flood warning issued for low-lying areas of Maha Oya	4	3eaf4c72	1700456520.0	en	https://www.adaderana.lk/news/95000/major-flood-warning-issued-for-low-lying-areas-of-maha-oya-
tamilmirrorlk	2023-11-20 10:30:56	சீனி தட்டுப்பாடு ஏற்பட வாய்ப்பே இல்லை	5	f1bf118c	1700456456.0	ta	https://www.tamilmirror.lk/செய்திகள்/சீனி-தட்டுப்பாடு-ஏற்பட-வாய்ப்பே-இல்லை/175-328296
virakesarilk	2023-11-20 10:25:00	இஸ்ரேலிய கொடியுடன் பயணிக்கும் கப்பல்களை தாக்கும் நடவடிக்கை  ஆரம்பம் - ஹெளத்தி கிளர்ச்சியாளர்கள் அறிவிப்பு - கப்பலொன்றையும் கைப்பற்றினர்	4	647630c0	1700456100.0	ta	https://www.virakesari.lk/article/169734
tamilmirrorlk	2023-11-20 10:12:58	எனக்கு அவர்கள் அச்சுறுத்தல் விடுத்தனர்;ரொஷான்	9	6dc2813c	1700455378.0	ta	https://www.tamilmirror.lk/செய்திகள்/எனக்கு-அவர்கள்-அச்சுறுத்தல்-விடுத்தனர்-ரொஷான்/175-328293
adaderanalk	2023-11-20 10:10:00	RDA Engineers to ‘report sick’ this week	4	b672f637	1700455200.0	en	https://www.adaderana.lk/news/94999/rda-engineers-to-report-sick-this-week-
tamilmirrorlk	2023-11-20 10:04:57	வருடத்திற்கு 5,000 சிறுவர்கள்... அதிர்ச்சி செய்தி	5	611c3e8f	1700454897.0	ta	https://www.tamilmirror.lk/செய்திகள்/வருடத்திற்கு-5-000-சிறுவர்கள்-அதிர்ச்சி-செய்தி/175-328291
economynextcom	2023-11-20 10:03:00	Sri Lanka rupee opens at Rs 327.90/328.20, bond yields stable	3	a30c0b77	1700454780.0	en	https://economynext.com/sri-lanka-rupee-opens-at-rs-327-90-328-20-bond-yields-stable-140724/
adalk	2023-11-20 09:59:13	පාසලේ කොන්ක්‍රීට් බැම්මක් කඩා වැටී සිසුවිය මැරුණාට විදුහල්පතිට පහරදුන් තිදෙනා අල්ලයි	3	28ff8c6f	1700454553.0	si	https://www.ada.lk/breaking_news/පාසලේ-කොන්ක්‍රීට්-බැම්මක්-කඩා-වැටී-සිසුවිය-මැරුණාට-විදුහල්පතිට-පහරදුන්-තිදෙනා-අල්ලයි/11-406731
tamilmirrorlk	2023-11-20 09:51:40	ஒழுக்கம் தவறினால் பதவி பறிபோகும்	6	07fb5c14	1700454100.0	ta	https://www.tamilmirror.lk/செய்திகள்/ஒழுக்கம்-தவறினால்-பதவி-பறிபோகும்/175-328290
newsfirstlk	2023-11-20 09:50:00	Rosalynn Carter, wife of former U.S. President Jimmy Carter, dies aged 96	10	6fefad3c	1700454000.0	en	https://www.newsfirst.lk/2023/11/20/rosalynn-carter-wife-of-former-u-s-president-jimmy-carter-dies-aged-96/
tamilmirrorlk	2023-11-20 09:40:07	பிற்பகல் 1 மணிக்கு பின்னர் இடியுடன் கூடிய மழை	8	4819c2fe	1700453407.0	ta	https://www.tamilmirror.lk/செய்திகள்/பிற்பகல்-1-மணிக்கு-பின்னர்-இடியுடன்-கூடிய-மழை/175-328289
bbccomsinhala	2023-11-20 09:40:06	ශතවර්ෂයක පටන් දිවයිනටම නුවණ බෙදන දැනුම් යාත්‍රාව	59	434ae1b5	1700453406.0	si	https://www.bbc.com/sinhala/articles/ckdpe8z1v7ko
tamilmirrorlk	2023-11-20 09:30:24	ஸ்ரீ லங்கா கிரிக்கெட் மனு இன்று விசாரணை	3	6a38ef8a	1700452824.0	ta	https://www.tamilmirror.lk/செய்திகள்/ஸ்ரீ-லங்கா-கிரிக்கெட்-மனு-இன்று-விசாரணை/175-328287
adalk	2023-11-20 09:27:55	මහ ඔය නිම්නයට ඉදිරි පැය 24දී විශාල ගංවතුරක් ගැන රතු නිවේදනයක්	3	46351366	1700452675.0	si	https://www.ada.lk/breaking_news/මහ-ඔය-නිම්නයට-ඉදිරි-පැය-24දී-විශාල-ගංවතුරක්-ගැන-රතු-නිවේදනයක්/11-406730
tamilmirrorlk	2023-11-20 09:27:02	நாட்டின் பல பகுதிகளுக்கு அபாய எச்சரிக்கை	8	6f433848	1700452622.0	ta	https://www.tamilmirror.lk/செய்திகள்/நாட்டின்-பல-பகுதிகளுக்கு-அபாய-எச்சரிக்கை/175-328286
newsfirstlk	2023-11-20 08:45:00	Roads in Giriulla inundated; flood advisory issued to many areas	15	89407faf	1700450100.0	en	https://www.newsfirst.lk/2023/11/20/roads-in-giriulla-inundated-flood-advisory-issued-to-many-areas/
economynextcom	2023-11-20 08:19:00	Argentina’s pro-dollarization Milei wins amid Sri Lanka style objections	21	56e1cdeb	1700448540.0	en	https://economynext.com/argentinas-pro-dollarization-milei-wins-amid-sri-lanka-style-objections-140670/
adaderanalk	2023-11-20 07:43:00	Fiery right-wing populist Javier Milei wins Argentina’s presidency	22	8df37899	1700446380.0	en	https://www.adaderana.lk/news/94998/fiery-right-wing-populist-javier-milei-wins-argentinas-presidency
adaderanalk	2023-11-20 07:36:00	Fairly heavy showers expected in several provinces	7	b477eaea	1700445960.0	en	https://www.adaderana.lk/news/94997/fairly-heavy-showers-expected-in-several-provinces
newsfirstlk	2023-11-20 06:21:00	Australia win ICC Cricket World Cup 2023 final against India	10	1fbb2f56	1700441460.0	en	https://www.newsfirst.lk/2023/11/20/australia-win-icc-cricket-world-cup-2023-final-against-india/
islandlk	2023-11-20 06:01:00	Meet the key people in-charge of Sri Lanka’s price stability and financial system stability	22	6c52b3d4	1700440260.0	en	http://island.lk/meet-the-key-people-in-charge-of-sri-lankas-price-stability-and-financial-system-stability/
economynextcom	2023-11-20 06:01:00	Sri Lanka Insurance profits Rs19.5bn up to Aug 2023 amid higher rates	7	c911a367	1700440260.0	en	https://economynext.com/sri-lanka-insurance-profits-rs19-5bn-up-to-aug-2023-amid-higher-rates-140665/
newsfirstlk	2023-11-20 05:54:00	Houthi rebels from Yemen seize Israeli-owned cargo ship in the Red Sea	9	b17c8f0b	1700439840.0	en	https://www.newsfirst.lk/2023/11/20/houthi-rebels-from-yemen-seize-israeli-owned-cargo-ship-in-the-red-sea/
newsfirstlk	2023-11-20 05:29:00	Facing worst economic crisis, Argentina elects radical candidate as president	7	d507530a	1700438340.0	en	https://www.newsfirst.lk/2023/11/20/facing-worst-economic-crisis-argentina-elects-radical-candidate-as-president/
bbccomsinhala	2023-11-20 03:10:21	'දෙලක්ෂ හැත්තෑදාහේ බෙහෙත ඕනා කියනකොට අපි ඔක්කොටම පිස්සු හැදිලා හිටියේ'	8	e734f937	1700430021.0	si	https://www.bbc.com/sinhala/articles/cj5pmrrm58do
tamilmirrorlk	2023-11-20 03:04:29	புதிய வரி செலுத்துபவர்கள் பதிவு	3	00efec14	1700429669.0	ta	https://www.tamilmirror.lk/செய்திகள்/புதிய-வரி-செலுத்துபவர்கள்-பதிவு/175-328283
tamilmirrorlk	2023-11-20 02:57:44	உள்ளூராட்சி ஊழியர்களுக்கு விரைவில் நியமனம்	2	a19736cc	1700429264.0	ta	https://www.tamilmirror.lk/செய்திகள்/உள்ளூராட்சி-ஊழியர்களுக்கு-விரைவில்-நியமனம்/175-328282
tamilmirrorlk	2023-11-20 02:54:33	மனிதப் புதைகுழி அகழ்வுப் பணி இன்று	2	559d7a01	1700429073.0	ta	https://www.tamilmirror.lk/செய்திகள்/மனிதப்-புதைகுழி-அகழ்வுப்-பணி-இன்று/175-328281
tamilmirrorlk	2023-11-20 02:51:49	காட்டெருமை தாக்கி வயோதிபர் காயம்	4	d46d7187	1700428909.0	ta	https://www.tamilmirror.lk/செய்திகள்/காட்டெருமை-தாக்கி-வயோதிபர்-காயம்/175-328280
dailyftlk	2023-11-20 00:18:42	Budget 2024 way forward towards fiscal and monetary policy constancy: Ravi K	14	87714aad	1700419722.0	en	https://www.ft.lk/news/Budget-2024-way-forward-towards-fiscal-and-monetary-policy-constancy-Ravi-K/56-755383
dailyftlk	2023-11-20 00:16:39	SJB MPs call for party reforms to ensure electoral win	6	14155c7b	1700419599.0	en	https://www.ft.lk/news/SJB-MPs-call-for-party-reforms-to-ensure-electoral-win/56-755382
