newspaper_id	time_str	original_title	n_original_body_lines	hash	time_ut	original_lang	url
lankadeepalk	2023-02-17 09:35:13	සාම්ප්‍රදායික කෘෂිකර්මයෙන් නවීනත්වයට යා යුතුමයි	11	f51067c4	1676606713.0	si	https://www.lankadeepa.lk/visheshanga/සාම්ප්‍රදායික-කෘෂිකර්මයෙන්-නවීනත්වයට-යා-යුතුමයි/26-628793
bbccomsinhala	2023-02-17 06:32:56	ජර්මනියේ ලෝක ප්‍රකට CTM සංගීත උළෙලේ 'හොඳ ම සංගීත පර්යේෂකයෙකු' ලෙස නම් කළ ඉසුරු කුමාරසිංහ සමග කතා බහක්	38	def7ce5f	1676595776.0	si	https://www.bbc.com/sinhala/articles/cg3yypwv1ldo
dailyftlk	2023-02-17 01:47:55	Future polls run risk of postponement on lack of funds claim: Former EC Chief	5	3d79fed1	1676578675.0	en	https://www.ft.lk/news/Future-polls-run-risk-of-postponement-on-lack-of-funds-claim-Former-EC-Chief/56-745417
dailyftlk	2023-02-17 01:47:13	Mujibur’s petition on LG polls fixed for consideration on 23 Feb.	6	d61db0f0	1676578633.0	en	https://www.ft.lk/news/Mujibur-s-petition-on-LG-polls-fixed-for-consideration-on-23-Feb/56-745416
dailyftlk	2023-02-17 01:46:18	President says Govt. will not be pressured by protests and sack anyone	9	a1a1a320	1676578578.0	en	https://www.ft.lk/news/President-says-Govt-will-not-be-pressured-by-protests-and-sack-anyone/56-745415
dailyftlk	2023-02-17 00:36:03	Liberal Youth Movement insists on elections	6	d487ff5d	1676574363.0	en	https://www.ft.lk/opinion/Liberal-Youth-Movement-insists-on-elections/14-745402
dailyftlk	2023-02-17 00:35:14	Sri Lankan crisis and urbanisation	19	de48a3f5	1676574314.0	en	https://www.ft.lk/columns/Sri-Lankan-crisis-and-urbanisation/4-745401
dailymirrorlk	2023-02-16 23:51:46	Onesh’s Brazilian wife had threatened him on several occasions in SL	11	17f0a957	1676571706.0	en	https://www.dailymirror.lk/breaking_news/Oneshs-Brazilian-wife-had-threatened-him-on-several-occasions-in-SL/108-254278
dailyftlk	2023-02-16 23:49:22	Chinese lending to Sri Lanka: A factual cum ‘reality’ check	58	c4b77d97	1676571562.0	en	https://www.ft.lk/columns/Chinese-lending-to-Sri-Lanka-A-factual-cum-reality-check/4-745392
dailymirrorlk	2023-02-16 23:26:17	Must hope got to have a colour? - EDITORIAL	9	7c84d778	1676570177.0	en	https://www.dailymirror.lk/opinion/Must-hope-got-to-have-a-colour-EDITORIAL/172-254275
dailymirrorlk	2023-02-16 23:23:17	Brain drain amidst anomie in Sri Lanka	22	03a9e3ed	1676569997.0	en	https://www.dailymirror.lk/opinion/Brain-drain-amidst-anomie-in-Sri-Lanka/172-254274
dailymirrorlk	2023-02-16 23:19:27	How Independent are the Independent Commissions?	18	ed893d97	1676569767.0	en	https://www.dailymirror.lk/opinion/How-Independent-are-the-Independent-Commissions/172-254273
dailymirrorlk	2023-02-16 16:38:49	Deep Jungle Music Festival: ’Tourism Ministry and other big wigs had approved it despite harm to environment’ - Activist	20	8ef4175b	1676545729.0	en	https://www.dailymirror.lk/breaking_news/Deep-Jungle-Music-Festival-Tourism-Ministry-and-other-big-wigs-had-approved-it-despite-harm-to-environment-Activist/108-254261
bbccomsinhala	2023-02-16 15:05:51	විදුලි ගාස්තු වැඩි කිරීම : ''ලාම්පු තෙල් ගන්නත් බෑ. ගොඩක් වෙලාවට කරුවලේ ඉන්නේ.''	21	a005f5d8	1676540151.0	si	https://www.bbc.com/sinhala/sri-lanka-64666768
bbccomsinhala	2023-02-16 14:12:12	13 වෙනි ව්‍යවස්ථා සංශෝධනය : දෙමළ ජනතාව ඉල්ලන දේශපාලන විසඳුම 13 ද?	25	f85950cc	1676536932.0	si	https://www.bbc.com/sinhala/articles/cl7jj101nwjo
lankadeepalk	2023-02-16 12:23:36	ජනාධිපති වෙන්න කළින් හිටිය ගෝඨාභය සහ ජනපති වුණාට පස්සේ ගෝඨාභය දෙන්නෙක්	19	aa56e680	1676530416.0	si	https://www.lankadeepa.lk/politics/ජනාධිපති-වෙන්න-කළින්-හිටිය-ගෝඨාභය-සහ-ජනපති-වුණාට-පස්සේ-ගෝඨාභය-දෙන්නෙක්/13-628745
virakesarilk	2023-02-16 11:16:00	Galaxy S23 மற்றும் S23 Ultra ஐ அறிமுகப்படுத்துவதில் மகிழ்ச்சியடைகிறது Samsung Sri Lanka	44	7032ebf8	1676526360.0	ta	https://www.virakesari.lk/article/148325
dailymirrorlk	2023-02-16 10:38:06	Gota leaves for China	4	0f275c3f	1676524086.0	en	https://www.dailymirror.lk/breaking_news/Gota-leaves-for-China/108-254239
lankadeepalk	2023-02-16 10:22:12	දේශපාලනය කැළඹූ හැට දෙකේ කුමන්ත්‍රණය	24	5bba402b	1676523132.0	si	https://www.lankadeepa.lk/visheshanga/දේශපාලනය-කැළඹූ-හැට-දෙකේ-කුමන්ත්‍රණය/26-628730
lankadeepalk	2023-02-16 09:59:09	විදුලිය නාස්ති බර ජනතාව පිට	25	2758387d	1676521749.0	si	https://www.lankadeepa.lk/visheshanga/විදුලිය-නාස්ති-බර-ජනතාව-පිට/26-628722
dailymirrorlk	2023-02-16 03:54:38	Some people are more than equal: How come Gota is still at large?	23	e1e37741	1676499878.0	en	https://www.dailymirror.lk/opinion/Some-people-are-more-than-equal-How-come-Gota-is-still-at-large/172-254205
dailymirrorlk	2023-02-16 03:46:12	“DigitAll”: Innovation, technology for gender equality	12	6880f139	1676499372.0	en	https://www.dailymirror.lk/opinion/DigitAll-Innovation-technology-for-gender-equality/172-254204
dailymirrorlk	2023-02-15 20:22:26	Electricity rates raised by 66%	2	e01dfd04	1676472746.0	en	https://www.dailymirror.lk/breaking_news/Electricity-rates-raised-by-66/108-254199
bbccomsinhala	2023-02-15 14:05:03	පළාත් පාලන මැතිවරණය 2023: තැපැල් ඡන්ද සලකුණු කිරීම දින නියමයක් නොමැතිව කල් දැමෙයි	82	d5aae7d4	1676450103.0	si	https://www.bbc.com/sinhala/articles/c2jpg2lgxkpo
virakesarilk	2023-02-15 13:28:00	நியாயப்பாடு இல்லாத ஒரு அரசாங்கத்தை ஜனாதிபதி தொடர விரும்புகிறார் என்ற எண்ணத்தை ஏற்படுத்தும் காரணிகள்	3	50def797	1676447880.0	ta	https://www.virakesari.lk/article/148259
dailymirrorlk	2023-02-15 12:56:06	US delegation in Sri Lanka for top level defence talks	7	e3d71736	1676445966.0	en	https://www.dailymirror.lk/breaking_news/US-delegation-in-Sri-Lanka-for-top-level-defence-talks/108-254185
lankadeepalk	2023-02-15 11:59:00	බලය බෙදීම.. උතුර නැංවීම.. සංහිඳියාව	12	3915d565	1676442540.0	si	https://www.lankadeepa.lk/features/බලය-බෙදීම---උතුර-නැංවීම---සංහිඳියාව/2-628659
lankadeepalk	2023-02-15 11:47:00	ගැබිනි මවුන්ගේ දීමනාව වැඩි කිරීම අගය කළයුත්තක්	7	10c2000f	1676441820.0	si	https://www.lankadeepa.lk/editorial/ගැබිනි-මවුන්ගේ-දීමනාව-වැඩි-කිරීම-අගය-කළයුත්තක්/117-628655
lankadeepalk	2023-02-15 11:47:00	ගැබිනි මවුන්ගේ දීමනාව වැඩි කිරීම අගය කළයුත්තක්	7	477e0a88	1676441820.0	si	https://www.lankadeepa.lk/features/ගැබිනි-මවුන්ගේ-දීමනාව-වැඩි-කිරීම-අගය-කළයුත්තක්/2-628655
bbccomsinhala	2023-02-15 03:26:15	රොටර්ඩෑම් සිනමා උළෙලේ දී ශ්‍රී ලංකාවේ නම බැබළවූ විසාකේස සහ ජගත්ගේ තිරයෙන් එහා අත්දැකීම්	35	4a93869c	1676411775.0	si	https://www.bbc.com/sinhala/articles/cglj5g2xneyo
dailymirrorlk	2023-02-14 20:53:12	Irked environmentalists demand venue change for ‘Deep Jungle fest’	20	bc70fdb5	1676388192.0	en	https://www.dailymirror.lk/news-features/Irked-environmentalists-demand-venue-change-for-Deep-Jungle-fest/131-254137
dailymirrorlk	2023-02-14 20:45:24	When everything goes 100% online…	18	0144a6a9	1676387724.0	en	https://www.dailymirror.lk/opinion/When-everything-goes-100-online/172-254135
dailymirrorlk	2023-02-14 20:39:18	Doctor or judge, jury and executioner…  - EDITORIAL	18	d691881c	1676387358.0	en	https://www.dailymirror.lk/opinion/Doctor-or-judge-jury-and-executioner-EDITORIAL/172-254134
dailymirrorlk	2023-02-14 16:14:03	Postal voting for LG polls postponed indefinitely	4	d2e532f7	1676371443.0	en	https://www.dailymirror.lk/top_story/Postal-voting-for-LG-polls-postponed-indefinitely/155-254124
bbccomsinhala	2023-02-14 10:54:13	පළාත් පාලන මැතිවරණය 2023 : හෙට තැපැල් ඡන්ද පත්‍රිකා නිකුත් කිරීමට නොහැකි බව මැතිවරණ කොමිසම කියයි	22	37e06189	1676352253.0	si	https://www.bbc.com/sinhala/sri-lanka-64636698
bbccomsinhala	2023-02-14 05:52:00	'ආදරය ගැන ටිකක් කතා කළත් Sex ගැන දෙමව්පියෝ ගුරුවරු කතා කරන්නෙම නැහැ'	26	ce400f71	1676334120.0	si	https://www.bbc.com/sinhala/articles/c72z72jn3p7o
bbccomsinhala	2023-02-14 05:02:03	අධ්‍යාපනය : වෛද්‍යවරයෙකු වීමට සිහින දකින කිසිදා පාසලකට නොගිය දරුවෙක්	24	cd581071	1676331123.0	si	https://www.bbc.com/sinhala/sri-lanka-64633872
dailymirrorlk	2023-02-14 03:27:39	Sri Lankan Tamils seek pruning of Governor’s powers	20	a83aedb0	1676325459.0	en	https://www.dailymirror.lk/opinion/Sri-Lankan-Tamils-seek-pruning-of-Governors-powers/172-254085
dailymirrorlk	2023-02-14 03:24:40	What kind of LG bodies do we need?	10	6c0795a8	1676325280.0	en	https://www.dailymirror.lk/opinion/What-kind-of-LG-bodies-do-we-need/172-254084
dailymirrorlk	2023-02-13 14:13:06	CID on standby to send team to Indonesia to probe billionaire Onesh Subasinghe’s murder	10	3a25d96a	1676277786.0	en	https://www.dailymirror.lk/top_story/CID-on-standby-to-send-team-to-Indonesia-to-probe-billionaire-Onesh-Subasinghes-murder/155-254055
dailymirrorlk	2023-02-13 13:07:40	Moneragala tremors could be a worrying factor if it repeats	6	659cd445	1676273860.0	en	https://www.dailymirror.lk/breaking_news/Moneragala-tremors-could-be-a-worrying-factor-if-it-repeats/108-254053
bbccomsinhala	2023-02-13 12:18:15	ප්‍රභාකරන් ජීවතුන් අතර සිටින බවට පළ. නෙඩුමාරන් කළ ප්‍රකාශය ශ්‍රී ලංකා යුධ හමුදාව ප්‍රතික්ෂේප කරයි	33	743757f7	1676270895.0	si	https://www.bbc.com/sinhala/sri-lanka-64626743
bbccomsinhala	2023-02-13 08:33:25	උතුරේත් - දකුණේත් ක්‍රියාකාරීන්ට ආණ්ඩුවට එරෙහිව උද්ඝෝෂණ කිරීමට අයිතියක් නැතිද?	36	b7126a55	1676257405.0	si	https://www.bbc.com/sinhala/articles/c3g3w79rn4vo
dailymirrorlk	2023-02-13 03:08:51	Tourism off to encouraging start as January income tops US$ 160mn	28	110078ec	1676237931.0	en	https://www.dailymirror.lk/breaking_news/Tourism-off-to-encouraging-start-as-January-income-tops-US-160mn/108-254023
dailymirrorlk	2023-02-13 02:23:09	How S.W.R.D surrendered to the power of the ‘saffron robes’	20	54f276a1	1676235189.0	en	https://www.dailymirror.lk/opinion/How-S-W-R-D-surrendered-to-the-power-of-the-saffron-robes/172-254010
dailymirrorlk	2023-02-11 17:44:48	President vows to implement development programs to restore strong economy of North	19	d6a58362	1676117688.0	en	https://www.dailymirror.lk/breaking_news/President-vows-to-implement-development-programs-to-restore-strong-economy-of-North/108-253984
lankadeepalk	2023-02-11 11:26:21	ගොඩින් බේරාගත යුතු ගල්අඟුරු අර්බුදය	6	057bb1f5	1676094981.0	si	https://www.lankadeepa.lk/features/ගොඩින්-බේරාගත-යුතු-ගල්අඟුරු-අර්බුදය/2-628449
lankadeepalk	2023-02-11 11:26:21	ගොඩින් බේරාගත යුතු ගල්අඟුරු අර්බුදය	6	18b75aaa	1676094981.0	si	https://www.lankadeepa.lk/editorial/ගොඩින්-බේරාගත-යුතු-ගල්අඟුරු-අර්බුදය/117-628449
dailymirrorlk	2023-02-10 10:15:48	Japanese giant Mitsubishi Corp. to wind up Lankan operations next month	8	7c35beda	1676004348.0	en	https://www.dailymirror.lk/breaking_news/Japanese-giant-Mitsubishi-Corp-to-wind-up-Lankan-operations-next-month/108-253906
dailymirrorlk	2023-02-09 19:21:18	Death of businessman Dinesh Schaffter: Aggrieved party highlights contradictions in postmortem report	3	3aa9ebd8	1675950678.0	en	https://www.dailymirror.lk/breaking_news/Death-of-businessman-Dinesh-Schaffter-Aggrieved-party-highlights-contradictions-in-postmortem-report/108-253866
dailymirrorlk	2023-02-08 21:48:51	’’Islandwide trade Union action cost Sri Lanka over Rs.1 bn’’ - Economists	11	a1a39632	1675873131.0	en	https://www.dailymirror.lk/breaking_news/Islandwide-trade-Union-action-cost-Sri-Lanka-over-Rs-1-bn-Economists/108-253802
dailymirrorlk	2023-02-08 15:23:19	Non-cash benefits exempted from PAYE tax for employees	3	449b508c	1675849999.0	en	https://www.dailymirror.lk/breaking_news/Non-cash-benefits-exempted-from-PAYE-tax-for-employees/108-253795
dailymirrorlk	2023-02-08 06:28:56	Sri Lankan graduates scamming Westerners via dating apps	4	bb9c5831	1675817936.0	en	https://www.dailymirror.lk/breaking_news/Sri-Lankan-graduates-scamming-Westerners-via-dating-apps/108-253755
dailymirrorlk	2023-02-07 19:04:36	Paris Club members express commitment to negotiate debt restructuring with Sri Lanka	2	9e56a3b6	1675776876.0	en	https://www.dailymirror.lk/breaking_news/Paris-Club-members-express-commitment-to-negotiate-debt-restructuring-with-Sri-Lanka/108-253724
dailymirrorlk	2023-02-07 15:15:53	Only Rs. 11 mn spent on Independence Day celebration: President’s Office	17	2f7bbbf5	1675763153.0	en	https://www.dailymirror.lk/breaking_news/Only-Rs-11-mn-spent-on-Independence-Day-celebration-Presidents-Office/108-253717
dailymirrorlk	2023-02-07 02:22:54	Indonesia launches probe into SL billionaire’s death	8	09c06787	1675716774.0	en	https://www.dailymirror.lk/breaking_news/Indonesia-launches-probe-into-SL-billionaires-death/108-253702
lankadeepalk	2023-02-04 13:33:30	නිදහස් දිනයේ නිදහසේ අරුත හරිහැටි තේරුම් ගනිමු	8	8713caab	1675497810.0	si	https://www.lankadeepa.lk/features/නිදහස්-දිනයේ-නිදහසේ-අරුත-හරිහැටි-තේරුම්-ගනිමු/2-628104
lankadeepalk	2023-02-04 13:33:30	නිදහස් දිනයේ නිදහසේ අරුත හරිහැටි තේරුම් ගනිමු	8	b44f0715	1675497810.0	si	https://www.lankadeepa.lk/editorial/නිදහස්-දිනයේ-නිදහසේ-අරුත-හරිහැටි-තේරුම්-ගනිමු/117-628104
virakesarilk	2023-02-04 10:41:00	Daraz ஊடாக கிடைக்கும் பொருளாதார சுதந்திரம்	25	1550a0ed	1675487460.0	ta	https://www.virakesari.lk/article/147401
lankadeepalk	2023-01-28 10:35:05	ජනවාර්ගික අර්බුදයට  ඉක්මන් විසඳුමක් ඕනෑ	6	193d3fec	1674882305.0	si	https://www.lankadeepa.lk/features/ජනවාර්ගික-අර්බුදයට--ඉක්මන්-විසඳුමක්-ඕනෑ/2-627685
lankadeepalk	2023-01-28 10:35:05	ජනවාර්ගික අර්බුදයට  ඉක්මන් විසඳුමක් ඕනෑ	6	81705024	1674882305.0	si	https://www.lankadeepa.lk/editorial/ජනවාර්ගික-අර්බුදයට--ඉක්මන්-විසඳුමක්-ඕනෑ/117-627685
lankadeepalk	2023-01-27 10:09:02	නව බදු ක්‍රමයෙන් බැටකන මධ්‍යම පන්තිය	8	1045acc9	1674794342.0	si	https://www.lankadeepa.lk/features/නව-බදු-ක්‍රමයෙන්-බැටකන-මධ්‍යම-පන්තිය/2-627628
lankadeepalk	2023-01-27 10:09:02	නව බදු ක්‍රමයෙන් බැටකන මධ්‍යම පන්තිය	8	ea67ede8	1674794342.0	si	https://www.lankadeepa.lk/editorial/නව-බදු-ක්‍රමයෙන්-බැටකන-මධ්‍යම-පන්තිය/117-627628
lankadeepalk	2023-01-21 10:55:27	සමස්ත සමාජය ගිලගත් නිමක් නැති ඝාතන රැල්ල	8	fc75831e	1674278727.0	si	https://www.lankadeepa.lk/features/සමස්ත-සමාජය-ගිලගත්-නිමක්-නැති-ඝාතන-රැල්ල/2-627291
lankadeepalk	2023-01-18 11:28:47	පාස්කු දිනයේ ප්‍රහාරයේ සත්පුද්ගල නඩු තීන්දුව	9	a4a8d965	1674021527.0	si	https://www.lankadeepa.lk/features/පාස්කු-දිනයේ-ප්‍රහාරයේ-සත්පුද්ගල-නඩු-තීන්දුව/2-627131
lankadeepalk	2023-01-15 12:38:13	විදුලි බිලෙන් උද්ගතවන ජනතාවගේ ජීවන ප්‍රශ්න	7	99e88930	1673766493.0	si	https://www.lankadeepa.lk/features/විදුලි-බිලෙන්-උද්ගතවන-ජනතාවගේ-ජීවන-ප්‍රශ්න/2-626924
lankadeepalk	2023-01-04 17:33:18	රටේ සමස්ත  කඩාවැටීමට හේතුව රාජපක්ෂවරුන්	24	16ef7eed	1672833798.0	si	https://www.lankadeepa.lk/politics/රටේ-සමස්ත--කඩාවැටීමට-හේතුව-රාජපක්ෂවරුන්/13-626339
lankadeepalk	2022-12-31 11:16:20	යස ඉසුරින් පිරුණු නව වසරක් උදාවේවා !	8	87d7cd8e	1672465580.0	si	https://www.lankadeepa.lk/features/යස-ඉසුරින්-පිරුණු-නව-වසරක්-උදාවේවා--/2-626068
lankadeepalk	2022-12-27 12:41:36	ගුරු-සිසු සබඳතාවලට හානි වන දඬුවම් එපා	7	ad277042	1672125096.0	si	https://www.lankadeepa.lk/features/ගුරු-සිසු-සබඳතාවලට-හානි-වන-දඬුවම්-එපා/2-625844
lankadeepalk	2022-12-27 12:04:47	ඉන්දියාවේදී කොටු වූ  ශ්‍රී ලංකා පාතාලය	7	b86edc09	1672122887.0	si	https://www.lankadeepa.lk/features/ඉන්දියාවේදී-කොටු-වූ--ශ්‍රී-ලංකා-පාතාලය/2-625839
lankadeepalk	2022-12-24 08:35:08	සමගියෙන් සමාදානයෙන් නත්තල අර්ථවත් කරමු	7	12a8bdd9	1671851108.0	si	https://www.lankadeepa.lk/features/සමගියෙන්-සමාදානයෙන්-නත්තල-අර්ථවත්-කරමු/2-625730
lankadeepalk	2022-12-23 11:10:42	කල් දැමූ පුංචි ඡන්දය තවත් කල් නොදමමු	6	a5a5604c	1671774042.0	si	https://www.lankadeepa.lk/features/කල්-දැමූ-පුංචි-ඡන්දය-තවත්-කල්-නොදමමු/2-625669
lankadeepalk	2022-12-22 10:18:12	යළිත් කළු මාසයකට ඉඩක් තියන්න එපා	7	53c31a7c	1671684492.0	si	https://www.lankadeepa.lk/features/යළිත්-කළු-මාසයකට-ඉඩක්-තියන්න-එපා/2-625606
lankadeepalk	2022-12-21 10:51:00	ඉදිකිරීම් අතරමග නතරකර මුදල් නාස්ති කිරීම	9	c6dbd03c	1671600060.0	si	https://www.lankadeepa.lk/features/ඉදිකිරීම්-අතරමග-නතරකර-මුදල්-නාස්ති-කිරීම/2-625561
lankadeepalk	2022-12-17 11:05:31	ආයෝජන එපා කරවන ශ්‍රී ලංකාවේ අනිසි තීරණ	8	f010f33a	1671255331.0	si	https://www.lankadeepa.lk/features/ආයෝජන-එපා-කරවන-ශ්‍රී-ලංකාවේ-අනිසි-තීරණ/2-625365
lankadeepalk	2022-12-10 12:44:59	මානව සංහතිය වනසන  අයිස් මත් රකුසා	6	5ac10ae8	1670656499.0	si	https://www.lankadeepa.lk/features/මානව-සංහතිය-වනසන--අයිස්-මත්-රකුසා/2-624992
lankadeepalk	2022-12-07 14:04:09	දිළිදු සහන වැඩ පිළිවෙළ තවත් පුළුල් කිරීමක් අවශ්‍යයි	7	3f0ea043	1670402049.0	si	https://www.lankadeepa.lk/features/දිළිදු-සහන-වැඩ-පිළිවෙළ-තවත්-පුළුල්-කිරීමක්-අවශ්‍යයි/2-624815
lankadeepalk	2022-12-03 09:34:07	ජනවාර්ගික ප්‍රශ්නයට දැන්වත් විසඳුමක් සොයමු	8	8b4a0c56	1670040247.0	si	https://www.lankadeepa.lk/features/ජනවාර්ගික-ප්‍රශ්නයට-දැන්වත්-විසඳුමක්-සොයමු/2-624586
lankadeepalk	2022-11-28 11:13:39	අරගල සහ මන්ත්‍රී කුමාර වෙල්ගමගේ යෝජනාව	10	abf92e5c	1669614219.0	si	https://www.lankadeepa.lk/features/අරගල-සහ-මන්ත්‍රී-කුමාර-වෙල්ගමගේ-යෝජනාව/2-624284
lankadeepalk	2022-11-26 10:42:01	ජනතා විශ්වාසය පළුදු කරන්න එපා	9	5654488f	1669439521.0	si	https://www.lankadeepa.lk/features/ජනතා-විශ්වාසය-පළුදු-කරන්න-එපා/2-624194
lankadeepalk	2022-11-19 11:11:17	කම්කරු ප්‍රතිපත්තිය යුගයට අනුරූප කරමු	10	9bafe8cf	1668836477.0	si	https://www.lankadeepa.lk/features/කම්කරු-ප්‍රතිපත්තිය-යුගයට-අනුරූප-කරමු/2-623746
lankadeepalk	2022-11-17 12:47:05	ජනපතිට සහය දෙනවා,  ඒත් කැබින්නටුවට යන්න බැහැ. - මනෝ ගනේශන්	23	54038664	1668669425.0	si	https://www.lankadeepa.lk/politics/ජනපතිට-සහය-දෙනවා---ඒත්-කැබින්නටුවට-යන්න-බැහැ----මනෝ-ගනේශන්/13-623612
lankadeepalk	2022-11-12 11:36:59	සල්ලිත් නෑ: පෝරත් නෑ වගකිවයුත්තෝ කවරහුද?	6	12fda3ed	1668233219.0	si	https://www.lankadeepa.lk/features/සල්ලිත්-නෑ:-පෝරත්-නෑ-වගකිවයුත්තෝ-කවරහුද-/2-623299
lankadeepalk	2022-11-05 16:12:31	සජිත් කරන්නේ සීනිබෝල දේශපාලනයක්	19	346a1272	1667644951.0	si	https://www.lankadeepa.lk/politics/සජිත්-කරන්නේ-සීනිබෝල-දේශපාලනයක්/13-622877
lankadeepalk	2022-11-05 09:48:13	ළමා කුසගිනි නිවීමට ප්‍රමුඛතාව දෙන්න ඕනෑ	9	fb59ec1c	1667621893.0	si	https://www.lankadeepa.lk/features/ළමා-කුසගිනි-නිවීමට-ප්‍රමුඛතාව-දෙන්න-ඕනෑ/2-622863
lankadeepalk	2022-11-02 10:28:51	රටම බලා සිටියදී පරිසර නීතිය කඩන්න ඉඩදිය හැකිද?	9	2e583b28	1667365131.0	si	https://www.lankadeepa.lk/features/රටම-බලා-සිටියදී-පරිසර-නීතිය-කඩන්න-ඉඩදිය-හැකිද-/2-622641
lankadeepalk	2022-10-29 09:28:19	මෙවැනි තිරිසන් ඝාතන මින් මතු ඇති නොවේවා	7	d67277a1	1667015899.0	si	https://www.lankadeepa.lk/features/මෙවැනි-තිරිසන්-ඝාතන-මින්-මතු-ඇති-නොවේවා/2-622397
lankadeepalk	2022-10-26 17:49:14	’’ආර්ථික ප්‍රශ්න එක්ක බැට කන මිනිස්සු පාරට ආවම එදාට වඩා දරුණු වේවි ’’ - සජබ පා.ම. මුජිබර් රහුමාන්.	22	afdf9a04	1666786754.0	si	https://www.lankadeepa.lk/videos/’’ආර්ථික-ප්‍රශ්න-එක්ක-බැට-කන-මිනිස්සු-පාරට-ආවම-එදාට-වඩා-දරුණු-වේවි-’’---සජබ-පා-ම--මුජිබර්-රහුමාන්-/12-622223
